body,title
"['Nicolás Cabré y la China Suárez tuvieron a Rufina, su hija, y a los pocos meses de su nacimiento se separaron. Pese a la ruptura de pareja, los actores se comprometieron a tener un buen vínculo por el bien de su pequeña, que actualmente tiene diez años.', 'Con el pasar de los años, cada uno rehizo su vida amorosa, incluso Eugenia tuvo dos hijos más pero con Benjamín Vicuña: Amancio y Magnolia quienes son medio hermanos de Rufina y tienen un vínculo familiar impecable, según constató la actriz.', 'Si bien Nicolás suele ser muy reservado con su vida privada, durante el último tiempo comenzó a mostrarse más suelto con la prensa, se hizo una cuenta de Instagram y desde ahí comparte contenido sobre su intimidad. En las últimas horas, tanto Cabré como Suárez mostraron imágenes junto a Rufina acompañándola en una actividad escolar.', 'Primero fue la actriz quien subió a su feed de Instagram, donde tiene más de seis millones y medio de seguidores, un compilado de fotos en el colegio de su hija. “Familia”, escribió junto a la primera foto donde está Cabré posando con Rufina y ella. También se la puede ver a Marcela, la mamá de la China quien asistió a la actividad y es abuela de la menor. En las imágenes está la pequeña abrazando a su papá y dándole un beso en la mejilla a su mamá.', 'Por su parte, Cabré también compartió más imágenes de la jornada para los más de 760 mil usuarios que lo siguen y le dedicó unas emotivas palabras para Rufina y Eugenia: “Secuencia de los abrazos por los que vivo y voy a vivir toda la vida. Familia”, remarcó feliz.', '“Nosotros tuvimos en claro desde el minuto uno que no había nada más importante que Rufina”, aseguró Cabré en una entrevista con Fernando Dente, conductor de Noche al Dente (América). “En definitiva, es lo único que importa acá... y esto se traspasa para todos: para Amancio, para Magnolia... ellos son lo único que importa. Después podés estar más o menos de acuerdo con algunas cosas pero eso es lo básico, es un acuerdo que tenemos claro”, agregó.', 'Además, admitió que tienen diferencias en la manera de pensar, sin embargo siempre logran un buen entendimiento: “A veces me querrá matar, a veces no, pero lo que nos importa es otra cosa: que nuestra hija esté bien”. Nicolás también se emocionó al hablar de la niña: “Ella es mi compañerita, la persona más especial del planeta. Está al lado mío siempre”.', 'Luego, Cabré dio detalles de su relación con Rufina: “Yo quiero estar y apoyarla en todo lo que hace. No me permito faltar a un acto o no estar presente cuando va, no sé, a natación. Es lo más importante de mi día. Ella me motiva a levantarme temprano, llevarla al colegio, esperarla, tomar la merienda con ella... todo eso me da la fuerza para ir al teatro a la noche y no tener que plantearme si soy feliz con lo que hago”.']",['La China Suárez y Nicolás Cabré acompañaron a su hija Rufina en una actividad escolar: “Familia”']
"['La Sede Administrativa de Escuelas Diocesanas (SAED) organizó un enriquecedor encuentro en la provincia de Santiago del Estero que congregó a más de 200 asistentes de diversas Instituciones Educativas. ', 'La jornada se abrió con una reflexión profunda a cargo del Padre Sergio Quinzio, asesor pastoral de los colegios del obispado, quien proporcionó un marco sobre la identidad católica del docente.', 'El evento contó con la destacada presencia de la experiencia educativa Ticmas, donde la especialista en educación y formadora de formadores, Laura Marinucci, brindó un taller en el que se exploraron las potencialidades del Aprendizaje Basado en Proyectos, para diseñar, planificar e implementar propuestas de enseñanza y aprendizaje significativas.', 'En la constante búsqueda de mejorar la calidad educativa, se han vuelto cada vez más relevantes los enfoques pedagógicos que estimulan la participación activa de los estudiantes, promueven el pensamiento crítico y despiertan la creatividad. En este contexto, el ABP se destaca como una metodología innovadora que transforma tanto la forma de enseñar como la forma de aprender.', 'El ABP pone a los estudiantes en el centro de su propio proceso de aprendizaje, alejándose de los enfoques tradicionales que abordan temas de manera aislada. En lugar de ello, involucra a los estudiantes en proyectos que requieren la aplicación de conocimientos y habilidades en situaciones de la vida real. Los docentes asumen el rol de facilitadores y guías, brindando apoyo cuando es necesario. Estos proyectos suelen ser colaborativos y multidisciplinarios, lo que refleja la complejidad de los desafíos que los estudiantes enfrentarán en la vida cotidiana y en sus futuras carreras.', 'Los beneficios del trabajo por proyectos son innegables, ya que estimulan la motivación intrínseca de los estudiantes al involucrarlos en situaciones significativas y auténticas que despiertan su interés. Esto se traduce en un mayor compromiso por parte de los estudiantes, fomentando una actitud que no solo promueve la comprensión profunda, sino también un aprendizaje que perdura a lo largo de toda la vida.', 'Sumado a esto, el ABP promueve el desarrollo de habilidades esenciales para el siglo XXI, tales como la resolución de problemas, la toma de decisiones, la comunicación efectiva y el trabajo en equipo. Estas habilidades son cruciales para el éxito tanto en la vida cotidiana como en el entorno laboral. Al desempeñar un papel activo en la planificación y ejecución de los proyectos, los estudiantes trabajan la autonomía y la autorregulación del aprendizaje es decir la habilidad de aprender a aprender. Esto les brinda la oportunidad de gestionar su propio proceso de aprendizaje, establecer metas y evaluar su progreso.', 'Durante el taller, los asistentes se involucraron activamente en la dinámica “Manos a la obra”, donde trabajaron con entusiasmo en la creación y planificación de proyectos ABP. En una instancia de puesta en común, no compartieron sus producciones: el Instituto Ntra. Sra. de la Salette propuso explorar la vida espiritual y la felicidad. El Inst. Laura Vicuña se centró en la pregunta de “¿Por qué Messi es campeón del Mundo?” con una mirada desde el producto final realizada con herramientas tecnológicas. El Instituto Nstra. Sra. de la Cons. de Sumampa trabajó en la concientización sobre la preservación y el cuidado de los árboles autóctonos a través de una campaña de concientización. El Colegio Nuestra Señora de Fátima se enfocó en acciones diarias para cuidar el medio ambiente. El Instituto Santiago Apóstol abordó el tema de las altas temperaturas en Santiago del Estero. El Inst. Juan XXIII promovió un consumo responsable. El Instituto San Cayetano exploró la empatía en la sociedad abordando la ataraxia. El Inst. María Auxiliadora creó una campaña de concientización sobre la reutilización de recursos y residuos domiciliarios. Los Institutos Superiores trabajaron en red en la construcción de un vivero forestal autóctono y campañas de concientización ambiental.', 'Los participantes destacaron la valiosa orientación del taller hacia sus necesidades de aprendizaje y mejora profesional. Comentaron que los aportes y las nuevas estrategias presentadas les abrieron oportunidades de crecimiento en su formación docente. Además, reconocieron que el ABP promueve la autonomía del estudiante y el trabajo colaborativo, lo que se traduce en un mayor compromiso y motivación. También hicieron hincapié en cómo este enfoque educativo estimula la creatividad.', 'Este evento en Santiago del Estero evidenció la importancia del ABP en el escenario educativo actual y su potencial para transformar la forma en que los estudiantes abordan el aprendizaje. La colaboración entre colegas y la inspiración para implementar proyectos ABP en sus instituciones dejaron una marca positiva en los asistentes. Con la mirada puesta en el futuro, el ABP se presenta como una herramienta valiosa para la educación en constante evolución.']",['Los docentes de Santiago del Estero se formaron en Aprendizaje Basado en Proyectos']
"['El público estalló: las bailarinas salieron a escena y después de una introducción por parte de la banda con 40 músicos en escena, Marco Antonio Solís pisó fuerte el escenario para iniciar lo que sería una noche de romanticismo y alegría, recalcando el atractivo indeleble que demuestra que sigue siendo el rey de la música romántica y el vínculo con el público argentino, que no deja de acompañarlo desde hace años.', 'El evento contó con una serie de elementos que contribuyeron a su éxito, desde una cuidada selección de vestuario hasta un grupo de músicos y bailarinas de alto calibre que acompañaron al artista en el escenario. El repertorio musical abarcó una amplia gama de emociones, desde temas románticos hasta canciones que invitaban al público a moverse al ritmo de la música.', 'El espectáculo comenzó con la interpretación de “No puedo olvidarla”, seguido de otros temas populares como “Dios bendiga nuestro amor” y “Ahora te vas”. Además, el multifacético artista ofreció una actuación emotiva al piano con la canción “Como me haces falta”, que arrancó suspiros entre los asistentes, quienes no dejaron de corear: “No quiero ver que mi vida se fue, y tu haciéndome falta”.', 'El ambiente se cargó de nostalgia cuando el artista interpretó “Tu Cárcel”, una canción que remontó al público a la época de Los Bukis, generando uno de los momentos más emotivos de la noche.', 'El evento, que tuvo una duración de más de dos horas y presentó un total de 22 temas, destacó por su alta calidad en la puesta en escena. El espectáculo forma parte de una serie de presentaciones programadas, de las que restan dos, los días 28 y 31 de octubre, en el marco de la gira internacional Buki World Tour 2023.', 'Cabe recordar que debido al furor por ver al reconocido músico, con casi cinco décadas y con más de 80 millones de discos vendidos a nivel mundial, es que a las dos funciones originalmente previstas, cuyas entradas se vendieron en dos horas, fue que luego se agregaron estas dos próximas actuaciones.', 'La habilidad y carisma de Marco Antonio Solís logran unir a seguidores de diversas generaciones que se congregan para disfrutar de su música. Este tour se posiciona como uno de los acontecimientos más relevantes del año en el ámbito musical de la Argentina.', 'Cabe recordar que la carrera musical de Marco Antonio Solís comenzó en 1970 cuando formó con su primo Joel Solís el grupo Los Hermanitos Solís. Al poco tiempo, del dueto nació el grupo Los Bukis. Los éxitos de este legendario grupo alcanzaron los primeros lugares de popularidad en varios países. Después de dos décadas, en 1995 Marco Antonio lanzó su primer disco en solitario “En pleno vuelo”, que en menos de una semana vendió más de medio millón de unidades, ocupando los principales lugares en las listas de Billboard en los Estados Unidos.', 'De esta manera, se convirtió en uno de los cantautores más reconocidos y solicitados en habla hispana. El nivel de afecto por parte del público es tanto que es el único artista latino en conseguir sold outs tanto en el Hollywood Bowl, el Madison Square Garden como en el Foro Sol o la Arena de la Ciudad de México. Además, más de 300 canciones de su autoría se han convertido en grandes éxitos interpretadas por figuras como Enrique Iglesias, Lila Downs, Olga Tañón, Pablo Montero, Rocío Dúrcal o Paulina Rubio.', 'Por la gran cantidad de logros obtenidos, Billboard lo nombró “Artista Latino de la década” en 2009 y le entregó el Premio Billboard a la Trayectoria Artística. A la lista de reconocimientos y premios que El Buki ha recibido a lo largo de su carrera se suman cinco Premios Grammy Latino; 18 Premios Lo Nuestro, incluyendo el Premio Lo Nuestro a la Excelencia; cuatro Antorchas de Plata, cuatro Antorchas de Oro, dos Gaviotas de Oro, y cinco Gaviotas de Plata, 16 Premios Furia Musical, 5 premios por temas de telenovelas.', 'En 2017 participó en la versión en español de la película ganadora del Oscar, Coco (Disney/Pixar), prestando su voz al personaje de Ernesto de la Cruz. Mientras que en 2019 el artista debutó en el icónico escenario del Hollywood Bowl de Los Ángeles, California, donde tuvo un histórico sold out reuniendo a más 17 mil espectadores que convirtieron este espectáculo en una de las noches más especiales y emotivas de la gira.']",['Marco Antonio Solís cautivó a su público con una fiesta de emociones']
"['Hace dos años Andrés Chaco Martínez sufrió un accidente vial que puso en pausa todos sus sueños. Desde muy chico se dedicó al deporte, y estaba listo para una competencia profesional de boxeo que sería el comienzo de su carrera. Con 18 años recién cumplidos, le diagnosticaron una lesión medular completa y le dijeron que a partir de ese momento su vida sería en silla de ruedas. La rehabilitación fue dura, pero de a poco volvió a entrenar y su constancia lo llevó a reinventarse como atleta adaptado y se convirtió en un referente. El fin de semana competirá en la categoría adaptive de una nueva edición de Southfit Challenge, el evento de crossfit que se disputa en La Rural desde el viernes 27 de octubre hasta el domingo 29, donde participan 1200 deportistas de nueve países.', 'La convocatoria es la más esperada en la región de Latinoamérica, y cada uno de los atletas que clasificaron se reúnen la Ciudad de Buenos Aires en búsqueda del triunfo. Vienen desde Uruguay, Chile, Paraguay, Brasil, Colombia, Venezuela, Costa Rica y Perú para ponerse a prueba durante tres jornadas, tanto a nivel individual como en desafíos en equipo. Para Andrés era impensado en octubre de 2021 cada uno de los logros que cosechó desde que conoció la combinación de ejercicios derivados de la gimnasia olímpica, el levantamiento olímpico de pesas y el entrenamiento funcional.', '“Algo dentro mío me decía que el deporte me iba a sacar adelante, que me iba a salvar, y no me equivoqué”, expresó en diálogo con Infobae. A los 2 años su madre lo llevó a natación y fue el inicio de una racha deportiva que no se detuvo ni siquiera cuando enfrentó la adversidad más grande. “Hasta los 10 seguí yendo a nadar, paralelamente hice básquet desde los 7 todos los fines de semana, y a los 13 empecé con kickboxing”, detalló. Luego de recibirse de instructor, incursionó en el boxeo, y encontró otra pasión en la que se imaginaba a largo plazo.', 'Un día nublado, que había lloviznado gran parte de la mañana, iba en su motocicleta rumbo al gimnasio cuando patinó a lo largo de 100 metros, cayó sobre el cordón y se golpeó con un auto que venía por la mano contraria. “Venía tratando de frenar desde hacía una cuadra, pero la moto se me iba, y una semana antes me habían hecho cambio de cubiertas; yo creo que me dieron unas cubiertas dibujadas y me dejaron los frenos estirados”, reveló sobre la discusión que mantuvo con el mecánico previo al accidente.', 'En ningún momento perdió el conocimiento, y luego de la caída sintió un dolor muy fuerte, y se dio cuenta de que había perdido la sensibilidad de la cintura para abajo. Ya en el hospital, los médicos le dijeron que iba a usar sonda permanente, que iba tener que recibir asistencia constante, y escuchó por primera vez el diagnóstico: lesión medular completa con paraplejia completa. “Fue demoledor, toqué fondo mil veces”, confesó sobre el shock que tuvo cuando comprendió la magnitud de lo que había pasado.', 'Después de recibir el alta volvió a su casa, en medio de las restricciones por la pandemia de coronavirus, por lo que se sintió más aislado que nunca de sus amistades, sus rutinas, y supo que la única forma de recuperar la motivación iba a ser retomar su trayectoria deportiva. Su exentrenador de kickboxing se convirtió en su instructor de crossfit, un mundo completamente nuevo para él, que se transformó en una segunda oportunidad. Seis meses más tarde pudo volver a estar de pie con el andador, algo que creía imposible. Luego vino el entrenamiento funcional, el levantamiento de pesas, y gracias a la disciplina y tenacidad que lo caracteriza, alcanzó metas semana tras semana.', 'Cuando cumplió un año de experiencia se animó a ir al Open Crossfit Games, el evento donde solo el top 5 de deportistas clasifica. “Fui pensando que iba a quedar en el puesto 30 con mucha suerte, y quedé en el siete, cuando la mayoría tiene más de seis años entrenando, así que fue una experiencia súper positiva que me permitió superar mis propios límites”, sostuvo. Luego viajó a la provincia de Santiago del Estero para participar de Freedom Battle 2023, una exposición de tres días de la que participaron 800 deportistas, una intensa vivencia que le sirvió como ensayo para presentarse en el gran evento Southfit Challenge, conocido como el “Mundial de Crossfit” por la relevancia que tiene en la región.', '“Implica un año entero de preparación, de días buenos y no tan buenos, y tuve que madurar demasiado rápido, pero entendí que no hay que quedarse con ganas de nada, hay que intentar como se pueda, con lo que tengas, que lo malo puede servir de impulso y que no existen las excusas si uno es fuerte mentalmente”, sostiene a horas de que comience la competencia. A su vez, el desafío de demostrar los resultados del trabajo incansable que asumió para llegar en las mejores condiciones posibles, lo motiva a superarse.', '“La voluntad y la fe son una combinación indestructible contra los peores pronósticos, y se suma el deporte, que a nivel físico y psicológico a mí me hizo mejorar mucho”, resalta. Venció muchos obstáculos, como entrenar con sillas de ruedas deportivas prestadas porque la suya no soportaba el peso durante los ejercicios, y tuvo que realizar colectas más de una vez para solventar los gastos previos a las competencias. Tampoco abandonó el boxeo, y sigue dando clases y entrenando a sus alumnos. Complementó su formación y hace masajes descontracturantes con ventosas para tener otro ingreso laboral.', 'Cada una de sus jornadas está llena de actividades que lo entusiasman, y no tiene dudas de que eligió el mejor camino para reconectarse con su esencia. “Siempre digo que hay que valorar lo simple, porque yo nunca pensé que iba a extrañar bañarme estando parado, algo que antes era parte de mi rutina de todos los días, y a veces uno se queja de más y no valora algo que parece tan trillado, pero que de verdad es lo más importante: la salud y la familia”, sentencia. Además formó una gran comunidad en Instagram -@chacomartinez_-, donde comparte cada uno de sus proyectos, e inspira a otros en cada uno de sus posteos.', 'Andrés tiene una meta a largo plazo aún más grande: representar a la Argentina en los CrossFit Games de Estados Unidos, pero por ahora está enfocado en ofrecer el mejor desempeño en Southfit Challenge. “Esta competencia desde el minuto cero me impulso a mi mejor versión, es un deporte súper completo para cualquiera, y estoy muy agradecido por todo lo que me enseña día tras día; fue un antes y un después, con aprendizajes y frustraciones, pero siempre están las ganas de dar todo de mí porque ese momento es una felicidad enorme”, asegura. Y agrega: “Siempre me gustó trabajar por lo mío, y me emociona cuando me dicen que quieren venir a entrenar conmigo, o me dan aliento con mensajes como: ‘Me das ganas de volver a luchar por mi sueño’; eso para mí ya es un montón”, dice agradecido por el apoyo que recibe a través de las redes sociales.', 'Desde el viernes 27 de octubre hasta el domingo 29 el predio ferial de La Rural será la sede de sus sueños, con jornadas que comienzan a las 7.30 de la mañana y culminan a las 20. Las entradas están a la venta en las boleterías del evento y a través de La Rural Ticket. Esta nueva edición ocupará 10.000 metros cuadrados, con circuitos distribuidos en el Pabellón Amarillo y Pista Central, y según anticiparon, se espera la concurrencias de más de 10.000 espectadores. Además de los desafíos físicos, el cronograma incluye clases abiertas al público y charlas guiadas por dos personalidades destacadas: Nora Edith Köppel, atleta olímpica en tres oportunidades y tricampeona mundial master; y el profesor de educación física Sergio Martín Parra, entrenador Olímpico en tres ocasiones, preparador físico Club Boca Juniors, y director ENADE Argentina (Escuela Nacional de Entrenadores).']",['Un accidente le impidió volver a caminar y competirá en el Mundial de Crossfit: “Soy mi mejor versión”']
"['La generación Z (personas que nacieron entre 1995 y 2010) está enfrentando problemas de salud mental en el centro laboral, lo que causa preocupación con respecto a su futuro. De acuerdo con una encuesta, casi la mitad de los jóvenes (46 %) siente estrés y ansiedad en el trabajo todo o la mayor parte del tiempo.', 'Estos datos fueron revelados en un informe de Deloitte que recopiló información sobre el trabajo y las condiciones de vida de más de 22 000 encuestados en 44 países entre noviembre y diciembre de 2022: 14.483 eran de la generación Z y 8.373 eran millennials (nacieron aproximadamente entre 1981 a 1994).', 'Por otro lado, la situación no parece ser mucho más prometedora para los millennials, quienes también informaron altos niveles de tensión laboral. El 39 % afirmó sentirse estresado o ansioso siempre o la mayor parte del tiempo durante su jornada laboral.', 'De acuerdo con el informe, los principales factores de estrés para estos grupos son su futuro financiero a largo plazo, sus finanzas diarias y la salud y bienestar de sus familias. Aspectos relacionados con la salud mental y el entorno laboral, como las altas cargas de trabajo, un balance inadecuado entre la vida personal y profesional, y las culturas de equipo negativas, también generan preocupaciones. Estas generaciones informan un incremento en los niveles de agotamiento debido a las tensiones laborales.', 'Las redes sociales tienen un impacto ambivalente en la salud mental de estas generaciones. Casi la mitad declara que su efecto es positivo, pero, por otro lado, más de 4 de cada 10 manifiestan que estas plataformas los hacen sentir solos o insuficientes, ejerciendo presión sobre ellos para mantener una presencia en línea constante.', 'La encuesta también reporta que el acoso en el lugar de trabajo es una gran preocupación, en particular para los jóvenes. Más de seis de cada 10 miembros de la generación Z (61 %) y cerca de la mitad de los millennials (49 %) han experimentado acoso en su centro laboral en los últimos 12 meses.', 'Estas estadísticas no son las únicas que causan asombro, pues también se complementan con un estudio de Oliver Wyman con más de 42.000 participantes de 26 países que evaluó las dimensiones mental, física, social y espiritual de la salud. Según los resultados, la mitad de los jóvenes (50 %) ha recibido apoyo para manejar problemas de salud mental, tales como ansiedad, depresión, trastorno de estrés postraumático, trastorno obsesivo-compulsivo, entre otros.', 'La encuesta reveló que la generación Z tiene 1.9 veces más posibilidades que otras generaciones de padecer trastornos de salud mental, con un 39 % de los participantes que han experimentado depresión en los últimos dos años y un 42 % que ha vivido ansiedad.', 'En conversación con Infobae, la doctora Silvia Ongini, médica psiquiatra infantojuvenil del Departamento de Pediatría del Hospital de Clínicas José de San Martín y presidenta de Centro de Prevención y Atención del Abuso Sexual en la Infancia y Adolescencia (CePasi), señaló cuáles son las cualidades de los jóvenes de la generación Z.', '“Las características que tienen es que, por un lado, son nativos digitales, es decir, que cuando nacieron ya todos los medios de comunicación estaban en uso y fueron los primeros usuarios de todas las redes sociales, con el impacto que tiene esto en la conformación de la socialización. También atravesaron un montón de circunstancias, en las que se vivieron hechos terribles, como el atentado a las Torres Gemelas o la pandemia, que la comunicación rápida y acelerada las impuso de otra manera en su cotidianidad”, mencionó.', 'Además, la especialista señaló que una problemática que los afecta está relacionada con la baja tolerancia a la frustración. “Precisamente, esta cuestión más meritocrática del esfuerzo y el trabajo para obtener los logros, o lo que era, entre comillas, considerado éxito en otras épocas, ahora en el posmodernismo, están devaluados y se buscan respuestas inmediatas. Esto incide claramente en una baja tolerancia a la frustración y también en una modificación de los estándares perseguidos como satisfacción o éxito”, indicó.']","['La mitad de los jóvenes siente estrés y ansiedad en el trabajo, según un informe internacional']"
