body,title
"['El financista Ivo Rojnica, alias “El Croata”, sospechado de regentear la mayor cueva financiera de la City porteña, este martes por la mañana fue detenido por el Departamento Contra El Crimen Organizado de la Policía de la Ciudad con la colaboración de la Policía Federal en el marco de una causa por lavado de dinero narco del Cartel de Sinaloa, investigada por el juez federal Federico Villena, con asiento en Lomas de Zamora.', 'Fuentes del caso aseguran que en el operativo, que incluyó 23 allanamientos en Capital Federal y en countries de la zona norte, también fue arrestado Federico Pulenta, otro histórico socio de Rojnica en diversas firmas del negocio financiero. Hay un tercer detenido, identificado como Agustín Estrada Palomeque, de 45 años, extranjero, empresario, señalado semanas atrás por discriminar a una trabajadora de Aerolíneas Argentinas según diversos medios.', 'Pulenta fue detenido en el barrio cerrado “El Encuentro”, en Benavídez. “El Croata” fue aprehendido en el barrio El Golf de Nordelta, donde se halló gran cantidad de documentación de interés para la causa. Mientras que Estrada Palomeque fue arrestado en su domicilio de Montevideo al 1800, en el barrio porteño de Retiro. ', 'Luego, los tres fueron trasladados a la División Crimen Organizado de la Policía de la Ciudad, en Barracas.', 'Por otra parte, la Aduana participó en varios procedimientos en oficinas satélite de Rojnica, ubicadas en el tercer piso de un edificio de Lavalle al 400, donde se encontraron gran cantidad de dinero y armas, entre ellas cinco pistolas -tres Glock, una con mira láser; una Bersa calibre .22 y una Walter- y dos revólveres Smith & Wesson calibre .38 Special.', 'También se conoció el video de la apertura de las cajas de seguridad privadas de Pilar que hicieron los policías que formaron parte del operativo, donde ve gran cantidad de dólares. ', 'El expediente por el que fue detenido, que comenzó en 2018, es un desprendimiento de la causa “Bobinas Blancas”, que investigó en 2017 la pista de un grupo de traficantes mexicanos y sus cómplices locales que conformaron una estructura local para exportar la droga oculta en cargamentos a destinos como Canadá y mover su dinero con una serie de empresas fantasma.', 'El caso comenzó tras el hallazgo 1375 kilos de cocaína dentro de ocho bobinas de acero en un galpón en el Parque Industrial de Bahía Blanca, junto a otros 486,28 kilos dentro de bolsas de arpillera hallados en un galpón en la localidad mendocina de Perdriel.', 'El expediente a cargo de Villena corre en paralelo al que investiga el Juzgado Federal N°8 a cargo de Marcelo Martínez de Giorgi y que tiene la megafinanciera Nimbus Group como blanco principal. Nimbus Group, cuyas oficinas ocupaban un piso entero en un edificio de la Avenida San Martín, fue allanada dos semanas atrás por la Aduana/AFIP y la PFA en medio de estrictos controles por la escalada del dólar libre. Allí, se encontró gran cantidad de documentación, computadoras y 15 máquinas de contar dinero.', 'Por otra parte, el reconocido abogado Gastón Marano, que representaba a Rojnica en el expediente que tramita en Comodoro Py, renunció ayer lunes a la defensa de “El Croata” al argumentar diferencias en la estrategia procesal. Marano no representaba a Rojnica en la causa investigada por Villena.', 'Semanas atrás, Martínez de Giorgí le había prohibido a Rojnica salir del país. Fuentes del caso aseguran que se investiga la ruta del dinero de Nimbus Group. Se sospecha de, al menos, tres agencias de viaje que vendían paquetes turísticos a extranjeros en dólares, con una compleja tramoya.', '“Se sospecha que se hacía facturar a varias personas, luego cambiaban el dólar billete a pesos y Nimbus se ocupaba de depositar los pesos en depósitos fraccionados de 15 a 19 millones por depósito. Con esto, la financiera se quedaría con la diferencia entre el dólar Qatar y el libre”, dijo un investigador.', 'Con respecto a “Bobinas Blancas”, en septiembre de 2021, el Tribunal Oral en lo Criminal Federal de Bahía Blanca condenó a siete integrantes de la banda con penas de entre 5 y 15 años de prisión.', 'Los jugadores mexicanos de la organización recibieron las penas más duras. Max Rodríguez Córdova fue sentenciado a 15 años, mientras que Jesús Madrigal Vargas y Gilberto Acevedo Villanueva recibieron ambos 14 años.', 'Rojnica y sus presuntos cómplices no son los primeros en ser investigados por la pista del narcolavado del caso. Emmanuel García, un broker de criptomonedas que convirtió 468 mil dólares de la banda en bitcoin, recibió 5 años de encierro en 2021.']",['Detuvieron a “El Croata” en una causa por lavado de dinero narco vinculada al Cartel de Sinaloa']
"['(HealthDay News) - Mientras pequeñas brujas, fantasmas y superhéroes recorren las calles en Halloween, es importante que los adultos mantengan su atención en la seguridad.', '“Siempre es mejor que un adulto acompañe a los niños pequeños cuando salen a pedir dulces”, dijo la Dr. Sadiqa Kendi, jefa de medicina de emergencia pediátrica en el Boston Medical Center y portavoz de la Academia Americana de Pediatría.', '“A menudo, tu ciudad o distrito parque ofrecerá actividades de Halloween más temprano durante el día para que puedas evitar salir después del anochecer. Los niños mayores deberían viajar en grupos y crear un “sistema de compañeros para llevarse a casa de manera segura y evitar caminar solos”, dijo Kendi en un comunicado de prensa de la academia.', 'El grupo de pediatras sugiere que los propietarios mantengan los caminos hacia la puerta bien iluminados y libres de obstáculos como bicicletas o mangueras de jardín que puedan hacer tropezar a los niños.', 'Además:', '- Los conductores deben tener especial cuidado el 31 de octubre, especialmente entre las 5:30 y las 9:30 p.m.', '- Los padres deben asegurarse de que los zapatos les queden bien y que los disfraces sean lo suficientemente cortos para moverse sin tropezar.', '- Los sombreros y máscaras deben ajustarse adecuadamente para que no se deslicen sobre los ojos y bloqueen la visión.', '- Añadir cinta reflectante a los disfraces y bolsas para pedir dulces.', '- Es más seguro permanecer en calles bien iluminadas.  Siempre use la acera y los cruces peatonales. Nunca cruce entre autos estacionados o salga de las entradas.', '- Si no hay acera, manténgase cerca del borde de la carretera, de frente al tráfico. No atraviese patios ni use callejones.', 'Aproximadamente el 62% de las muertes de niños peatones ocurren a mitad de la cuadra, en lugar de en las intersecciones, señala la academia. “Los padres a menudo se preocupan por los dulces contaminados en Halloween, pero los autos y el tráfico son realmente la mayor preocupación”, dijo Kendi. “Mantengamos los sustos al mínimo y disfrutemos de este Halloween.”', '- Solo vaya a hogares con una luz en el porche e idealmente, un camino bien iluminado.', '- No asuma que los peatones tienen el derecho de paso. Los conductores pueden tener problemas para verle. Incluso si un automóvil se detiene, otros pueden no hacerlo.', '- Los padres no deben enviar mensajes de texto o escuchar música mientras piden dulces con sus hijos.', '- Si sus hijos mayores salen con amigos, hágales acordar una hora específica para regresar a casa.', '- Consiga linternas con baterías para todos. Permítales llevar un teléfono celular para una comunicación rápida.', '- Si su adolescente es lo suficientemente mayor para conducir, considere firmar el Acuerdo de Conducción entre Padres y Adolescentes de la AAP, disponible en línea.', 'Más información. Safe Kids Worldwide tiene más sobre consejos de seguridad en Halloween.', 'FUENTE: Academia Americana de Pediatría, comunicado de prensa, 3 de octubre de 2023.', '*Cara Murez. Health Day Reporters © The New York Times 2023']",['Desde disfraces al tráfico: recomendaciones de expertos para un Halloween sin sobresaltos']
"['El papa Francisco autorizó la promulgación del decreto del milagro de Mama Antula y en unos días firmará el decreto que la convertirla, así, en la primera santa argentina. El decreto de la congregación de las Causas de los Santos tiene fecha del 24 de octubre de 2024. Dice: “Durante la audiencia concedida el martes por la tarde a su eminencia reverendísima el Sr. Cardenal Marcello Semeraro, prefecto del dicasterio de las causas de los santos, el Sumo Pontífice ha autorizado al mismo dicasterio a promulgar el decreto relativo al milagro atribuido a la intercesión de la beata María Antonia de San José (Antonia de Paz y Figueroa), conocida como Mama Antula, fundadora de la Casa de Ejercicios Espirituales de Buenos Aires; nacida en 1730 en Silípica, en Santiago del Estero (Argentina) fallecida el 7 de marzo de 1799 en Buenos Aires (Argentina)”.', 'La ceremonia de canonización se realizará en la Plaza San Pedro a comienzos del próximo año, según fuentes del Vaticano. Ya había sido beatificada en 2016 en Santiago del Estero, su tierra natal, luego de que el Papa aprobara la publicación de un milagro por la sanación de una religiosa de las Hijas del Divino Salvador.', 'El Vaticano la describió como “laica consagrada, fundadora de la Casa de Ejercicios de Buenos Aires y llamada Mama Antula por el pueblo”. Luego de la expulsión de los jesuitas del país, caminó más de 4.000 kilómetros a pie descalza por todo el virreinato para continuar con el legado a pesar de la prohibición. Su misión era visitar las regiones pobres del nordeste argentino para promover los ejercicios espirituales”. “En sólo ocho años, consiguió ofrecer los ejercicios espirituales a setenta mil personas”, afirma un portal del Vaticano.', 'El milagro de canonización tiene como protagonista a Claudio Perusini, cuya historia personal resulta extraordinaria debido los lazos que lo unen a las personas involucradas. En primer lugar, el protagonista es un ex alumno del Papa. Y no se trata de un alumno más, ya que con el tiempo pasó a ser un gran amigo de Bergoglio. El primer encuentro entre ambos tuvo lugar en Santa Fe, cuando Perusini acompañó a un sacerdote hasta esa ciudad. Bergoglio, que por entonces era superior de los jesuitas, los recibió a todos con mucha cordialidad y los invitó a comer a su casa. Perusini guardó de manera imborrable el recuerdo de Bergoglio cocinando para el grupo una tortilla de papa.', 'Desde ese momento, Claudio decidió entrar en el Seminario de la Compañía de Jesús. En los primeros años del noviciado, a final de los años setenta, era el cocinero. Él recuerda que todos los sábados y domingos el profesor Bergoglio lo ayudaba a cocinar, esa era una pasión que los unía. Bergoglio era, además, su confesor y director espiritual. Sin embargo, la relación entre los dos no fue fácil: tenían discusiones que llegaban hasta la pelea, con un lenguaje un poco subido de tono. Todo eso ocurría porque Claudio quería ser sacerdote, pero Bergoglio no veía en él los atributos necesarios. De hecho, le decía: “No sos para esto. Tenés que ser feliz. Y acá no lo vas a ser”. Se peleaban porque Perusini insistía y quería seguir adelante. Entonces Bergoglio lo palmeaba y le decía: “Andate. Yo te voy a bautizar a los chicos”. Jorge Bergoglio le marcó el camino y Claudio tomó su propia decisión: se fue a un lugar de la Patagonia, se casó con María Laura y tuvieron dos hijos.', 'Durante 2017, mientras Claudio se encontraba en Santa Fe por una cuestión familiar, tuvo un accidente cerebrovascular que lo dejó en estado vegetativo. Podía permanecer así el resto de su vida o morir. Para los médicos, no existía una tercera posibilidad. Pero un amigo jesuita llevó a la clínica una estampita de Mama Antula y empezó a rezarle pidiendo un milagro. De repente, su condición se revirtió, y Claudio recuperó todas sus funciones vitales. Esta sanación que no tiene explicación médica fue considerada un posible milagro.', 'El 13 de abril de 2018, en Santa Fe, monseñor Arancedo les tomó juramento a las personas designadas para llevar adelante la investigación canónica de esta curación y el 18 de diciembre se cerró el proceso con una misa de Acción de Gracias. Los sobres lacrados con los documentos del supuesto milagro fueron enviados a Roma para la evaluación de la Junta Médica y de la Comisión para las Causas de los Santos.', 'El papa Francisco, que es el encargado de dar el veredicto final, fue una figura indispensable en todo este proceso. Es quien puede hacer santa a la mujer que rezó y trabajó para que el legado jesuita no muriera. Mama Antula pedía constantemente el regreso de la Compañía de Jesús. Y la orden resplandeció con su máximo brillo con la elección del primer papa jesuita de la historia.']",['El papa Francisco aprobó un milagro de Mama Antula y se convertirá en la primera santa argentina']
"['El adolescente de 14 años que confesó haber asesinado a Joaquín Sperani, su amigo y compañero del colegio de la localidad cordobesa de Laboulaye, fue liberado en las últimas horas, luego de que una abogada solicitara que quede bajo el cuidado de sus padres.', 'La medida, de carácter provisorio, fue ordenada por el juez Sebastián Moro, a cargo del Juzgado Control de Niñez, Adolescencia, Penal Juvenil, Violencia Familiar, Género y Faltas de Laboulaye. El magistrado dispuso que el menor se reintegre a su familia en una residencia ubicada en otra ciudad, lejos de donde ocurrió el crimen.', 'El juez Moro, además, estableció que el adolescente se incorpore a un tratamiento multimodal psicoterapéutico, individual, grupal y familiar de tiempo prolongado.', 'Mariela Flores, la mamá de Joaquín, repudió la medida y se quejó ante la prensa local: “La Justicia está tomando decisiones que no son correctas”. “Nunca existieron los derechos para Joaquín. Mató y salió como si nada”, aseguró.', 'El adolescente imputado estaba alojado en el Centro de Admisión y Diagnóstico (CAD), que depende del Complejo Esperanza de la ciudad de Córdoba, donde enfrentó diversas pericias psicológicas y psiquiátricas.', 'Tras el rechazo de un habeas corpus, la asesora letrada con funciones múltiples de Laboulaye, Mariana Noelia Ferreyra, presentó ante el Tribunal Superior de Justicia de Córdoba un recurso de casación, que acompañó el abogado Raúl Palacios, para pedir el “cese de la privación de su libertad y que sea restituido a sus progenitores”.', 'El abogado fundamentó el planteó a partir de un fallo que TSJ emitió el 25 de septiembre pasado, que insta a los jueces penales juveniles a que “busquen otras alternativas distintas a la internación” para el tratamiento de los casos de los menores que cometen delitos y que, por su edad, no son punibles.', 'Joaquín Sperani, también de 14 años, desapareció el 29 de junio luego de dejar su bicicleta en el patio de la escuela IPEM 278 “Malvinas Argentinas”, de Laboulaye, a la que asistía. Nunca ingresó a clases.', 'En cambio, las cámaras de seguridad de la zona lo registraron cuando caminaba por la vereda del colegio acompañado por uno de sus amigos y compañero de escuela, el mismo que días después confesó el crimen.', 'El domingo 2 julio pasado, el cuerpo de la víctima fue hallado por vecinos en una vivienda abandonada ubicada a 100 metros de la escuela. Poco más tarde, el imputado fue detenido luego de admitir que lo había atacado, aunque dijo que no había sido su intención matarlo.', 'El chico “hizo un relato en donde admite que participó solo, que no hubo participantes, que todo sucedió a partir de una fuerte discusión, que tomó un fierro y le pegó en la cabeza”, según resumió un vocero judicial.', 'La autopsia determinó que el cuerpo de Joaquín tenía múltiples golpes en la cabeza que le ocasionaron politraumatismo de cráneo y daño encefálico que derivó en su muerte.', 'A principios de octubre, el Ministerio de Educación de la provincia de Córdoba apartó al equipo directivo del colegio “para profundizar la investigación administrativa que lleva adelante” esa cartera y “para garantizar el clima institucional”.', 'Mientras tanto, surgió una nueva pista que incrimina al amigo de la víctima. En un allanamiento a la casa del homicida se encontró un oso de peluche que tenía adentro un papel oculto en el cual se lee el apellido Sperani, el nombre de otro niño y la frase “mamá pronto se olvidará de esto”. La familia de Joaquín cree que el otro adolescente podría haber sido la siguiente víctima.', 'Tras el hallazgo, Mariela, la madre de la víctima, apuntó contra los padres del menor acusado: “Hoy los pongo como cómplices porque, ¿qué es eso de no ver el fierro que trajo en la mochila, de no ver la ropa y las zapatillas manchadas de sangre, de no ver el celular de Joaquín?”.']",['El adolescente de 14 años que confesó el crimen de Joaquín Sperani fue liberado: “Mató y salió como si nada”']
"['El pasado sábado 14 de octubre, Ricardo Iorio y su banda subieron al escenario del Anfiteatro Municipal de Rosario, en Santa Fe, con el objetivo de concluir su gira denominada Unas estrofas más. Casi uno de los últimos temas en un show que duró poco más de una hora y media interpretó el clásico “A vos, amigo”; aquel en el que deja en claro que “es mía la suerte de poder cantar esto que mando. Agradecido a vos arquetipo del nunca aflojar, leal y gamba. Amigo, fundido estoy con vos”.', 'Pero antes de entonarla, expresó unas palabras que hoy se resignifican: “Espero haberlos complacido y, reitero, tal vez sea la última vez que nos veamos porque la gente se muere. Ustedes se van a morir, hijos de puta. A mí me quedan muchas balas todavía, unas tres, cuatro”, señaló desde el escenario fiel a su estilo. Es que el intérprete ya estaba pensando en los próximos pasos, como su nuevo disco de estudio, después de casi siete años.', 'El inicio de la jornada rosarina estuvo a cargo del trío musical Vencer o morir, que directamente abrió su presentación con el tema “Momento de Luchar”, originalmente interpretado por la banda V8. Luego subió Impuros, grupo que hizo referencia a figuras icónicas del género como Pantera con su tema A new level”, además de una versión hardcore de “Desterrando a los oscurantistas de Hermética”, otra de las bandas de las que fuera Iorio líder indiscutido.', 'Con la llegada de la noche, a las 22 como estaba previsto, el referente del metal pesado argento tomó el escenario para interpretar “Hoy es”, una canción que sirvió como una suerte de reencuentro con el público. Vestido con ropa estilo camuflado, hablador como de costumbre, con una lista de temas que no defraudó y varias reflexiones fue pasando la noche, con frases que hoy se leen de otra manera. “No te mueras nunca”, le gritaron del público. “Si no me muero nunca me quedo sin amigos, hermano. De lo que sí estoy seguro es que no voy a ser el cadáver más sano del cementerio. Prefiero ser un reloco que un recuerdo”, reflexionó.', 'Pero sin dudas uno de los puntos más altos estuvo cuando invitó al escenario a la guitarrista Carina Alfie, quien se acopló a la banda en un par de temas como “Guitarrera”, el hit que abre su cuarto álbum solista, para luego interpretar “Justo que te vas” y su letra profética: “Justo que te vas llega esta canción como un adiós de remate. Sueño que la guardes en tu corazón, como en el mío, yo te guardo a vos”.', 'Pasada una hora y media desde su arribo al escenario, y sin la realización de bises, Ricardo Iorio abandonó el tablado dejando igualmente a un público conforme por verlo en escena. Y ansioso por conocer el nuevo material, ese trabajo que lo tenía entusiasmado y que ya había dado a conocer algunas canciones.', 'Sobre ese punto, quien se mostró conmocionado fue Juanchi Baleirón, músico, productor discográfico y amigo personal del exlíder de Almafuerte, quien aseguró: “No lo puedo creer… veníamos charlando cada tanto. Estaba lleno de proyectos giras… en noviembre iba a grabar el disco nuevo, no lo puedo creer”, para luego continuar sobre esa última conversación: “Retomamos una charla de anécdotas Super buena onda, con energía, con ganas, con proyectos, no lo puedo creer”.', 'El último mensaje recibido por Baleirón fue el lunes 23 de octubre a las 23:25. Más tarde, llegaría un comunicado del Hospital Municipal Raúl Caccavo, de Coronel Suárez: “En el día de hoy, martes 24 de octubre, a las 6:51 horas se recibió un llamado de emergencia con solicitud de ambulancia al domicilio rural del señor Iorio”. El músico murió camino al hospital.']",['“Tal vez sea la última vez que nos veamos porque la gente se muere”: las palabras de Ricardo Iorio a su público durante su último recital']
"['Después de los resultados de las elecciones generales, Leandro Santoro, candidato a jefe de Gobierno porteño por Unión por la Patria (UP), tomó la decisión de no competir en el balotaje del 19 de noviembre. De esta manera, Jorge Macri, candidato de Juntos por el Cambio (JxC), quien obtuvo el 49,61% de los votos, será el sucesor de Horacio Rodríguez Larreta en la Ciudad de Buenos Aires.', 'La medida de la oposición porteña comenzó a ser analizada desde el domingo. Inicialmente, habían optado por esperar los resultados del escrutinio definitivo. Según la normativa, el ganador tiene que alcanzar el 50% de los votos y, si eso no ocurre, debe volver a competir en un balotaje. Sin embargo, la proximidad de Macri a una victoria en la primera vuelta llevó a adelantar el anuncio.', '“Queremos agradecer a los casi 600.000 porteños y porteñas que nos dieron su confianza a través del voto”, comienza el comunicado publicado por Unión por la Ciudad.', '“A pocas horas de comenzar el escrutinio definitivo, nuestras actas registran que el resultado que obtendrá Jorge Macri estará a muy pocos votos de alcanzar el número establecido por la Constitución de la CABA para ser electo Jefe de Gobierno. Es por ello que una lectura realista del resultado electoral, sumado al apoyo explícito de Javier Milei a Jorge Macri, nos dan la pauta de que sería insensato forzar un ballotage”, prosigue el escrito mediante el cual se realizó el anuncio oficial de la oposición porteña.', '“Por tales motivos, consideramos que la estrategia correcta que nos demanda este momento histórico es concentrar nuestros esfuerzos en defender la democracia frente a la amenaza autoritaria, contribuyendo a que Sergio Massa gane en la Ciudad de Buenos Aires y sea electo Presidente de la Nación. Finalmente ratificamos nuestro compromiso de seguir trabajando para lograr una Ciudad más justa, sensible y humana”, concluye el texto firmado por Santoro y los referentes de Unión por la Ciudad.', 'Con el 98,68% de las mesas escrutadas, el diputado nacional alcanzó el 32,20% de los votos y se quedó con el segundo puesto en CABA, relegando a Ramiro Marra (La Libertad Avanza) al tercer lugar con un 13,89%. En el último puesto se ubicó Vanina Biasi, del Frente de Izquierda y de Trabajadores-Unidad, con el 4,28% de los votos.', 'Previamente, desde el círculo cercano al legislador habían indicado que “tomar cualquier decisión antes del recuento definitivo sería imprudente”. En el búnker de UP había mucha satisfacción por el desempeño alcanzado en todas las categorías. Además, la elección estuvo en línea con sus expectativas. Los resultados obtenidos en los comicios generales representaron una notable mejora en comparación con las Primarias Abiertas Simultáneas y Obligatorias (PASO), en las que Santoro había obtenido el 22,17% de los votos.', 'Pese a esto, la brecha que lo separaba del candidato de Juntos por el Cambio en las elecciones de este domingo finalmente lo llevó a retirarse de la contienda por la jefatura de la Ciudad de Buenos Aires.', 'Según establece el Código Electoral porteño, el balotaje entre los competidores porteños debía llevarse a cabo en un plazo de 30 días a partir de la última votación. En ese escenario, habría coincidido con la segunda vuelta nacional entre Sergio Massa y Javier Milei.', '“Hoy no hablé con Massa. Hablamos en el búnker. Como los números que tenemos son muy finitos, quedamos en que vamos a esperar el resultado definido”, explicó ayer Santoro a Infobae.', 'Ahora, tras la decisión de su rival, Jorge Macri, actual ministro de Gobierno de CABA, será quien suceda a Rodríguez Larreta durante los próximos cuatro años.', 'El ex intendente de Vicente López -que comparte fórmula con Clara Muzzio, candidata a vicejefa de JxC y ministra de Espacio Público e Higiene Urbana de la Ciudad- fue el candidato más votado en la elección citadina.', 'Durante las PASO, Macri se impuso de manera ajustada sobre Martín Lousteau, con quien competía en la interna, al obtener el 28,57% de los votos frente al 27,13% del líder de UCR-Evolución. Entre los dos candidatos totalizaron 55,92% de los sufragios.', 'Aunque su performance en las elecciones del 22 de octubre disminuyó en comparación con la de agosto, el primo del ex presidente fue el único candidato de la coalición opositora que pudo celebrar en el escenario electoral del domingo.']",['Leandro Santoro no competirá en el balotaje y Jorge Macri será el próximo jefe de Gobierno de la Ciudad de Buenos Aires']
