body,title
"['Horario y dónde ver los Pumas-Inglaterra:', 'El partido se podrá ver a través de TV Pública, ESPN y la señal de streaming Star+.', '13 Ciudad de México.', '14 Perú, Colombia y Ecuador.', '15 Bolivia y Venezuela y Miami (Estados Unidos).', '16 Argentina, Uruguay, Paraguay, Chile y Brasil', 'Los Pumas buscarán igualar la mejor actuación en un Mundial:', 'El equipo argentino ahora buscará igualar su mejor actuación en este tipo de citas con el tercer puesto que consiguió también en Francia durante la edición 2007. El elenco albiceleste peleará por imitar su mejor presentación en la historia de los Mundiales con aquel triunfo sobre el local Francia (34-10).', 'Hay que recordar lo hecho por Argentina en las anteriores Copas del Mundo. Tras ser eliminados en fase de grupos en las primeras tres de 1987 (pasaron Nueva Zelanda y Fiji), 1991 (clasificaron Australia y Samoa) y 1995 (avanzaron Inglaterra y Samoa), pasaron por primera vez a octavos de final en 1999 como mejores terceros y allí vencieron a Irlanda. Sin embargo, cayeron contra Francia en cuartos.', 'Luego de otra despedida temprana en fase de grupos en 2003 (clasificaron Australia e Irlanda), tuvieron la mejor presentación en el torneo del 2007 que se celebró también en Francia. Avanzaron primeros del grupo por delante del local, Irlanda, Georgia y Namibia. Superaron 19-13 a Escocia en cuartos de final, cayeron en semifinales contra Sudáfrica (37-13) y luego vencieron 34-10 a los franceses en el duelo por el tercer lugar. A diferencia de esta actuación, en aquel entonces Los Pumas sólo fueron superados en un partido (el de semifinales) ya que clasificaron como líderes de su zona con cuatro victorias.', 'En el 2011 quedaron segundos del grupo detrás de Inglaterra, pero luego perdieron contra Nueva Zelanda en cuartos de final.', 'En el 2015, en Inglaterra, tuvieron otro hecho inolvidable cuando se ubicaron como escoltas de su grupo detrás de Nueva Zelanda y se clasificaron a semifinales tras eliminar a Irlanda en cuartos de final. Sin embargo, la derrota contra Australia en esa instancia los privó de la final y luego fueron superados por Sudáfrica (24-13) en el choque por el tercer lugar.', 'No es un detalle menor señalar que los argentinos llegaron a este Mundial tras haber sido eliminados en fase de grupos en la Copa 2019 que se organizó en Japón.', 'Argentina enfrentará a Inglaterra por el tercer puesto en el Mundial de rugby Francia 2023 para igualar su mejor actuación histórica en la máxima cita. Cada vez más lejos quedó aquella epopeya conseguida en 2007, cuando la Albiceleste derrotó tanto en el partido inaugural como en el de la medalla de bronce a Les Bleus, anfitriones como este año. París fue testigo de una excelente camada de Los Pumas y en la memoria permanecerán los sprints de Ignacio Corleto para doblegar 34-10 al combinado europeo.', 'Leer la nota completa ', 'En la previa del duelo por la medalla de bronce en el Stade de France de París, es bueno recordar el primer partido de rugby que jugaron Los Pumas ante los ingleses en la gira que el seleccionado nacional realizó en 1978 por Inglaterra, Gales, Irlanda e Italia.', 'Leer la nota completa ', 'Argentina e Inglaterra se volverán a ver las caras en el Stade de France para decidir el tercer puesto del Mundial de rugby Francia 2023. Atrás quedó aquel debut en la fase de grupos con victoria 27-10 para La Rosa, que actuó con un jugador menos por la expulsión de Tom Curry a los 7 minutos de la primera mitad y contó con la estelar actuación del apertura George Ford, autor de la totalidad de los puntos para los europeos a través de cinco penales y tres drops que destruyeron a la defensa de Los Pumas.', 'Leer la nota completa ', 'Para alcanzar un lugar en el podio del Mundial de rugby, Inglaterra se prepara para el choque contra Argentina de este viernes, (19h00 GMT) y su head coach, Steve Borthwick, confirmó en conferencia de prensa que presentará un equipo con ocho novedades con respecto al que alineó en semifinales contra Sudáfrica.', 'Leer la nota completa ', 'Los Pumas, el seleccionado argentino de rugby, se prepara para firmar otro hito en su historia deportiva este viernes ante Inglaterra en el duelo por el tercer puesto del Mundial de rugby Francia 2023. De cara al choque trascendental, el coach Michael Cheika dio a conocer cuál será la formación titular para saltar al campo de juego del Stade de France el próximo viernes desde las 16 (hora Argentina).', 'Leer la nota completa ', 'La derrota ante los All Blacks fue dura y tal vez inesperada. Un golpe al corazón de estos Pumas que no pensaban ni en el peor de sus sueños recibir de esta forma. Porque si bien sabían del potencial del equipo neozelandés, nunca se les pasó por la cabeza ni tampoco de la del staff que hubiera tamaña diferencia para una semifinal, ya sea en el resultado final (44-6), ni mucho menos en el juego; a pesar que realizaron unos dignos 35 minutos en la primera parte.', 'Leer la nota completa ', 'Formaciones:', 'Pumas: 1- Thomas Gallo, 2- Julián Montoya (capitán), 3- Francisco Gómez Kodela; 4- Guido Petti, 5- Pedro Rubiolo; 6- Juan Martín González, 7- Marcos Kremer, 8- Facundo Isa; 9- Tomás Cubelli, 10- Santiago Carreras; 11- Mateo Carreras, 12- Jerónimo De la Fuente, 13- Lucio Cinti, 14- Emiliano Boffelli; 15- Juan Cruz Mallía. Coach: Michael Cheika.', 'Suplentes: 16 Joel Sclavi, 17- Eduardo Bello, 18- Agustín Creevy, 19- Matías Alemanno, 20- Rodrigo Bruni, 21- Lautaro Bazán Vélez, 22- Nicolás Sánchez y 23- Matías Moroni.', 'Inglaterra: 1- Ellis Genge, 2- Theo Dan, 3- Will Stuart, 4- Maro Itoje, 5- Ollie Chessum, 6- Tom Curry, 7- Sam Underhill, 8- Ben Earl, 9- Ben Youngs, 10- Owen Farrell (c), 11- Henry Arundell, 12- Manu Tuilagi, 13- Joe Marchant, 14- Freddie Steward, 15- Marcus Smith.', 'Suplentes: 16- Jamie George, 17- Bevan Rodd, 18- Dan Cole, 19- David Ribbans, 20- Lewis Ludlam, 21- Danny Care, 22- George Ford, 23- Ollie Lawrence.', '¿Cómo llega Inglaterra?', 'La Rosa, por su parte, fueron los dueños absolutos del Grupo D al ganar en sus cuatro presentaciones (Argentina, Japón, Chile y Samoa). En cuartos de final superaron 30-24 a Fiji y en semifinales cayeron de manera ajustada por 16-15 ante Sudáfrica.']","['Los Pumas buscarán el tercer puesto en el Mundial de Rugby ante Inglaterra, en vivo: hora, TV y formaciones', 'El lado B de Nani Corleto, el héroe del bronce de Los Pumas en Francia 2007: de sus singulares hobbies a la verdad sobre las versiones de romance con Madonna', 'Los entretelones del primer partido entre Los Pumas e Inglaterra, que terminó empatado y los británicos borraron de su historial', 'El “plan maestro” que Inglaterra preparó durante ocho años para derrotar a Argentina en el Mundial de rugby', 'El técnico de Inglaterra palpitó el duelo ante Los Pumas y explicó por qué será un partido “diferente” al del debut', 'Los Pumas confirmaron la formación que buscará hacer historia ante Inglaterra en el Mundial de rugby', '“Terminar con una medalla colgada no es lo mismo que terminar sin una”: Los Pumas buscan levantarse tras la derrota en semifinales del Mundial']"
"['Nicole Neumann se encuentra abocada a la preparación de su boda con Manu Urcera, que está prevista para el próximo 8 de diciembre, aunque la unión por Civil será el 8 de noviembre. Por estos días, la modelo también se ocupó de celebrar uno de los festejos del cumpleaños de 15 de Indiana, su hija mayor fruto de su exrelación con Fabián Cubero, con quien también tiene a Sienna y a Allegra. Si bien en los últimos meses, entre la panelista de Los 8 Escalones y la adolescente había un vínculo frío y distante - Indiana se fue a vivir a la casa de su papá con Mica Viciconte y su pequeño hermano Luca - la celebración del cumpleaños fue una excusa para lograr el tan esperado acercamiento entre madre e hija.', 'Así las cosas, Nicole está dedicando este último tiempo a la preparación de su casamiento. Según se supo en un comienzo, la fiesta se iba a realizar en el sur del país, en San Martín de los Andes, de donde es oriundo Urcera, pero luego cambiaron la locación a un campo de la localidad de la provincia de Buenos Aires. Se trata de una estancia de 500 hectáreas que se llama Monte Chico, ubicada en Exaltación de la Cruz, a 70 kilómetros de la Ciudad de Buenos Aires.', 'Según había revelado Laura Ubfal en Intrusos (América), “Este lugar tiene 500 hectáreas y se llama Monte Chico, ubicado en Exaltación de la Cruz. El sitio es propiedad de Walter Ramírez, un empresario rural argentino y por primera vez en la historia, el sitio será alquilado”. Por otra parte, la periodista también dio detalles de la costosa residencia en el campo. “Tiene lagos, animales, caminos de álamos y un casco de estancia increíble con muebles comprados del Palacio Duhau. El casamiento será dentro de dos enormes carpas, que estarán ubicadas en la zona del campo de polo y, por supuesto, contará con baños químicos para todos los invitados”, puntualizó.', 'En ese contexto, Nicole se encuentra con los últimos preparativos de su atuendo. Durante este jueves, la modelo compartió un video en sus historias de Instagram en el que mostró un particular detalle para el día de la boda. “Acá les dejo pispear los tocados”, comenzó diciendo Nicole mientras filmaba unas cajas iguales desplegadas sobre la mesa. A medida que las fue destapando, aclaró: “Y los de mis niñas”.', 'Adentro de las cajas podían apreciarse unas tiaras de perlas y brillitos para que las cuatro se coloquen en la cabeza, a modo de accesorio para el cabello. Cabe esperar que para ese momento sus hijas estén unidas a su mamá y asistan a la celebración en uno de los días más importantes de su vida.', 'En una entrevista que concedió Neumann en este último tiempo a Implacables (El Nueve) adelantó algunos aspectos que tendrán lugar dentro del festejo de la boda. En ese caso, se refirió al menú del evento. En diálogo con la Susana Roccasalvo, la modelo aseguró que habrá opciones para todos los gustos, incluyendo alternativas veganas, de manera de reflejar su conocida inclinación hacia este tipo de alimentación. Sin embargo, no todo ha sido fácil en la organización. ya que reveló que hubo ciertas discrepancias con Urcera, especialmente en lo que respecta al destino de su luna de miel. Mientras ella prefería un destino más aventurero, como un safari, su novio tenía en mente otros lugares. A pesar de las diferencias, ella aseguró: “Donde sea, la vamos a pasar bien”.', 'En cuanto a los regalos de boda, Nicole mencionó que habían establecido dos listas para sus invitados. Una de ellas que incluye regalos tradicionales, mientras que la otra está dedicada a donaciones. La modelo expresó su deseo de que los invitados opten por hacer donaciones, aunque todavía están en proceso de decidir a qué organizaciones beneficiarán con estas contribuciones.']",['Nicole Neumann mostró el particular accesorio que compartirá con sus hijas el día de su boda con Manu Urcera']
"['Calles en las que parece de día a las 3 de la mañana, pájaros desconcertados cantando a medianoche, vecinos que refuerzan las cortinas para poder dormir de noche. Estos son algunos efectos de la contaminación lumínica: un problema que viene creciendo en las ciudades, a veces fomentado por la sensación de seguridad que produce el alumbrado público. Un grupo de estudiantes secundarios de la Escuela Nuevos Horizontes de El Bolsón y la Fundación Osiris de Astronomía decidieron empezar a concientizar a la comunidad sobre este tema. Ahora pueden ganar 100.000 dólares.', 'El proyecto de la escuela y la Fundación Osiris está nominado al Premio Zayed a la Sustentabilidad en la categoría “Escuelas Secundarias Globales”, subcategoría “Américas”, junto con otros proyectos educativos de Perú y Chile. Fueron seleccionados entre 5213 candidaturas de 163 países.', 'En total, entre las distintas categorías hay 33 proyectos finalistas, de los cuales 18 son impulsados por escuelas de distintas partes del mundo. Además de las iniciativas educativas en Argentina, Perú y Chile, entre los nominados en otras categorías hay proyectos de Brasil y Guatemala.', 'Los ganadores serán anunciados el 1° de diciembre durante la COP28, la 28ª Conferencia de las Naciones Unidas sobre el Cambio Climático, que se celebrará en los Emiratos Árabes Unidos. Hasta ahí deberá viajar la delegación de El Bolsón para saber si se quedan con el premio.', '“Desde el año pasado veníamos preocupados por el tema de la contaminación lumínica en El Bolsón. Este problema se da por calles iluminadas en exceso o de manera ineficiente. Por ejemplo, cuando las luminarias públicas iluminan demasiado las casas, pueden generar problemas de insomnio o estrés, y la gente termina teniendo que tapar las ventanas”, explicó Diego Galperin, coordinador de la Fundación Osiris de Astronomía, a Infobae.', '“Además del derroche de energía, la contaminación lumínica genera trastornos en los animales, por ejemplo los pájaros se desorientan. Por otro lado, un exceso de iluminación impide que se vean las estrellas en el cielo”, agregó Galperin, responsable del proyecto nominado junto con Leonardo Heredia, profesor de la Escuela Nuevos Horizontes.', 'Durante el año pasado, desde la Fundación Osiris estuvieron trabajando con estudiantes de distintas escuelas de El Bolsón y alrededores en iniciativas de concientización sobre el problema de la contaminación lumínica. Los alumnos hicieron memes, sacaron fotos para registrar la contaminación lumínica en la ciudad, dieron talleres y trabajaron a partir de distintos disparadores (entre ellos, un capítulo de Los Simpson que aborda este tema).', 'Esos antecedentes respaldan al proyecto que ahora está nominado al Premio Zayed, y que prevé la participación de unos 20 estudiantes de 13 a 17 años. “El objetivo es armar una campaña profesional que apunte a disminuir la contaminación lumínica. Queremos concientizar sobre la problemática y generar un proyecto que apunte al recambio de las luminarias en algunos sectores de la localidad, repensar el alumbrado, ver dónde se necesita y dónde no, ver si algunas pueden activarse a demanda. En otras palabras, iluminar de una forma más eficiente y racional”, señaló Galperin.', 'También aclaró que ellos no están proponiendo dejar las calles a oscuras: “Entendemos que el incremento de la iluminación en las ciudades responde a que la gente se siente más segura si hay más luz. Pero se pierde calidad de vida cuando se ilumina de manera ineficiente o mal direccionada: necesitás iluminar la calle, no las casas. Se trata de iluminar sin derrochar”.', 'A modo de ejemplo, Galperin mencionó una aplicación tecnológica desarrollada en la Universidad Nacional de Río Negro que permite el prendido y apagado de las luminarias públicas usando el celular mediante el bluetooth: “De esta manera, el peatón podría activar la iluminación pública a demanda con su celular cuando pasa por una calle”. Estiman que esto implicaría una disminución en la cantidad de luces prendidas y una mejor orientación de las que permanecen encendidas toda la noche.', 'El proyecto sobre contaminación lumínica –que depende del financiamiento del premio para concretarse– prevé el trabajo conjunto entre la Fundación Osiris y la Escuela Nuevos Horizontes, especialmente desde la materia de Física y los talleres de problemáticas ambientales y sociocomunitarias, espacios curriculares creados con la nueva Escuela Secundaria Río Negro.', 'Más allá de lo que pase en diciembre en la entrega de premios en Abu Dhabi, los impulsores de la iniciativa ya se sienten ganadores por haber visibilizado un tema que no suele estar en la agenda de la sustentabilidad. Galperin expresó: “Para nosotros, estar saliendo en los medios nacionales para hablar sobre la contaminación lumínica ya es haber ganado. Ese era nuestro principal objetivo: que más gente tomara conciencia sobre esta problemática”.']","['Una escuela de El Bolsón, candidata a ganar 100 mil dólares para combatir la contaminación lumínica']"
"['En un evento de reconocimiento internacional, los jefes de la Armada Argentina (ARA), almirante Julio Guardia, y de la Prefectura Naval (PNA), prefecto general Mario Rubén Farinón, fueron distinguidos con la prestigiosa Medalla de Oro FIDALMAR en la ciudad de Sevilla, en España.', 'El galardón se trata de uno de los más altos honores conferidos por la Federación Internacional de Instituciones Navales y Marítimas, el máximo organismo iberoamericano dedicado a abordar asuntos marítimos, fluviales y portuarios en los países hispanohablantes. Anualmente, representantes de instituciones públicas y privadas de los países miembros se reúnen para evaluar el desarrollo de las marinas mercantes, militares, policiales, pesqueras y deportivas en América y Europa.', 'El premio se entregó en el marco de la XXXIV Cumbre Internacional de Marinos FIDALMAR 2023, que se inició el pasado 24 de octubre en el salón de convenciones del hotel Silken Al Andaluz. El evento proporciona una plataforma para que los países miembros expongan el estado de sus respectivas naciones y formulen propuestas destinadas a los organismos marítimos y navales, tanto a nivel nacional como internacional.', 'En el marco de estas deliberaciones, la Junta de Gobierno de la Federación, después de un detenido análisis de los antecedentes de cada candidato, propone la entrega de diferentes tipos de reconocimientos. La Medalla de Oro FIDALMAR ostenta un lugar de prominencia en esta escala, y en esta ocasión, el país ha sido doblemente destacado.', 'Con un voto unánime, los miembros del organismo internacional reconocieron los esfuerzos realizados por la Prefectura Naval Argentina y la Armada Argentina para desarrollar eficientes mecanismos de control en la Zona Económica Exclusiva Argentina (ZEEA).', 'En una conversación con Infobae, el representante argentino ante la Federación, Perito Naval VGM Fernando Morales, reveló que su responsabilidad consistió en presentar un informe sobre el sistema actual de protección de los intereses argentinos en el mar, así como la efectiva implementación de los sistemas de control remoto de las operaciones marítimas conocidos como “Pollux” y “Guardacostas”.', 'Morales subrayó la novedad de estos mecanismos de control. A diferencia del pasado, indicó que actualmente ya no se depende de la buena voluntad de los capitanes de pesqueros extranjeros que se acercan a la milla 200 para mantener encendidos sus sistemas de geolocalización conocidos como AIS.', '“Al terminar la exposición de Argentina, pude percibir el alto grado de interés que generó entre los representantes de potencias pesqueras como España y Portugal. La colaboración conjunta de las fuerzas federales de seguridad y defensa, respaldada por una nueva normativa sancionatoria de infracciones, y el apoyo diario de la Comisión de Actividades Aeroespaciales, hacen la diferencia”, señaló el presidente de la Liga Naval Argentina y jefe de la delegación nacional.', 'Por su parte, el Almirante Luis Espejo Segura, miembro de la Armada de Colombia y Presidente pro tempore de la entidad, elogió a los premiados por su profunda dedicación a los asuntos marítimos y por su contribución al engrandecimiento del patrimonio marítimo de la humanidad.', 'Cabe destacar que Argentina es uno de los miembros fundadores de la Federación, y entre sus principales asociados se encuentran Brasil, Chile, Uruguay, Colombia, Cuba, República Dominicana, Perú, Estados Unidos, España, Portugal e Italia, además de contar con otros países adherentes.', 'Durante las jornadas de la cumbre, Morales pasó revista al rol que cumplen en la actualidad la Subsecretaría de Pesca, La Armada Argentina, la Prefectura Naval y otros organismos de reciente creación como el Comando Conjunto Marítimo y los convenios de complementariedad que “vienen arrojando resultados satisfactorios”, se informó oficialmente.', 'También se refirió a las medidas legislativas que permitieron la actualización del régimen fiscal sancionatorio para los infractores a la ley Federal de Pesca y las vicisitudes de la problemática en torno a las licencias de pesca ilegales otorgadas por el gobierno colonial británico en las Islas Malvinas.']",['Los jefes de la Armada y la Prefectura Naval obtuvieron un importante reconocimiento internacional']
"['El irregular comienzo de temporada del Manchester United lo apartó circunstancialmente de la lucha por el campeonato en la Premier League y, hasta este martes, aún no había ganado en la UEFA Champions League. La reciente victoria por 1-0 ante Copenhague en Old Trafford pareció brindar tranquilidad en el máximo certamen continental a nivel clubes, pero esa alegría se disipó después de una polémica publicación de Alejandro Garnacho con la figura del partido, André Onana.', 'El arquero camerunés comprado por más de USD 52 millones al Inter de Milán venía siendo discutido por sucesivos errores que le costaron puntos a los Diablos Rojos y el penal atajado a Jordan Larsson a los 96 minutos de partido aseguró los primeros tres puntos en el Grupo A, zona también integrada por Bayern Múnich y Galatasaray. Garnacho fue uno de los que se estrechó en un abrazo con su compañero.', 'Horas más tarde, el delantero posteó la imagen de ese agradecimiento y, en la descripción de la publicación, puso dos emojis de un mono. Esto provocó una catarata de comentarios vinculados a acusaciones de racismo y pedidos de que borrara el mensaje. El revuelo generado provocó que el joven modificara la publicación original: borró los emojis y sólo dejó la imagen.', 'En la previa al clásico frente a Manchester City, el protagonista principal de la imagen intentó bajar los decibeles a las opiniones ajenas. Onana subió dos historias a su cuenta personal de Instagram, seguida por más de 1.800.000 de personas, y defendió al talentoso futbolista. “La gente no puede elegir lo que me ofende. Sé exactamente lo que Garnacho quería decir: poder y fuerza. Este asunto no debe ir más allá”, escribió acompañado de otra foto dándose un abrazo con el Bichito.', 'A pesar de estas palabras, el joven de 19 años corre peligro de ser sancionado por la FA (Asociación de Fútbol) por violar las pautas sobre publicaciones racialmente sensibles en las redes sociales. Hay un antecedente de similares características que podría hacer efectiva una resolución. En diciembre de 2020, Edinson Cavani fue suspendido por tres partidos y debió pagar una multa de USD 136.000 por repostear la historia de un amigo y dejar la siguiente frase: “Gracias, negrito”.', 'En ese momento, la FA lo calificó como una “infracción agravada” porque “incluye una referencia, implícita o explícita, al color, raza u origen étnico”, a pesar de que Cavani aclaró que no tuvo ninguna intención racista y que el propio Manchester United comentó que la palabra fue utilizada en tono amistoso y que tenía una connotación diferente en Sudamérica a como se percibe en Reino Unido.', 'Esta nueva polémica en la carrera de Alejandro Garnacho es la tercera destapada a través de las redes sociales. Ya anteriormente, le dio like a un posteo que rezaba “no convocaron a Garnacho porque es español” después de no haber sido elegido por la selección argentina para el Mundial de Qatar. Vale recordar que nació en España, pero ya eligió vestir la camiseta de la Albiceleste.', 'Además, en febrero pasado, la eliminación del Barcelona a manos del United para avanzar a los octavos de final de la UEFA Europa League mereció una mención en Twitter: “Pasa de ronda el equipo grande”. Así, el jugador surgido en el Atlético de Madrid se ganó la enemistad de los hinchas del último campeón de España.', 'En medio de este contexto, Manchester United deberá afrontar el clásico de la ciudad este domingo desde las 11:30 (hora argentina) en el Teatro de los Sueños contra los dirigidos por Pep Guardiola en el cierre de la fecha 10 en la Premier League. Será una oportunidad inmejorable para achicar diferencias en los primeros lugares, ya que la escuadra roja marcha en el 8° lugar con 15 puntos, a 8 del líder Tottenham. En la vereda opuesta, los Ciudadanos buscarán el golpe de nocaut para seguir prendidos en la pelea por su tetracampeonato consecutivo.']",['La respuesta del arquero del Manchester United tras la polémica publicación de Garnacho: “La gente no puede elegir lo que me ofende”']
