body,title
"['La UCR se convirtió en el foco de atención luego de la derrota que sufrió Juntos por el Cambio el pasado domingo. Las fuertes críticas que Javier Milei lanzó durante toda su campaña presidencial a los radicales generaron especulaciones sobre un posible apoyo a Sergio Massa para el balotaje del próximo 19 de noviembre. De hecho, según pudo reconstruir Infobae, un sector ya se había acercado al candidato de Unión por la Patria luego de las PASO, molestos con la estrategia nacional de Juntos por el Cambio. Sin embargo, en las últimas horas, los dirigentes enfrentados a las autoridades del Comité Nacional salieron a aclarar que no cerrarán ningún tipo de acuerdo sino que, por el contrario, apostarán a la unidad de la coalición opositora -contra todo los pronósticos- y darán libertad de acción para la votación. “Los dirigentes no somos los dueños de los votos”, aseguran.', 'En medio de la interna y las especulaciones, Gerardo Morales convocó a la Mesa Nacional de la UCR. En su entorno aseguraron a este medio que tanto Mauricio Macri como un sector del PRO ya acordó con Milei, por lo que buscarán acercar posiciones cuando se reúnan desde las 14 en la sede de la calle Alsina. El gobernador jujeño arrastra profundas diferencias con el ex presidente: lo cruzó cuando trató a Hipólito Yrigoyen de populista, lo responsabilizó por operaciones mediáticas en su contra y ahora -junto con Evolución, el espacio que lidera Martín Lousteau- lo acusan de ser el ideólogo de la estrategia electoral que los llevó a la derrota con Patricia Bullrich como candidata.', 'En la previa al encuentro de mañana, María Luisa Storani - vicepresidenta de la UCR- adelantó que llevará a la Mesa Nacional la idea de votar a Massa en el balotaje: “No sé si será compartida (la propuesta) por el resto los miembros de la mesa. Mi posición, solamente, es en contra de Milei-Villarruel”. Durante la entrevista con C5N, la dirigente aclaró: “Es un espacio donde vamos a debatir esto, pero tampoco se toma la decisión mañana. Tenemos posiciones distintas con la gente de otras provincias, porque son realidades diferentes”.', 'Sus declaraciones enfurecieron al sector enfrentado a las autoridades del partido centenario. Los radicales que jugaron con Bullrich en los últimos comicios denuncian que Storani no representa al espacio y que, además, salió a hablar por un pedido de Morales. “Ella dijo lo que en Jujuy no se animan a decir: que quieren jugar con Massa pero no quieren pagar el costo”, detallaron en diálogo con Infobae. Otros menosprecian la figura de Morales, Lousteau y de Storani ya que, pese a dirigir el Comité Nacional, fueron derrotados en sus territorios. “Ya no pueden hablar en nombre de la UCR”, dicen.', 'Con la derrota de Lousteau en la ciudad de Buenos Aires en manos de Jorge Macri, y la pérdida de dos senadores jujeños, sus adversarios creen que ahora las decisiones deben tomarlas lo gobernadores electos. Pese al mal desempeño electoral del domingo pasado y la pérdida de bancas en el Congreso, la UCR se consagró este año en cinco provincias. Según pudo reconstruir este medio, son los que impulsan la unidad de Juntos por el Cambio, pese a la fuerte interna que atraviesa la coalición, el peligro de ruptura y la feroz interna en el PRO.', 'De hecho, luego de la reunión que convocó Morales para en el Comité, a las 19 habrá una reunión de los 10 gobernadores de Juntos por el Cambio en la Casa de Corrientes, entre ellos, Alfredo Cornejo (Mendoza), Rogelio Frigerio (Entre Ríos), Ignacio Torres (Chubut), Marcelo Orrego (San Juan), Claudio Poggi (San Luis), Leandro Zdero (Chaco) y Carlos Sadir (Jujuy), más Gustavo Valdés. Maximiliano Pullaro (Santa Fe) no podrá concurrir por un compromiso que tiene en Estados Unidos.', 'Entre los gobernadores radicales que asistirán a la Casa de Corrientes hay un discurso unificado: “Hay que mantener unido a Juntos por el Cambio”. Se niegan a expresarse a favor de Massa o de Milei ya que creen que sus declaraciones o apoyos no garantizan la victoria de ninguno. “Nadie está esperando a ver qué decimos para elegir a uno de los dos. Nadie es dueño de los votos”, insisten.', 'Es más, algunos se aventuran a asegurar que hay militantes correligionarios que están dispuestos a optar por los libertarios, pese a la catarata de insultos que recibieron por parte del líder de la Libertad Avanza. “Hay muchos radicales que se niegan a votar por un peronista”, advierten.', 'En público y en privado ningún radical se anima a hablar de un acuerdo con Massa, aunque todos reconocen que ya existen negociaciones y no descartan futuros acuerdos. “Todos son acuerdos individuales. Massa puede ofrecer Ministerios y habrá radicales que acepten, pero nunca en nombre del partido”, resaltan. Justamente, los gobernadores electos tienen sus propias alianzas locales con las que deben acordar estrategias, por lo que descartan un pronunciamiento público. “Tenemos que estar unidos y acordar una estrategia para poder dialogar con el futuro presidente”, analizan.']",['La UCR define su rol en el balotaje ante un posible quiebre de JxC: el reclamo de los gobernadores y las diferencias por Massa']
"['Aitana Bonmatí lleva un año para enmarcar. La jugadora del Barça e internacional con la selección español lo ha ganado prácticamente todo. Con el club azulgrana ha ganado la Champions, LaLiga y la Supercopa de España y con la selección se alzó con la mayor gesta de la historia del fútbol femenino español: se proclamaron campeonas del mundo. Pero es que, a nivel individual, Bonmatí también ha sumado una larga lista de premios a su cuenta personal más los que aún podría añadir. Y es que, la campeona del Mundo está nominada a Futbolista Femenina del Año 2023, un premio que concede la BBC, aunque no será hasta el 28 de noviembre cuando se descubrirá quien se llevará el galardón.', 'El año comenzaba de la mejor forma posible para la número 14 del Barça. El 22 de enero de 2023 tenían la primera gran cita del año, la final de la Supercopa de España frente a la Real Sociedad. Un partido en el que el club azulgrana se impuso por un 0-3. El primer título de la temporada estaba en casa. Tras ello, llegó el turno de la Liga F. Después de una temporada impecable, la azulgrana se alzaron el título en el mes de abril, tres jornadas antes de que concluyera la competición. Pero todavía faltaba una cita muy importante, una fecha señalada en el calendario: la final de la Champions.', 'Te puede interesar: Aitana Bonmatí sobre el beso de Rubiales en ‘Salvados’: “Me da rabia, obviamente, porque todo nuestro Mundial ha quedado tapado”', 'El Barcelona podía conquistar su segunda Champions en el PSV Stadion de Eindhoven, en Países Bajos, aunque para eso tenía que ganar al VfL Wolfsburgo. El encuentro no comenzó de la mejor manera para las jugadoras de Jonatan Giráldez, ya que empezaron 0-2 por debajo en el marcador. Sin embargo, no estaban dispuestas a que se les escapara otra Champions en una final como les ocurrió el año pasado. Con Patri Guijarro como protagonista tras marcar dos goles, dieron la vuelta al partido y un tanto de Fridolina Rolfö en el 70 dio la victoria al equipo. Con esta temporada a sus espaldas, le nombraron jugadora de la temporada y jugadora del partido en cinco de los once partidos del Barça en la competición internacional.', 'Del club catalán a la selección. Aitana quería seguir sumando título y pasar a la historia del fútbol femenino al conquistar un Mundial por primera vez y así fue. Las jugadoras de la selección española se impusieron en la final frente a Inglaterra por 1-0 con un tanto de Olga Carmona, convirtiéndose en campeonas del Mundo. Tres grandes títulos con su club y uno con La Roja. A partir de ese momento, comenzaron a lloverle los títulos individuales.', 'Te puede interesar: Mariona Caldentey sobre las palabras de Morata: “Me da rabia cuando dicen que solo quieren centrarse en jugar al fútbol, porque nosotras también queremos jugar”', 'Tras finalizar la final del Mundial, Aitana recibió el premio a mejor jugadora del torneo, dado que durante toda la competición realizó una actuación incontestable, quien además marcó tres goles y dos asistencias durante la competición. Además, de hacerse la dueña y señora del centro de campo, moviendo el balón por todo el terreno de juego, buscando espacio y creando ocasiones de peligro.', 'Con esta temporada a sus espaldas, la UEFA no dudó en otorgarle el siguiente título de su cuenta personal: el The Best. Según explicó la propia UEFA, Aitana Bonmatí ganó el título de mejor jugadora por el papel ofensivo realizado en el Barcelona. Además, registró 5 goles y 8 asistencias en la Champions; 9 goles y 10 asistencias en la Liga F; y tres goles y dos asistencias en el Mundial de Sidney.', 'Ahora, el medio digital 433, le ha nombrado Jugadora del Año y le ha entregado un anillo al estilo NBA con los logros que ha conseguido en la temporada grabados. Y no solo eso, sino que BBC ha publicado la lista de jugadoras que optan al premio de Futbolista del Año 2023, un galardón al que también opta Aitana. Y, por si fuera poco, todo el mundo rumorea que será la próxima ganadora del Balón de Oro. Esto sería lo que le pondría la guinda a una temporada incontestable.']",['El año incontestable de Aitana Bonmatí']
"['Ricardo Iorio, el popular músico referente del heavy metal, falleció este martes a los 61 años. Estaba en su casa -ubicada en una zona rural de Coronel Suárez- cuando habría sufrido un infarto, según informó su abogado, Juan Ignacio Vitalini, en diálogo con la radio Rock&Pop.', '“Empezó a correr el rumor en Bahía Blanca -explicó Vitalini-. Intenté hablar con algunos familiares, la mujer me confirmó la triste noticia. (Iorio) empezó a sentirse mal en la casa, un fuerte dolor en el pecho, se acostó, llamaron a la ambulancia y falleció en el trayecto; cuando ella llegó ya había fallecido. Se desconocía si había tenido algún problema anterior, la señora me dice que no. Es muy sorpresivo todo. Estaba todo bien, solo sintió ese dolor en el pecho. Una locura. Es una triste noticia”.', 'Minutos después se conoció el parte oficial: “Se recibe llamado al teléfono de emergencias procedente de la sala médica local, solicitando personal policial en el campo donde reside Ricardo Iorio en zona rural de Coronel Suárez, a 80 kilómetros de esta, dando cuenta que habría fallecido. Motivo por el cual se da aviso inmediato a personal jurisdiccional por corresponder jurisdicción”, se sostiene en el documento.', 'Ricardo Horacio Iorio había nacido en Ciudadela, en la provincia de Buenos Aires, el 25 de junio de 1962. Su carrera como cantante y compositor es muy extensa. Fue uno de los impulsores del metal argentino y fundador de bandas icónicas como V8, Hermética y Almafuerte. Luego, lanzó su carrera como solista. Actualmente se encontraba recorriendo el país. ', 'Su último show en vivo fue hace diez días, en Rosario, el 14 de octubre en el Anfiteatro Municipal, en el marco de su nueva la gira federal llamada Unas Estrofas Más, con Almafuerte. “Acá estamos, en Rosario, en los campos, los llanos. El día del maldito eclipse, el sábado, vamos a estar ahí para avivar la llama del héroe que hay en cada uno de nosotros”, expresó Ricardo en el último video que se publicó en las redes sociales. “A ver si nos encontramos con los de la región y todos los que quieran arrimarse. Ya saben que las canciones están hechas y con esta banda tan ajustada que tengo que somos una cosa incorregible. Un saludo para todos”, concluye.', 'Su amigo Juanchi Baleirón, líder de Los Pericos, escribió en sus redes sociales minutos después de conocerse la noticia: “No lo puedo creer, veníamos charlando cada tanto, estaba lleno de proyectos giras. En noviembre iba a grabar el disco nuevo, no lo puedo creer”.', 'En diálogo con C5N, Baleirón reveló que esa comunicación se había dado hacía apenas algunas horas: “Estoy atónito, hablé con él anoche, no lo puedo creer. Me enteré por una periodista que me llamó desde Bahía Blanca. Yo estaba manejando, llevando a mis hijos al colegio, me avisaron y quedé atónito porque justo ayer, anoche, hablé con él. Hacía mucho que no hablábamos, lo hacíamos cada tanto, nos pusimos al día de historias de la vida, de recuerdos que tenemos de hace 40 años que nos conocemos o más”.', 'El músico contó más detalles de esa que, sin sospecharlo, sería su última charla. “Me contó de sus proyectos, su gira, que estaba por entrar a grabar el disco que viene con su amigo Álvaro Villagra. Me mandó un videíto, yo le había mandado un meme y me contestó. Retomamos la charla y hoy amanezco con esta noticia. Estaba súper bien, contento, entusiasmado con proyectos y de repente encontrarte con este fue muy duro”, reveló en diálogo con el programa Turno Mañana.', '“Hasta donde yo sé no tenía ningún problema de salud, nunca me manifestó él ni su mujer, que es con quien él confiaba la comunicación hacia el mundo exterior, social sobre todo. Sorpresa de todas formas, tristeza y tengo una rara sensación de haber tenido el privilegio de ser de los últimos que habló con él, de los últimos colegas que habló con él. Fue todo muy extraño, reconectamos y charlamos mucho, media hora de cosas de la vida, de historias vividas juntos, y de repente esto, es muy fuerte”, agregó sobre esa comunicación y anunció que compartiría el video para que sus seguidores pudieran comprobar que el compositor se encontraba feliz. ', 'Con respecto al presente del músico y su decisión de vivir alejado de la ciudad, Baleiron contó que su vida había cambiado por completo: “Vivía en Sierra de la Ventana, estaba tranquilo con su mujer, sus hijos ya grandes. Y vivía una vida de campo, relajado, moviéndose los fines de semana en gira. Estaba en ese plan, se había hecho amigo de sus vecinos del campo. Estaba muy relajado, alejado de la ciudad y de algunas relaciones. Estaba tranquilo en ese ámbito”.', '“Ole-le, Ola-la, Iorio es lo más grande del heavy nacional”, rezaba el cántico popular en cada uno de las presentaciones de Iorio. Sin dudas, dejó una huella en el género en la historia de nuestro país.']","['Murió Ricardo Iorio, ícono del heavy metal argentino']"
"['La presidenta de la Academia de Cine Europeo y directora de cine, Agnieszka Holland, reivindica el cine “valiente e innovador” para hacer frente a las plataformas audiovisuales, dirigidas por “algoritmos y criterios de éxito global” que tienen que gustar “a todo el mundo”', '“El cine sólo puede sobrevivir si es valiente e innovador, porque las plataformas no lo son”, sentencia la directora polaca en una entrevista con EFE por la presentación de su película Green Border en la Semana Internacional de Cine de Valladolid, en la que habla de cine, política y las recientes elecciones en su país.', 'Un largometraje de 147 minutos en blanco y negro, premio especial del jurado en Venecia, que narra las vivencias de los refugiados de África y Oriente Medio atrapados en un bosque primitivo que sirve de frontera entre Polonia y Bielorrusia y que según expone muestra la brutalidad y la doble moral de los guardias a ambos lados de la valla.', 'Holland explica que el film ha “sido muy mal recibido por las autoridades, pero muy bien aceptado por la mayor parte de la población”, con un notable éxito en taquilla y que se ha convertido “en una especie de evento social y político” y una “victoria artística” para la autora, en un momento en el que su país se encuentra en un punto de inflexión por una posible de coalición que desaloje a la derecha conservadora.', 'Para la cineasta, “será un gran alivio” un nuevo gobierno para dejar atrás la “atmósfera pegajosa, tan terrible y tan antidemocrática” que, en su opinión, repite “los mismos esquemas que Putin y Lukashenko llevan a cabo en Rusia y Bielorrusia”.', 'Sin embargo, reconoce que el nuevo gobierno tiene una tarea “muy difícil”, ya que sus predecesores “han minado las instituciones y es muy difícil restaurar una democracia normal”, aunque concluye con que “tiene que salir bien, no tienen otra opción”.', 'Nuevos mercados', 'Respecto al séptimo arte, Holland demanda “más coraje” en el cine europeo y se pregunta que “si el cine está haciendo lo mismo que las plataformas, por qué ir al cine”, por lo que afirma que resulta necesario ser “más fuertes en la forma de contar las historias o en los contenidos, que los cineastas sean más valientes y mejores”.', 'En su tarea como presidenta de la Academia Europea de Cine, la artista polaca reconoce que ve muchas películas del continente “muy bien hechas y con talento”, pero que le generan una sensación “de haber visto lo mismo el año pasado, el anterior y el anterior”, tal vez por el deseo de que entren en festivales o de agradar a las instituciones patrocinadoras.', 'Preguntada por la posibilidad de entrar en otros mercados, como el chino o el indio, señala las dificultades de acceso, por la falta de libertad en el primer caso y porque, en la India, no se puede entrar en el mercado popular del cine de Bollywood.', 'Sin embargo, sí ve un resquicio en el pequeño “pero muy fuerte” mercado de cine de autor en la India, del que “llama la atención que les gustan más las películas del este de Europa que las de Francia, porque las considera demasiado lujosas y burguesas”.', 'Un Kafka “poco convencional”', 'Holland, que vive a caballo entre Francia, Estados Unidos y Polonia, señala que trabaja en una biografía “poco convencional” de Frank Kafka, que empezó a preparar antes de Green Border, pero saltó por la actualidad y que espera tener para el próximo año.', 'Sin embargo, esta semana competirá por la Espiga de Oro en un festival en el que no es es una extraña, ya que sus películas han sido candidatas al máximo galardón en otras cuatro ocasiones Spoor (2017), In Darkness (2011), por la que recibió el premio a mejor director en el certamen vallisoletano, Olivier, Olivier (1992) y su debut Aktorzy prowincjonalni (1979).', 'Fuente: EFE.', 'Fotos: Guglielmo Mangiapane (REUTERS)']",['Agnieszka Holland: “El cine sólo puede sobrevivir ante las plataformas si es valiente”']
"['Juanchi Baleirón, guitarrista de Los Pericos, y Ricardo Iorio, líder de Almafuerte y figura clave del heavy argentino, se conocían desde hace más de 40 años. Antes de sentar las bases del reggae en el país, Juanchi llevó su guitarra por las huestes del metal, y compartieron banda y salas de ensayo hasta que sus carreras tomaran nuevos rumbos. Pero siempre mantuvieron el contacto. La muerte de Ricardo conocida durante la mañana del martes causó un fuerte impacto en el ambiente musical, y Baleirón fue uno de los más conmovidos. ', 'Según relató en sus redes, había retomado el diálogo con el bajista horas antes de su muerte. Todo se inició a partir de que le enviara un meme inspirado en los resultados de los comicios y jugando con el balotaje que definirá al presidente y Sabotage, uno de los discos clásicos de Black Sabbath “Estaba súper bien, estaba como contento, entusiasmado, con proyectos y de repente encontrarme con esto fue muy duro”, reveló el perico a C5N.', 'Al conocer el fallecimiento, Baleirón subió a las redes el meme en cuestión y el video que le envió Iorio como agradecimiento. “El último mensaje que me dejó Ricardo anoche, lunes 23 de octubre 23:25 horas. Así lo voy a recordar”, relató el guitarrista anticipando el material que registró Ricardo horas antes de su muerte: “Gracias por acordarte de mí, Juanchi. Hermoso, me hiciste reír mucho. Buena, buena, buena zapiola, me hiciste reír mucho, ya lo imprimo”, señaló el exAlmafuerte en referencia al meme.', 'Mirando fijo a cámara, Iorio continuó con un pedido para su colega: “Te mando un saludo y no olvides de llamarme porque muchos no quieren llamar porque dicen ‘para no molestar’. Un llamado tuyo es una caricia al alma Juanchi querido”, expresa, antes de despedirse con un deseo. “Buena salud para vos y para todos los tuyos”.', 'En la mencionada entrevista, Baleirón recordó los días en los que fue compañero de Iorio. “En el 84 tuve una banda con él, durante un impasse que tuvo V8 y de ahí que tenemos una relación que fue conectando, tengo conocimiento del lado de fan y de haber sido colega, de seguir su carrera y de lo importante que significó para el movimiento”, señaló el guitarrista. En X, la red social antes conocida como Twitter, Juanchi también subió la foto de Letal, el grupo al que hizo referencia y en el que tocaba Chofa Moreno, fundador de V8 con Ricardo.', 'Respecto a la personalidad, Baleirón lo definió como “picante” y “provocador”: “Le gustaba agitar socialmente. Si no lo conocías, es como que te metía un poco de miedo o te generaba un respeto, pero siempre le gustaba picantear”, señaló, y dio su explicación respecto a esta personalidad. ”Uno como lo conoce entiende el humor de él, cómo buscaba llamar la atención. Lo hacía desde el lado inocente, aunque decía cosas fuertes”, afirmó.', 'Además de la persona, Juanchi también habló del músico: “El tipo es como un ícono, un emblema del heavy metal. Hace 41 años creía que el heavy metal era un género que iba a cambiar las cosas, que iba a ser el vehículo para que los mensajes lleguen y la gente se concientice, para abrirle los ojos a esa generación. Él creía en el heavy metal como fenómeno, creía que iba a generar conciencia en una generación”, evocó.', 'FInalmente, se refirió a los últimos años de Iorio. “Vivía en Sierra de la Ventana, estaba tranquilo con su mujer, sus hijos ya grandes. Llevaba una vida de campo, relajado, moviéndose los fines de semana en gira. Estaba en ese plan, se había hecho amigo de sus vecinos del campo. Estaba muy alejado de la ciudad y de algunas relaciones”, concluyó.']","['El video que Ricardo Iorio le mandó a Juanchi Baleiron, horas antes de su muerte: “Gracias por acordarte de mí, muchos no quieren llamar para no molestar”']"
