body,title
"['Prime Video ha anunciado el inicio de la producción de la esperada serie Cometierra, un drama inspirado en la novela homónima de la reconocida escritora argentina Dolores Reyes. Este proyecto cuenta con un elenco estelar que incluye a Lilith Curiel, Max Peña, Iván Martínez, Roberto Aguilar, Gerardo Taracena, Harold Torres, Juan Daniel García Treviño, Lizeth Selene, Yalitza Aparicio, Arcelia Ramírez, Rubén Albarrán y Mabel Cadena.', 'La trama se sumerge en un mundo de realismo mágico y sobrenatural para contar la historia de Aylín, una joven de los suburbios de la Ciudad de México que obtiene un extraordinario poder: la capacidad de comunicarse con la tierra. Este don la lleva a resolver crímenes y enfrentar las sombras de su pasado en un barrio afectado por la violencia y las desapariciones.', 'La adaptación de este exitoso libro, traducido a 14 idiomas, es una producción conjunta de The Mediapro Studio, Oficina Burman (The Mediapro Studio), Exile Content Studio y Cimarrón (The Mediapro Studio). El creador Daniel Burman, conocido por su trabajo en Iosi, el espía arrepentido, lidera el equipo de directores, que incluye a Cris Gris y Martín Hodara. La escritura estuvo a cargo de Mónica Herrera, junto con un talentoso equipo de guionistas, entre ellos Gabriela Guraieb, Camila Brugés, Juan Carballo, Clara Roquet y la novelista Brenda Navarro. Laura Fernández Espeso, Daniel Burman, Sandino Saravia Vinay, Isaac Lee e Isabel López Polanco son los productores ejecutivos.', 'Alonso Aguilar, líder del equipo de Amazon Originals en Prime Video México, comentó sobre la serie: “Cometierra es una apuesta por hablar de muchas de las problemáticas ineludibles en la realidad de los mexicanos, desde la perspectiva desfachatada del mundo de los superhéroes, la música urbana, y el despertar sexual de la adolescencia. Junto a nuestros socios productores y creadores, estamos muy orgullosos de que esta obra literaria llegue a la pantalla para deleitar a nuestra audiencia local y los fanáticos del young adult en todo el mundo”.', 'El propio Burman también compartió su entusiasmo: “Cuando terminé de leer Cometierra por primera vez, sentí en mis manos toda la fuerza de su protagonista, y la conmoción que me provocó la obra es la misma que nos contagió a todos los que nos sumamos a esta aventura vibrante y necesaria. Llevar esta historia a todo el mundo de la mano de Prime Video y con todo el apoyo de The Mediapro Studio es un privilegio enorme, el cual estoy disfrutando en cada día de rodaje”.', 'Cometierra promete ofrecer una experiencia única a los espectadores, explorando temas relevantes a través de un prisma novedoso. Con la calidad y el talento detrás de esta producción, sin duda alguna, esta serie se convertirá en una de las más esperadas del próximo año. Estén atentos a más detalles y avances emocionantes a medida que se acerca el lanzamiento en Prime Video.']","['Primer vistazo de “Cometierra”, la serie basada en la exitosa novela de Dolores Reyes']"
"['Hay que comenzar a ver las coincidencias. Bahiano Bobadilla, el temible ladrón que fue liberado en un ataque de 30 tiros al Servicio Penitenciario Bonaerense en Tolosa, fue recapturado la semana pasada por la Policía Bonaerense en Berazategui a bordo de un Alfa Romeo modelo 2012. Ese Alfa Romeo era robado: tenía un pedido de secuestro por hurto desde el 9 de agosto de este año. Había sido robado, precisamente, en González Catán, jurisdicción de La Matanza. Cruzó todo el Conurbano para terminar como el vehículo de fuga de uno de los delincuentes más peligrosos de la historia reciente.', 'No es el único. Detectives y jugadores atentos a la radio propia del mundo del hampa aseguran lo mismo. Los autos que se roban en una jurisdicción, hace tiempo, terminan en otra. El delito de hurto de vehículos en la calle, por otra parte, está en alza. Números de la Procuración bonaerense marcan un aumento de un 25,2 por ciento en los expedientes del rubro entre 2021 y 2022, más de 26 mil casos. Un informe de Ituran, empresa de recupero de vehículos, habla de un aumento del 58 por ciento en sus casos entre junio de 2022 y 2023 a nivel nacional.', 'Los robos de autos son una constante en la provincia, pero cambió el mercado. El crimen de Alan Bravo, ocurrido en enero de 2021 en La Tablada, fue una insignia de la lógica anterior. A ]Alan dieron dos tiros en el pecho para quitarle su Peugeot RCZ, por el cual había trabajado meses. Ese Peugeot, un auto de alta gama, iba a ser desguazado parte por parte para los conductores que no tienen problema en pagar un poco menos por un repuesto manchado con sangre. Hoy, vale más el auto entero: se revende a delincuentes. El negocio se organiza de otra forma, con, irónicamente, más profesionalismo, más sentido empresarial.', 'El tarifario es insólito también. Las bandas, coinciden fuentes de los dos lados de la ley, pueden pagarle $500 mil a un menor de edad por un auto robado, hasta $800 mil si es una camioneta. El monto es mucho más de lo que le pagaría un narco por revender bolsitas en un bunker. El número se duplica en la reventa. Bahiano Bobadilla habría pagado un millón y medio de pesos por el Alfa Romeo de su fuga.', 'Hay un caso reciente que ilustra la nueva época, con La Matanza como foco, una jurisdicción que acumula un diez por ciento de los expedientes a nivel provincial. Esta semana, la Dirección de Investigaciones de Delitos Contra la Propiedad Automotor de la Policía Bonaerense detuvo en González Catán a cinco sospechosos, acusados de conformar una asociación ilícita dedicada a robar autos y falsificar documentos, en una causa bajo las órdenes de la UFI N°9 de Andrea Palin en La Matanza y la UFI N°3 de Mario Ferrario en Morón, con 12 allanamientos en la Zona Oeste.', 'Tenían la tecnología suficiente para ser una pequeña y mediana empresa del choreo de vehículos. Los detectives se llevaron trece handys, un inhibidor de señal, hasta chapas de pecho identificatorias de la Bonaerense, lijadoras, mazas, amoladoras, cortafierros, todo para el desguace. Les encontraron también cuatro chapas patente, limpias, sin pedido de secuestro, diez puertas, cinco capots, veinte torpedos, cuarenta paragolpes, 200 cubiertas. La multiplicación parece una ironía.', 'Había autos enteros, como un Volkswagen Tiguan con pedido de secuestro activo, robado a punta de pistola hace tres días en Isidro Casanova, buscado por la UFI N°11 de La Matanza. Luego, un Volkswagen T-Cross, hurtado en la Comuna 9 porteña un día después. El Peugeot 208 con chapa falsa que hallaron estacionado a pocos metros había sido robado en La Matanza un mes antes, el 23 de septiembre, con una causa de la UFI N°3; las obleas en varias autopartes permitieron identificarlo.', 'Así, encontraron nueve vehículos más, autos y motos, hurtados en La Matanza y Morón.', 'Tomás Rico, hermano de dos de los detenidos, fue la primera pista. Había sido arrestado por la Policía de Entre Ríos el 30 de julio de este año, mientras se movía en una camioneta Renault Duster con patente apócrifa, casualmente robada en González Catán el día anterior por dos delincuentes. Se cree que Rico se dirigía a la Triple Frontera, para cruzar la Duster hacia Brasil. Es decir, el auto robado no cruza solo el Conurbano: cruza media Argentina.', 'La banda, con hampones como Cristian Raúl López, alias “El Jabalí”, con base en González Catán y Kevin Tusoni, alias “Plástico”, de 22 años, todavía cubierto por la obra social de su padre, está sospechada por los investigadores del caso de manejar un esquema mayorista de autos robados que serían enviados, precisamente, a Uruguay y Brasil, con viejos trucos como el robo de patentes en autos estacionados. Un destornillador, un poco de prisa y ya.', 'Ahora, ¿qué sentido tiene robar una patente para colocársela a un auto ya robado? Simple: la denuncia del robo de la patente se carga en un sistema distinto al del robo de un auto en sí. “Entonces, cuando pasa por un lector de patentes no salta el pedido de secuestro”, explica un detective.', 'También, le vendían vehículos a hampones de otros rubros. Se secuestró un Toyota Etios en Lanús que había sido visto en varios domicilios investigados en la causa. Cuando se abrió el auto, se encontró un kit completo para robo de viviendas, con handy, guantes, barbijos, pinzas y barretas.', 'La banda terceriza su mano de obra. Se cree que le encargaba los robos a delincuentes menores de la zona. Hoy, la Superintendencia de Investigaciones de Delitos Complejos de la Policía Bonaerense detuvo a un adolescente en La Tablada por el asesinato de Emilio Ghezzi, muerto de de un tiro por la espalda en Aldo Bonzi por tres ladrones que intentaban llevarse su camioneta Citröen C3. Investigadores policiales creen que el menor, de 17 años, habría recibido de la banda de “Jabalí” y “Plástico” el pedido para salir a robar que terminó con la muerte de Emilio.', 'Otro operativo relevante ocurrió esta semana entre Morón y La Matanza, a cargo de la División Investigación del Robo Organizado de la Federal, con la UFI N°2 de Morón. Se ejecutaron 12 órdenes de allanamiento por tres robos de autos de alta gama.', 'Hubo seis detenidos. Se encontró el parking clandestino de la banda en Villa Luzuriaga con diez autos en proceso de desguace y tres block de motor con pedido de captura.', 'El mes pasado, la DDI de La Matanza allanó un nuevo desarmadero en la calle Dumont en González Catán. Se encontraron a dos sospechosos que terminaron detenidos, con cuatro vehículos con pedido de secuestro.']",['Así opera la nueva industria bonaerense del robo de autos: la lista de precios y los Alfa Romeo revendidos a delincuentes']
"['Habla con un tono cubano, en el que se entrometen algunos giros colombianos por el tiempo que vivió en ese país. Por momentos se deja ganar por la emoción y sube la voz, en otros momentos escucha con una atención que parecería que el resto del mundo ha perdido la nitidez. Es un tipo apasionado. Habla con datos duros. Julio Carranza es el Consejero Regional para América Latina y el Caribe de UNESCO, organización clave para pensar la situación de la educación.', 'Carranza visitó el stand que Ticmas montó en la Cumbre de Virtual Educa en Guayaquil y compartió sus ideas sobre educación, inteligencia artificial, el uso de las tecnologías, la necesidad de formar docentes que puedan acompañar el aprendizaje de los estudiantes en tiempos de cambio e incertidumbre.', '—La pandemia significó un impacto muy grande, con atrasos notables en Educación. Los informes que ustedes han publicado en el último año dieron números muy malos lectocomprensión.', '—Exactamente. Y eso ha sido resultado de problemas estructurales, que fueron empeorados con la pandemia. La consecuencia peor, en mi opinión, es que se ha profundizado la brecha entre sectores de la población en materia de educación. A los sectores con mayores dificultades, los colocó todavía más atrás. Los otros pasaron ese terrible momento con mayores ventajas. Ahora —como dirían en Colombia— toca buscar la manera de cerrar esas brechas. De hecho, el secretario general de Naciones Unidas, Antonio Guterres, convocó el año pasado una cumbre educativa a nivel de jefes de Estado para llamar la atención sobre este problema.', '—¿Cómo es el trabajo de UNESCO con la educación primaria y secundaria?', '—Tienen una importancia fundamental, son como las bases de un edificio. La primaria tiene mucha cobertura a nivel internacional y hoy día son pocas las sociedades que no tienen educación primaria obligatoria con un nivel de cobertura aceptable. En cambio, en secundaria básica, la situación es otra. La cobertura no es tan alta y hay también problemas de calidad. Tenemos más preocupación con la educación secundaria, que necesita ser transformada. Que no esté solamente basada en los conocimientos más generales de las asignaturas tradicionales, sino que también esté más arraigada a las necesidades concretas de cada uno de los territorios. Y es determinante que los estudiantes tengan la capacidad de manejar la complejidad de las nuevas tecnologías como la inteligencia artificial, sin embargo, no nos interesa una persona con todas las capacidades tecnológicas, pero con una incapacidad de comprender la diversidad cultural, los valores, la importancia del otro, la importancia de la historia.', '—UNESCO, el BID y otros organismos, junto con los informes, dan pautas sobre cómo debería aplicarse ciertos programas en la región. ¿Cuáles serían las pautas que propone UNESCO para la enseñanza de la tecnología?', '—En primer lugar, mantener una visión integral de la educación como un sistema que no solamente significa el traslado de conocimientos en las áreas tradicionales. La educación supone una visión compleja de la formación del individuo, y eso está conectado directamente con la necesidad de tener maestros con la capacidad de abordar la enseñanza desde un concepto profundo, que está basado en los criterios de carácter cultural. Y cuando digo cultural, me refiero a cultura en su sentido profundo. A veces una interpretación simplista de la cultura se reduce a la literatura y las bellas artes, pero la cultura tiene que ver con las tradiciones, con el conocimiento de lo mejor que han constituido las conquistas de la humanidad, con el conocimiento de la diversidad que caracteriza al ser humano, con las formas de hacer, con los estilos, con los valores. Todo eso no solamente debe acompañar el conocimiento y la tecnología, sino poner el conocimiento y la tecnología en función de su interés.', '—¿Se puede entender de esta respuesta cierta desconfianza hacia la tecnología?', '—De ninguna manera. La tecnología es esencial, es fundamental, es imprescindible. Pero debe estar conducida por la cultura y los valores fundamentales del ser humano. Te voy a dar algunos ejemplos por lo que no todo lo que viene bajo el rótulo de tecnología significa necesariamente progreso: primero, la sofisticación actual de las armas nucleares; luego, hay tecnologías que resuelven una cantidad de problemas importantes, pero generan un deterioro del medio ambiente; y hay otras que desplazan la fuerza de trabajo sin compensación. Las tecnologías siempre desplazan fuerza de trabajo, y eso está bien, pero tiene que haber políticas que vayan compensando ese desplazamiento y su colocación en otras dinámicas. Yo estoy absolutamente en contra de pensar que eso lo resuelve automáticamente el mercado. Nosotros decimos que lo que le pone dirección al avance de la tecnología es la cultura.', '—Un informe justamente de UNESCO dice que en 2040 en América Latina van a faltar docentes, sobre todo en áreas asociadas al STEM (ciencia, tecnología, ingeniería y matemáticas). ¿Cómo se revierte esa falta de docentes?', '—Acabo de leer una noticia que dice que faltan 44 millones de docentes a nivel mundial para cubrir la educación universal básica antes del 2030, que es el umbral de los ODS (Objetivos de Desarrollo Sustentable). Efectivamente, hay un problema serio. Sobre todo en STEM. Es un problema que hay que afrontar desde la política. De dónde, si no. Tiene que ser una decisión de los Estados la inversión, la formación de maestros, priorizar la educación, colocar los presupuestos, orientar las vocaciones hacia aquellas áreas de conocimiento que son fundamentales y están en déficit. Las empresas son imprescindibles, son parte del tejido fundamental de la economía y de la sociedad, pero los mercados no pueden manejar los intereses públicos; esa es función de los Estados.', '—Y ante la falta de maestros, ¿cómo influye la inteligencia artificial?', '—Las tecnologías ayudan a reducir los déficits de maestros, pero, de todas maneras, no cierra completamente ese déficit. Tiene que haber un proceso de rescate de la importancia fundamental del maestro en la sociedad, y eso supone estímulos, no solamente de reconocimiento moral, sino también de reconocimiento material, de salarios, de recursos, etc. La política, la cultura, la educación y la conciencia son factores fundamentales que permiten potenciar, en sus expresiones más importantes, todo lo que nos ofrece hoy día esa maravilla que es la inteligencia artificial.']","['Julio Carranza, consejero de UNESCO: “Lo que le pone dirección al avance de la tecnología es la cultura”']"
"['La Copa de la Liga ingresó en su etapa de definición y este jueves culmina la décima jornada con tres partidos de vital injerencia tanto en la disputa por el título como en la carrera por conseguir un boleto a una competencia internacional o mantenerse en la Primera División. En primer turno, San Lorenzo y Platense igualaron 1-1. Ahora, Lanús superó 2-1 a Tigre y Godoy Cruz venció 2-0 a Newell’s en Rosario.', 'SAN LORENZO 1-1 PLATENSE:', 'Un interesante duelo abrió la actividad en el Pedro Bidegain, donde se vieron las caras un San Lorenzo que se jugó una de sus últimas cartas para meterse en la disputa por el título y un Platense que estaba obligado alejarse del descenso y aspirar a una competencia internacional. Con el arbitraje de Silvio Trucco, el encuentro terminó empatado 1-1 por los goles en el final de Maximiliano Zalazar (34′ST) y Adam Bareiro (45′ST).', 'El punto le sienta mejor al Calamar, pese a que sufrió la igualdad en el final y es porque el equipo de Vicente López quedó a un paso de asegurarse la permanencia en Primera División. Le sacó diez puntos a Colón, el equipo que estaría perdiendo la categoría por Tabla Anual, con 12 en juego. El equipo de Martín Palermo continúa en alza al llevar tres victorias en sus últimas cinco presentaciones.', 'El Ciclón, en cambio, dejó pasar una gran oportunidad de meterse en zona de clasificación a la Copa Libertadores. En la Copa de la Liga no encuentran el rumbo y acumula nueve juegos sin victorias, lo que los posiciona ahora con diez unidades en la parte baja de la tabla, a cinco de ingresar a los puestos de Fase Final. Además, perdió terreno en la Tabla Anual y cedió su lugar en Copa Libertadores.', 'Los primeros 45 minutos fueron muy discretos y poco jugado. Ambos equipos, envueltos en sus urgencias por resultados, chocaron y hubo mucha intención pero poco juego. San Lorenzo llevó peligro recién a los 22 minutos por un cabezazo que salió apenas desviado de Girotti. Tres minutos después, se dio un acción que generó preocupación en el Perrito Barrios, quien sufrió una dura investida de Nicolás Castro, que se terminó ganando la amarilla.', 'En el complemento, San Lorenzo salió con todo y agobió por momentos a Platense, aunque no con llegadas claras de peligro. Esto fue advertido por Martín Palermo, que promediando la etapa metió tres cambios, entre ellos el ingreso de Maximiliano Zalazar, quien pudo romper el marcador. El futbolista de Boca Juniors que está a préstamo en el Calamar clavó un golazo, tras una gran jugada colectiva y puso en ventaja a su equipo a diez minutos del final.', 'Empujado por su gente, el equipo de Insua no se resignó y logró la igualdad mediante su goleador, Adam Bareiro ya con el tiempo cumplido. El goleador paraguayo conectó de cabeza un centro perfecto de Agustín Hausch y luego se ganó la amarilla por festejarlo en la cara del capitán de Platense, Gastón Suso.', 'Formaciones:', 'San Lorenzo: Augusto Batalla; Rafael Pérez, Gastón Campi, Gastón Hernández; Agustín Giay, Carlos Sánchez, Nahuel Barrios, Jalil Elías; Malcom Braida, Federico Girotti y Adam Bareiro. DT: Rubén Darío Insua.', 'Platense: Ramiro Macagno; Raúl Lozano, Juan José Infante, Gastón Suso, Ignacio Vázquez; Franco Díaz, Nicolás Castro, Leonel Picco; Ciro Rius, Ronaldo Martínez y Sasha Marcich. DT: Martín Palermo.', 'Estadio: Pedro Bidegain.', 'Árbitro: Silvio Trucco.', 'Televisación: ESPN Premium.', 'LANÚS 2-1 TIGRE:', 'Lanús superó 2-1 a Tigre en el Estadio Ciudad de Lanús Néstor Díaz Pérez. El Granate está consiguiendo su primera victoria en la Copa de la Liga, donde se ubica penúltimo. Cierra la nómina el Matador de Victoria, que sumó su sexta derrota.', 'Fue un primer tiempo parejo, aunque Lanús logró desnivelar a los 39 minutos luego de un tiro libre desde la izquierda que ejecutó Pedro de la Vega y Lautaro Acosta cabeceó solo para abrir el marcador. El Laucha le dedicó el tanto a un sector de la tribuna donde se ubica la barra brava.', 'En el complemento Tigre no reaccionó y Lanús aprovechó para golpear otra vez. A los 78 minutos Juan Cáceres convirtió el segundo tanto. En el final Tigre alcanzó el descuento con el tanto de Abel Luciatti.', 'En la próxima fecha Lanús volverá a jugar de local y el lunes recibirá a uno de los líderes de su grupo, Belgrano de Córdoba, desde las 18.30. Mientas que Tigre jugará al martes con el otro puntero de la zona, Godoy Cruz, a partir de las 19.', 'Formaciones:', 'Lanús: Lucas Acosta; Juan José Cáceres, Cristian Lema, Diego Braghieri, Brian Aguirre; Pedro De La Vega, Gonzalo Pérez, Raúl Loaiza, Lautaro Acosta; Jonathan Torres y Leandro Díaz. DT: Ricardo Zielinski.', 'Tigre: Santiago Rojas; Martín Garay, Robert Rojas, Abel Luciatti, Sebastián Prieto; Sebastián Prediger, Ezequiel Forclaz, Lucas Menossi, Alexis Castro, José Paradela; y Renzo López. DT: Lucas Pusineri.', 'Estadio: Ciudad de Lanús Néstor Díaz Pérez', 'Árbitro: Hernán Mastrángelo', 'Televisación: TV Pública y ESPN', 'NEWELL’S 0-2 GODOY CRUZ:', 'Godoy Cruz venció 2-0 a Newell’s en el Coloso Marcelo Bielsa de Rosario y alcanzó la punta de la Zona B de la Copa de la Liga. El equipo mendocino aprovechó las que tuvo, fue más práctico y tuvo en su arquero Diego “Ruso” Rodríguez a su principal figura.', 'En una parada difícil como siempre lo es el recinto rosarino, el conjunto mendocino pudo ponerse en ventaja. A los 37 minutos Roberto Fernández se metió en el área aguantó sobre la línea de córner. Abrió hacia Thomas Galdames, que mandó un centro rasante y Daniel Barrea pateó de primera y puso el 1-0.', 'En el complemento Newell’s buscó el empate y probó con centros o pelota parada. Pero le costó entrarle al Tomba que supo defenderse.', 'El ingreso de Francisco González le cambió la cara al conjunto rojinegro, que mereció el empate y el arquero Diego Rodríguez se convirtió en la figura de Godoy Cruz.', 'Pero Newell’s dejó espacios en el fondo y tras un rechazo, la pelota le llegó a Salomón Rodríguez que se la bajó a Tomás Conechny que quedó mano a mano con Lucas Hoyos, lo gambeteó y convirtió el segundo tanto.', 'Con esta victoria el Bodeguero alcanzó la cima de su zona junto a Belgrano, que tiene mejor diferencia de gol (+7 y + 5). Además, está consiguiendo su pase a la próxima Copa Libertadores y ahora es tercero en la tabla anual.', 'En la próxima fecha Newell’s visitará a Platense el lunes, desde las 21.15. Mientras que Godoy Cruz volverá a viajar y en este caso será hasta Victoria para jugar contra Tigre, el martes a partir de las 19.', 'Formaciones:', 'Newell’s: Lucas Hoyos; Armando Méndez, Gustavo Velázquez, Guillermo Ortiz, Ángelo Martino; Juan Sforza, Iván Gómez, Cristian Ferreira; Brian Aguirre, Jorge Recalde y Ramiro Sordo. DT: Gabriel Heinze.', 'Godoy Cruz: Diego Rodríguez; Lucas Arce, Pier Barrios, Federico Rasmussen, Thomas Galdames; Bruno Leyes, Roberto Fernández, Tadeo Allende, Hernán López Muñoz y Tomás Conechny; Daniel Barrea. DT: Daniel Oldrá.', 'Estadio: Marcelo Bielsa', 'Árbitro: Pablo Dóvalo', 'Televisación: TNT Sports', 'Tabla de posiciones:']","['San Lorenzo empató con Platense, Godoy Cruz le ganó a Newell’s y Lanús a Tigre en el cierre de la fecha 10 de la Copa de la Liga ']"
