body,img,title
"['A dos días de la final de la Copa Libertadores entre Boca Juniors y Fluminense en el estadio Maracaná de Río de Janeiro, el talentoso mediocampista ofensivo del equipo brasileño, Paulo Henrique Ganso, analizó lo que podría pasar el sábado 4 de noviembre a las 17 horas en el terreno de juego y dejó en claro que hay “mucho respeto” por el rival que buscará el séptimo título en su historia.', '“Esta final con Boca es muy diferente, ya la estoy disfrutando y no me quiero imaginar lo que debe ser ganarla. Esto es muy especial, no solo para el Flu, sino para mi carrera, nadie imaginaba que estuviéramos en la final. Estoy muy tranquilo, aunque la gente tiene muchas expectativas”, comenzó el jugador de 34 años en una entrevista con el canal ESPN.', 'Ganso, de pasado en la selección brasileña y en el Santos de Neymar, donde juntos consiguieron ganar la Libertadores en 2011, y luego fueron apabullados 4-0 ante el Barcelona de Messi y Guardiola en la el Mundial de Clubes, recordó que les tocó enfrentar al “mejor equipo de la historia”, pero que él solo piensa en el duelo del sábado: “Tenemos mucho respeto por Boca Juniors, por su equipo, por su manera de jugar y por su historia dentro de la Copa Libertadores. Llevan seis títulos, así que tenemos que respetarlos”.', 'El futbolista que tuvo un paso por el San Pablo, Sevilla y Amiens de Francia y lleva cinco temporadas consecutivas en el Fluminense, reconoció que tiene un fanatismo especial por Juan Román Riquelme, con quien intentaron compararlo en el programa F90. “¿Qué comparación, eh? Yo soy muy fan de Riquelme y le quiero agradecer personalmente porque cuando fuimos a jugar contra Argentinos Juniors (octavos de final de la Copa Libertadores) nos recibió muy bien en el predio de entrenamientos de Boca. Estoy muy agradecido con él”, expresó el brasileño.', 'En cuanto a lo que podría ocurrir en el juego y la fortaleza del equipo que orienta Jorge Almirón en la definición por penales, donde suele ser imbatible con Sergio Romero en el arco, Ganso fue sincero y señaló: “Esperemos no tener que llegar a los penales. Queremos definir el partido en los 90 minutos porque la gente ya sabe la historia de Boca, la forma en la que llegaron a la final, no fue por casualidad”.', 'Además, sobre el juego que plantea el equipo argentino, el número 10 del Flu, resaltó que Boca sabe cómo encontrar los espacios porque “se defienden y juegan de contraataque” y estableció una comparación con River Plate, equipo al que Fluminense enfrentó en la primera fase. “A River le gusta mucho tener la pelota en sus pies y atacar. Por lo que demostró en esta Copa, a Boca le gusta más defender el balón, estar juntos en la zona defensiva para poder salir de contragolpe”, indicó.', 'Por último, Ganso les mandó un mensaje a todos los hinchas que no son de Boca en la previa a la final de la Libertadores: “Un saludo a todos los argentinos y a los que no son torcedores de Boca y que lo sean de River, que alienten al Fluminense”.']",[],"['Su fanatismo por Riquelme, el temor a los penales y un pedido de apoyo a River: 6 frases de Ganso en la previa de Fluminense-Boca ']"
"['La pregunta sobre las tecnologías emergentes se ha vuelto para entender el presente y el futuro: en tanto que la realidad cambia con un ritmo acelerado y exponencial, es imperativo comprender el alcance de estas tecnologías y de cómo la disrupción influye en nuestra identidad y sociedad. El próximo martes, cuatro expertos proponen un diálogo abierto para explorar el impacto de la convergencia tecnológica, a la vez que se indague sobre las habilidades que se debe cultivar para moverse en el nuevo mundo.', 'El encuentro es el martes 7 de noviembre a las 17, en el auditorio de Ticmas (Costa Rica 5639, CABA). Con entrada gratuita, requiere, sin embargo, de inscripción previa a través de este formulario online. Participan:', 'Joan Cwaik es autor, conferencista y experto en tecnologías emergentes, lleva su experiencia desde las páginas de sus libros hasta las aulas de la Universidad de San Andrés. Cwaik es, además, el profesor host del programa “Tecnologías emergentes: descubriendo el poder de su sinergia”, desarrollado en conjunto por Ticmas y UdeSA.', 'Fredi Vivas es un ingeniero pionero en el mundo del Big Data. Fundador de RockingData. Su experiencia en analítica de datos y su profundo conocimiento sobre la inteligencia artificial lo convierten en una voz fundamental en este panel. Vivas no solo se sumerge en las profundidades de la IA, sino que también cuestiona sus límites y riesgos. Una de sus preguntas es: ¿Cómo desarrollar una IA de manera responsable?', 'Daiana Gómez Banegas se presenta como una impulsora del cambio social y la innovación. Como “bitcoiner”, Gómez Banegas invita a pensar cómo la tecnología puede moldear un mañana más equitativo, desafiando las fronteras de lo posible en el proceso.', 'Tomás Chernoff es el fundador y CEO de Che3D. Con un espíritu inquieto, Chernoff logró que su compañía pasara de ser un pequeño espacio donde los estudiantes universitarios imprimían sus maquetas a convertirse en un estudio de diseño con clientes como Disney, Adidas, Danone, Samsung, Bayer, Techint, entre otras. Además, en 2019 fundó Peek Studios, el primer canal por streaming profesional orientado a E-Sports y entretenimiento.', 'Los cuatro expertos brindan una visión profunda y ecléctica. Desde la inteligencia artificial hasta las criptomonedas y la realidad virtual, son emprendedores que nos recuerdan que la innovación no solo es un motor de cambio, sino también una lente a través de la cual podemos ver un futuro más brillante y conectado.']",[],['¿Qué son las tecnologías emergentes? Cuatro expertos explican las dinámicas que están cambiando el mundo']
"['En el Salón Verde de la Facultad de Derecho de la Universidad de Buenos Aires ya no entra más público. Pensada como una charla para “compartir el dolor”, como expresa el moderador Emilio Periña, el auditorio escucha con respeto las reflexiones de los expositores. Mariano Caucino, ex embajador en Israel entre 2017 y 2019, no deja dudas: “En Palestina no hay un problema territorial. En la Franja de Gaza gobierna una organización terrorista que atacó a un Estado soberano. Y ante el terrorismo lo único que cabe es el repudio total y absoluto”.', 'Caucino es licenciado en Relaciones Internacionales y conocedor de la problemática en Medio Oriente como pocos. Por eso explica las características del conflicto armado y condena que “Argentina hizo un acuerdo con Irán y eso no puede ser”. Pero no profundiza tanto en los cuestionamientos políticos. Si pide, mientras en una pantalla desfilan imágenes de los rehenes del grupo terrorista Hamas tras el ataque del 7 de octubre, al gobierno argentino un mayor protagonismo. “Hay 242 rehenes. 21 son argentinos. No somos conscientes. El gobierno debería saber que el 10% son argentinos y de alguna forma debería visibilizarlo más”, afirma.', 'La charla sobre “La actual guerra entre el Estado de Israel y Hamas” fue organizada por el Observatorio sobre la lucha contra el Antisemitismo, la Asociación de Abogados Judíos de la República Argentina y la Asociación Argentina de Amigos de la Universidad Ben Gurion del Neguev. Caucino dice que este conflicto bélico es “un problema de difícil solución” y señala la complejidad basándose en que influye que “no haya acuerdos entre las tres potencias, Estados Unidos, Rusia y China” en un mundo cada vez más complejo. También resalta las intenciones de la República Islámica de Irán que todo parece indicar que “busca su bomba nuclear”. “Eso puede provocar que Egipto y Arabia Saudita puedan ir detrás en ese camino armamentístico”, subraya. ', 'Ante una de las preguntas del público que se acercó pese a las inclemencias climáticas (entre ellos estuvieron el legislador de la Ciudad, Facundo Suárez Lastra, y el ex secretario de Derechos Humanos Claudio Avruj) el ex embajador sostuvo que el comunicado que emitió la Cancillería argentina en el que condenó el ataque de las Fuerzas de Defensa israelíes al campo de refugiados de Jabalia, que produjo muertos y heridos “cayó muy mal” pero que “hay algunas cosas en el texto que están bien”. “La oportunidad no fue la mejor. Porque se interpretó que Argentina se sumaba a la posición de (Gabriel) Boric o (Gustavo) Petro, pero no es así”, agregó y aseguró que el principal error es que “no se menciona a los rehenes”.', 'Además de Caucino participaron en el panel Nava Rubensadeh, de la Asociación Argentina de Amigos de la Universidad Ben Gurion del Neguev, Hernán Najenson, de la Asociación de Abogados Judíos y Hernán Elman, del Observatorio sobre la lucha contra el Antisemitismo.', 'Najenson habló de su experiencia en la Universidad Ben Gurión y de cómo Israel, logró transformar un desierto en un lugar con naturaleza. Y también se refirió a la importancia de la justicia en el accionar del Estado de Israel. “Hay una de las partes que confunde población civil con objetivos militares que es la palestina” y del lado de Israel trabajan “abogados que dictaminan sobre cada una de los operaciones, además de un control de la Corte Suprema que evalúa lo que pasa sobre el terreno”. Lamentó que no se pudo realizar una reunión sobre “libertad religiosa, con abogados de todo el mundo, que debió cancelarse” y dijo que Israel tiene un “compromiso con la verdad, la paz y los derechos humanos”.', 'A su turno, Elman repudió y reclamó la liberación de los rehenes. “El 7 de octubre cambió todo. Hubo situaciones extremas que cambian las reglas del juego. Hay que marcar el sadismo y crueldad de ese ataque. Difícil de entender y que no es casual”, aseveró.', 'Hizo hincapié, además, en la importancia de la comunicación: “Por algo los terroristas registraron lo que hicieron. Quieren que el mundo amplifique ese mensaje de terror. Es algo conceptual. Desde acá tenemos que dar otra interpretación”.', 'Y añadió: “El antisionismo no es una casualidad, no quieren que exista un Estado judío. Líderes de Hamas lo dejaron en claro”. Condenó, asimismo, el doble estándar que a veces se utiliza para analizar la situación en Gaza. “Hay una demonización de Israel. Y eso “más que antisionismo es antisemitismo”.', 'Rubensadeh fue la última en exponer. Con tono emocionado, recordó que nació en Palestina cuando aún no existía Israel como Estado y que recién a los 8 años junto a sus padres se fue a vivir allí. “Hamas no nos quiere a los judíos. Hay noches en las que no puedo dormir porque siempre me llama algún conocido que tiene a familiares o amigos afectados por el conflicto”, expresó. ', 'Además, destacó: “No tengo miedo, vamos a salir adelante porque el pueblo israelí tiene mucha fuerza”. Al finalizar pidió apoyo a la comunidad argentina: “Esta es una gran oportunidad de estar juntos y más fuertes”.']",[],['Especialistas expusieron sobre la guerra entre Israel y Hamas: “Ante el terrorismo lo único que cabe es el repudio total y absoluto”']
"['Los días previos a la final de la Copa Libertadores deberían distinguirse por el ambiente festivo, y más en una ciudad con los atractivos turísticos de Río de Janeiro y el aura inspirada por el mítico estadio Maracaná, pero la nota de este jueves volvió a ser la violencia después del ataque de los barras de Fluminense a los de Boca Juniors en una playa de Copacabana.', 'Las redes sociales han canalizado decenas de videos sobre las agresiones sufridas por los simpatizantes que llegaron a la ciudad carioca para acompañar al equipo de Jorge Almirón en su lucha por lograr la séptima Libertadores de su historia y disfrutaban de una jornada de sol. Uno de los fragmentos más esclarecedores sobre el modus operandi de los torcedores aporta una mirada panorámica sobre lo sucedido en cuestión de segundos.', 'La grabación inicia con los seguidores del Flu adentrándose sobre la arena, luego de una extensa marcha por las calles en horas de la tarde. Estos individuos se detuvieron en un punto específico del lugar y, como si hubiera estado planificado, emprendieron alunísono la arremetida para sembrar el miedo entre mujeres, hombres y niños, que disfrutaban pacíficamente del atardecer con merchandising auriazul.', 'Esto provoca una inmediata desesperación de los visitantes, que iniciaron una estampida para escaparse de la zona de conflicto y evitar los robos de sus pertenencias más valiosas, mientras las fuerzas de seguridad se destacaron por su nula intervención en el comienzo de los golpes a los fanáticos del Xeneize. Los móviles policiales se mantienen a pocos metros del lugar. Los encargados de mantener el orden público intervinieron de manera tardía para reprimir con balas de goma y gases lacrimógenos.', 'A pesar de la elocuencia aportada por el video en cuestión, las imágenes de los movimientos realizados por los agentes se destacaron por el arresto de un simpatizante con los colores de la Ribera acusado de haber proferido insultos racistas contra el público brasileño. El joven, aprehendido cuando se había lanzado al mar para escapar del ataque, fue liberado después, sin pruebas sobre la acusación.', 'El periodista de TNT Sports, Ignacio Bezruk, brindo pormenores del ataque realizado por los barras de Fluminense: “Fue un momento terrible lo que hemos vivido. La gente estaba tranquila y en paz cuando vinieron cientos de hinchas aparentemente de la torcida del Fluminense a molestar y a agredir, directamente”.', '“Han robado carteras, han agredido a las mujeres, a niños y a los hombres. A todos. La policía brilló por su ausencia, tardaron en llegar siete minutos. No había ningún policía alrededor de la gente de Boca. En el Fan Zone estaban los hinchas del Fluminense al lado de los de Boca”, siguió el movilero desde Río de Janeiro.', 'Uno de los testimonios de los hinchas argentinos da cuenta de lo sucedido sin ningún motivo aparente: “Es hora de parar con esto. Esto no es fútbol. No nos metimos con nadie y vinieron a quitarnos todo. Nos robaron carteras, nos pegaron y nos revolearon sillas y palos, de todo. No viajamos para que nos acribillen a golpes”.', 'Esta no es la primera vez que sucede algo de esta magnitud. Horas atrás, el reportero Martín Arévalo informó de una “emboscada” contra los argentinos que fueron a Brasil. Uno de los hinchas agredidos, Pablo Moulia, subió una historia de Instagram con una foto del golpe que recibió en la cabeza y la siguiente frase: “Nos cagaron a palos. Me robaron el celular. Éramos 30 y vinieron con reposeras a la playa a rompernos la cabeza”.', 'Los futbolistas de Boca Juniors llegaron este miércoles a Brasil en medio de este contexto hostil para iniciar la preparación del duelo ante Fluminense. Estos episodios de violencia deberán extremar las medidas frente a lo que suceda este viernes en el banderazo de los hinchas al plantel Azul y Oro a un día de la definición y, sobre todo, durante el sábado para evitar enfrentamientos similares en las adyacencias al Maracaná.']",[],['El video que muestra el inicio de la agresión de la barra de Fluminense a los hinchas de Boca Juniors ante la pasividad de la policía de Brasil']
"['Desde 1992, la Marcha del Orgullo de Buenos Aires se realiza el primer sábado de noviembre, mes que se celebra a todas las diversidades dentro de la comunidad LGBTIQ+(Lesbiana, Gay, Bisexual, Travesti, Transexual, Transgénero, Intersex y Queer) que además de visibilizar el orgullo se enfocan en distintos reclamos del colectivo.', 'Bajo la consigna: “Ni un ajuste más, ni un derecho menos. ¡Ley Antidiscriminatoria, ley Integral Trans ya! ¡Frenemos a les anti derechos!”, este sábado 4 de noviembre será su edición número 32 y, desde la Secretaría de Transporte y Obras Públicas porteña ya anunciaron cortes de tránsito y desvíos en la zona del Congreso de la Nación y la Plaza de Mayo, epicentro de la movilización.', 'En ese contexto, y con el objetivo de mejorar la circulación, desde la cartera que dirige Manuela López Menéndez recomiendan usar el transporte público y el sistema Ecobici para moverse.', 'El evento de este año comenzará a las 10 con una feria, que a partir de las 11 será seguida con un conjunto de bandas. A partir de las 15 habrá una marcha hacia el Congreso, donde distintas agrupaciones desfilarán en caravana.', 'El operativo de tránsito tendrá un perímetro cerrado al acceso vehicular que contemplará desde las avenidas Córdoba, Leandro N. Alem, Paseo Colón, Belgrano y las calles Sarandí, Ayacucho desde las 10 horas hasta las 18, horario en que comienza la circulación restringida.', 'En tanto, en el transporte público el Metrobus 9 de julio estará afectado desde la avenida Córdoba hasta la avenida San Juan y se realizará el desvío de varias líneas de colectivos.', 'Las líneas hacia el Noroeste irán por Bernardo de Irigoyen, avenida Juan De Garay, Sarandí, Humberto 1° y Sarandí; las líneas al Este (luego al Norte) irán por avenida Corrientes, Riobamba y avenida Santa Fe; y las líneas al Este (luego al Sur) por avenida Belgrano, Combate de los Pozos y avenida San Juan.', 'Las líneas Metrobus 9 de Julio al Norte: avenidas Montes de Oca, Brasil, Paseo Colón, La Rábida, Leandro N. Alem, Córdoba y 9 De Julio; las líneas del Metrobus 9 de Julio hacia el Sur: avenidas 9 De Julio, Leandro N. Alem, La Rábida, Paseo Colón, Juan De Garay, y las calles Paraguay y Lima.', 'Los desvíos sugeridos para los autos particulares son hacia el sur la av. Leandro N. Alem y av. Córdoba, av. Corrientes y Junín, y av. San Juan y Sarandí. Hacia el Norte, en tanto, son avenidas Paseo Colón, Brasil, Don Pedro de Mendoza y Alicia Moreau de Justo.', 'La primera Marcha del Orgullo en Argentina se realizó el 2 de julio de 1992 en la Plaza de Mayo convocada por la organización Gays por los derechos civiles que encabezó el activista Carlos Jáuregui, el histórico militante que también luchó por el primer proyecto de unión civil. En su honor se celebra el Día del Activismo por la Diversidad Sexual. Falleció a los 38 años.', 'Se realizó en esa fecha por ser el primer día no laborable después del 28 de junio, jornada en que se celebra el Día del Orgullo en la mayoría de los países del mundo, en conmemoración de los disturbios de Stonewall en Nueva York. Entonces, en 1968, la comunidad homosexual se enfrentó con la policía de la ciudad debido a las detenciones y situaciones de abuso que sufrían por parte de algunos oficiales.', 'Por entonces, la prioridad en derechos para la comunidad LGBTIQ+ era la derogación de la ley de averiguación de antecedentes y los “edictos policiales”, que le daban facultades a los efectivos para detener personas en la vía pública y allanar puntos de encuentro de la comunidad.']",[],['Cómo serán los cortes de calles este sábado durante la Marcha del Orgullo']
"['La Cámara Federal sobreseyó hoy al presidente de la AFA, Claudio Tapia, en la causa iniciada por Guillermo Tofoni, dueño de la empresa World Eleven, a raíz de una denuncia por supuesta violación a un convenio que le daba al empresario la responsabilidad de gestionar los partidos amistosos del seleccionado argentino.', 'La Sala I de la Cámara Federal, con la firma de Pablo Bertuzzi y Leopoldo Bruglia, confirmó el sobreseimiento que había dictado en septiembre el juez federal Julián Ercolini tras un dictamen de la Fiscalía.', 'En esa instancia, el magistrado sostuvo que la cuestión debería seguir tramitando en el fuero comercial, “siendo que su naturaleza excede la competencia de la justicia penal”.', 'Al momento de apelar, los abogados de Tofoni acusaron de “prematura y arbitraria” la resolución de Ercolini, argumentando que “realizó un injustificado cambio de criterio que lo llevó a dejar sin efecto un exhorto librado a los Estados Unidos”. Además, la defensa reclamó la declaración de varios periodistas, “quienes en el ejercicio de su profesión habrían informado sobre presuntas transferencias recibidas por la A.F.A. y su contratación con una empresa china para el desarrollo de partidos amistosos en ese país”.', 'La Cámara decidió confirmar la decisión de Ercolini. “A diferencia de lo alegado, se advierte que la resolución tiene el basamento suficiente y que las objeciones efectuadas evidencian, en realidad, el disenso con el temperamento adoptado como materia propia de la apelación deducida”, dice el fallo, al que tuvo acceso Infobae. Y agrega que “el conflicto suscitado entre las partes se presenta como una divergencia interpretativa alrededor de un contrato, cuya ponderación excede la naturaleza propia de este fuero y amerita su tratamiento bajo la jurisdicción comercial, la cual, precisamente, ya se encuentra interviniendo”.', 'Los abogados de la AFA sostienen que “el contrato firmado en mayo de 2021, y que en teoría regía hasta 2030, no fue refrendado por el comité ejecutivo de la AFA y no tiene la rúbrica del secretario general de la entidad, Víctor Blanco”. Y añaden: “Sí figuran, en cambio, las del propio Tapia y la del secretario ejecutivo de la presidencia de AFA, Pablo Toviggino”.', 'Pero el estatuto es claro ya que establece que “la firma del presidente de la AFA en un contrato carece de validez si no está acompañada por la del secretario general, en este caso, Víctor Blanco, presidente de Racing”. En las actas de AFA del 29 de septiembre de 2021 consta que el Comité Ejecutivo de la entidad, rechazó la renovación. “Tomó la palabra el Secretario General (Blanco), quien manifestó que no resulta conveniente para la AFA suscribir dicho contrato, puesto que el mismo no implicaría ningún beneficio directo para la institución”, reza el boletín oficial de la entidad.', 'Al momento de hacer la denuncia, Tofoni acusó a Tapia por el delito previsto en el artículo 173, inciso 11°, del Código Penal. “El hecho de que la Selección Argentina, el día 18 de diciembre de 2022, se consagrara campeona de la Copa Mundial de Fútbol organizada por la FIFA en Catar, impactó de manera positiva en la valoración del conjunto nacional, lo que llevó a Tapia a firmar un extraño contrato con otra empresa, recientemente creada y sin experiencia en el rubro, que tiene por objeto el otorgamiento de las mismas facultades, sin haberle importado la vigencia del acuerdo que tenía con él”, dice la denuncia.', '.']",[],['La Cámara Federal confirmó el sobreseimiento del presidente de la AFA por la denuncia de un empresario ']
