body,title
"['Con su mamá presente en el estudio de América, este martes a la noche se presentó Camila Homs en la pista de Bailando 2023. La modelo fue la encargada de abrir la pista y tras una previa entretenida entre Liliana Fontán y Marcelo Tinelli, la exesposa de Rodrigo De Paul arrancó la coreografía junto a su bailarín, Nico Fleitas.', 'Con la melodía de Ulises Bueno, “Intento”, la actual novia de José Sosa bailó al ritmo de un cuarteto moderno junto a su compañero. Casi al final de la performance, la modelo tuvo un accidente con su vestuario que pudo resolver sin problemas. Cuando terminó uno de los trucos, se le movió el corpiño y dejó ver más de la cuenta, pero Cami pudo superar el incidente. “Estamos acostumbrados a que eso suceda acá en la pista”, la tranquilizó Tinelli y ella contó que le había ocurrido lo mismo en uno de los ensayos. “Me salvó el vestuario, por suerte tengo puestas unas pezoneras”, explicó entre risas.', 'A la hora de las devoluciones del jurado, la pareja de baile recibió comentarios halagadores. Como es habitual, el primero en pronunciarse fue Ángel de Brito. “Quiero destacar que Camila ha evolucionado y también depende mucho de su gran bailarín. Se nota que lo hacés contenta. Viniste con miedo al principio, esta película también ya la vi”, comenzó diciendo el conductor de LAM. “Me pareció lindo y simple el cuarteto, estoy poniendo notas bajas en este ritmo, no se asusten. ¡Bienvenidas las pezoneras que te salvaron!”, dijo en forma graciosa. Su puntaje fue un 4.', 'De inmediato, la mamá de Camila aseguró que no le gustó el puntaje. “No merece un 4, bailó increíble, se le escapó una lola y siguió bailando”, la defendió a su hija. Luego fue el turno de Pampita Ardohain. “Me agrada mucho cómo has progresado, veo a otra Cami, como que hubo un quiebre. ¿Vos lo sentís así? Se notó y se contagia, Y muy bueno todo el comienzo, ese contraluz que tuvo un efecto y después cambió, las pantallas, todos los detalles estaban pensados”. Para concluir, la exconductora de El Hotel de los Famosos dijo que le gustó mucho la coreografía. “Esta pareja da sorpresas y mi puntaje es secreto”.', 'En cuanto a Moria Casán también tuvo palabras halagadoras para Camila. “Me encanta cómo están todos, me encanta tu salida de la perra que tenés adentro, que sos una mujer sumamente bella, femenina y está saliendo una perra con clase. Me encanta cómo vas evolucionando y cómo vas disfrutando. Tenés coreo facial, meté un poquito más de empeine porque estás haciendo trucos muy difíciles y te están saliendo muy bien. Fue una coreo complicada, tuvo como cuatro dinámicas diferentes, sigo creyendo en tu evolución y tu disfrute. Se ve que tenés un buen amor que te hace bien, el buen amor es increíble. ¡Aguante el Pato Galmarini!”, resumió la actriz.', 'Antes de terminar de hablar la One se dirigió a Marcelo. “La mamá de Camila viene por usted, Tinelli” y de inmediato la participante aclaró que era verdad. “Te juro que viene por vos”, confirmó. El puntaje de Moria para la pareja de Cami fue un ocho.', 'En último lugar, Marcelo Polino comentó que le había gusto mucho la presentación. “Linda la puesta, me gustó y con pocos recursos pudieron hacer algo lindo. Las botas te jugaron un poco en contra”, sostuvo. Entonces Cami aclaró que eran suyas porque había tenido un problema con el vestuario. “Tu mamá acompaña pero está al límite de la vergüencita ajena, que no te robe la previa. Van evolucionado bien, chicos, voy a dar un apoyo a esta pareja”, finalizó y les puso un cinco.']",['Camila Homs tuvo un percance con el corpiño en el Bailando 2023: “Me salvó el vestuario”']
"['Una mirada al presente que también es una mirada al futuro. La Escuela de Innovación del Instituto Tecnológico de Buenos Aires (ITBA) realiza hoy, martes 24 de octubre, a las 18, la tercera edición de “What’s Next? Habilidades & Tecnologías”, un evento que busca explorar las últimas tendencias en tecnología.', 'El encuentro se realiza en forma virtual y está abierto a profesionales y entusiastas interesados en descubrir las visiones de expertos destacados en campos como inteligencia artificial, neurociencia, liderazgo, ciberseguridad, sustentabilidad y arte informático. Además, durante la jornada se podrá navegar en diferentes recorridos temáticos a través de un espacio inmersivo donde oradores y participantes podrán interactuar en los espacios de “Debate Rooms”.', 'El programa de la jornada:', '1. ¿La IA puede ser creativa? Por Desireé Jaimovich, periodista especializada en tecnologías e innovación. Es columnista en La Nación y en Radio Con Vos en las secciones de tecnología.', '2. ¿Es la tecnología un apéndice necesario de nuestro cerebro? Por Fabricio Ballarini, Director del Departamento de Ciencias de la Vida el ITBA. Es investigador del CONICET. Ha publicado en varias revistas científicas internacionales de alto impacto y ha dado conferencias en congresos nacionales e internacionales. Es el creador de las Jornadas “Educando al Cerebro” auspiciadas por el CONICET.', '3. ¿Qué nos limita hoy la disrupción en nuestras rutinas como líderes? Por Melina Jajamovich - licenciada en Ciencias Sociales y Políticas, Coordinadora Académica de Metodologías Ágiles en la Universidad Torcuato Di Tella, Asesora Senior en el Gobierno de la Ciudad y Speaker.', '4. ¿Quiénes deben ser los protagonistas para evitar la escalada de ciberataques? Por Jorge Litvin – CBO de Resguarda, empresa especializada en la prestación de servicios y herramientas enfocados en el compliance y la prevención de riesgos para las organizaciones y los individuos. Es abogado especializado en derecho y tecnología.', '5. ¿Cómo construir el puente entre lo ideal y lo posible? Por Amelia Corradi – Project Economics Lead Analyst del área de Desarrollo de Negocios de Tecpetrol. Egresada de la carrera de Ingeniería en Petróleo del ITBA, con experiencia en desarrollo de Reservorio No Convencionales y la Industria Petrolera en Pan American Energy e YPF S.A.', '6. ¿Pueden las computadoras crear arte? Por Diego Alberti – Fundador del Proyecto Aurore Numérique, una instalación interactiva telemática que explora la naturaleza numerica del mundo y la cualidad aúrica de los datos a través de la creación de una experiencia que tiene como eje central la aparición artificial. Egresado de la UBA.', 'Informes e inscripción: https://innovacion.itba.edu.ar/whats-next-3/', 'Desde su creación como universidad privada en 1959, el Instituto Tecnológico de Buenos Aires es reconocido por su vocación por la innovación, la tecnología y la excelencia académica en las formaciones de ingeniería y negocios. La institución fue destacada en el Ranking QS como la universidad privada focalizada en ciencia y tecnología con mayor impacto y vinculación con redes internacionales de investigación de la Argentina.']","['Cuál es el real impacto de la tecnología en la educación, el arte y la sociedad, según los grandes expertos de la Argentina']"
"['A pocos días de haberse realizado las últimas elecciones generales, el presidente de la Corte Suprema de Justicia, Horacio Rosatti, habló de la coyuntura política que atraviesa la Argentina, cuestionó “el canto de las sirenas” y deseó que “la etapa que se inaugura ahora nos marque un camino de unidad”.', 'El magistrado se expresó de esta manera al participar de la primera jornada del evento por los 170 años de la Constitución Nacional, que organizó la Facultad de Derecho de la Universidad Nacional de Lomas de Zamora (UNLZ).', 'En su discurso, ante un auditorio repleto de representantes judiciales y de diferentes sectores sociales, el titular del máximo tribunal sostuvo que la reforma de la Carta Magna de 1994 fue “el último acto político de unidad nacional que se registró desde el punto de vista institucional en la República Argentina”.', '“Ojalá la etapa que se inaugura ahora nos marque un camino de unidad y de unión nacional tan importante para poder poner al país en marcha”, sostuvo la también autoridad del Consejo de la Magistratura de la Nación.', 'En este sentido, en un mensaje que pareció estar dirigido al candidato de La Libertad Avanza, Javier Milei, Rosatti remarcó que “el canto de las sirenas es muchas veces el canto de la desunión, el canto de la grieta, el canto del enfrentamiento”.', '“Hay que aferrarse al mástil de la Constitución, que es la prenda de la unidad nacional. Fue la prenda de unidad nacional que nos hizo salir de la anarquía en 1853, fue una prenda de unidad nacional para establecer la reforma de 1994 y seguramente va a ser una prenda de unidad nacional para transitar este mar Egeo que tenemos que transitar para llegar al destino que todos queremos”, agregó.', 'Al respecto, el juez opinó que en el marco de “una proclama humanista, como es la relación entre el Estado y el mercado, luego de la reforma de 1994″, hay que considerar “capitalismo sí, propiedad privada sí, pero también en función social, como dice el artículo 75, inciso 19, incorporado en esa reforma”.', '“Defensa del valor de la moneda, como dice el inciso 19 del artículo 75, no son proclamas políticas que a uno se le ocurren en este momento, están en la Constitución con letras de fuego. Capacitación de los trabajadores, un crecimiento que debe darse con equidad, con redistribución, con políticas que tengan en cuenta la situación de quienes están en situación de desventaja, inciso 23 del artículo 75 incorporado en la reforma del 94″, continuó.', 'De esta manera, Rosatti ratificó su posición a favor de la existencia del peso, que contrasta con una de las principales propuestas de campaña de Milei, que es el de eliminar el Banco Central e ir a un sistema de libre competencia de monedas que derivaría en una dolarización.', '“Les digo los incisos, les digo los artículos, para que quede claro que esto no es algo aspiracional o lo que uno piensa sobre algo, sino que es lo que está escrito y como ustedes saben, la Constitución está por sobre todas las leyes”, insistió el presidente de la Corte Suprema.', 'De la inauguración de estas jornadas de debate, que continuarán este miércoles, participaron, entre otros, el rector de la UNLZ, Diego Molea y la decana de la facultad de Derecho y consejera de la magistratura de la Nación, María Fernanda Vázquez.', 'Las declaraciones del magistrado se dieron luego de que el candidato de La Libertad Avanza quedara segundo en las elecciones del domingo pasado, casi siete puntos por debajo de su rival de Unión por la Patria, Sergio Massa, contra quien deberá enfrentarse ahora en un balotaje que se llevará adelante el 19 de noviembre.']",['Horacio Rosatti: “Ojalá la etapa que se inaugura nos marque un camino de unidad” ']
"['Mientras la mirada de la comunidad internacional está centrada en lo que ocurre en la Franja de Gaza, desde donde los terroristas de Hamas lanzaron un ataque sin precedentes contra Israel, en el territorio palestino de Cisjordania también se registraron en los últimos días focos de tensión por protestas en diferentes ciudades.', 'En ciudades como Ramallah, Hebron, Nablus, Tubas y Jenin hubo fuertes enfrentamientos entre los manifestantes y las fuerzas de seguridad palestinas. El estallido social responde a una disconformidad de la gente con la respuesta de Mahmoud Abbas, presidente de la Autoridad Nacional Palestina (ANP), al conflicto entre Israel y Hamas.', 'En este contexto de creciente tensión, es importante entender cuáles son las diferencias entre los territorios palestinos de Gaza y Cisjordania.', 'Franja de Gaza', 'Con una superficie de 360 kilómetros cuadrados, el enclave palestino cuenta con 40 kilómetros de largo y 11 de ancho, y una extensa salida al Mar Mediterráneo.', 'Uno de los datos que tal vez más llame la atención es que se trata de uno de los lugares más densamente poblados del mundo (77,6%), ya que en esa pequeña superficie conviven 2.098.389 personas.', 'La frontera principal la comparte con Israel, con 59 kilómetros, mientras que al sur limita con Egipto (13 kilómetros). Según la ONU, casi 600.000 refugiados viven en ocho campamentos en el territorio.', 'Hasta 1917, Gaza fue parte del Imperio Otomano. Ese año quedó bajo control de los británicos, que se habían comprometido a colaborar para la formación de un reino árabe unificado. En el marco de la Primera Guerra Mundial, británicos y turcos llegaron a un acuerdo sobre el futuro de Gaza y la mayoría de las tierras árabes que pertenecían al Imperio Otomano. Sin embargo, en la Conferencia de Paz de París celebrada en 1919, las potencias europeas vencedoras se opusieron a la formación de un reino árabe unificado que planteaban los británicos. De ese modo, y bajo la aprobación de la Sociedad Naciones, el enclave pasó a formar parte del mandato británico de Palestina; situación que se prolongó hasta 1948.', 'En 1947, tras varios años de tensiones entre árabes y judíos, la Organización de Naciones Unidas (ONU) aprobó el Plan de Partición, que proponía una solución de dos Estados que dividiera la tierra entre esos dos pueblos, y que Jerusalén -otro de los focos de disputa- quedara bajo un régimen internacional. En ese entonces, Gaza formaba parte del territorio otorgado a los árabes.', 'Tras la declaración de la independencia del nuevo estado de Israel, en 1948 se desató la guerra con la invasión iniciada por Egipto, Siria, Jordania, Irak y Líbano. El Ejército israelí venció, y pasó a ocupar el 77% del territorio que Palestina había tenido bajo el mandato británico, incluida la mayor parte de Jerusalén. El resto del territorio que había sido asignado al Estado árabe por Naciones Unidas quedó bajo el control de Jordania y Egipto.', 'El control de Egipto se mantuvo casi dos décadas, y en ese entonces comenzó la llegada de refugiados palestinos a ese territorio.', 'En 1967 una coalición de países árabes atacó a Israel, desatando lo que se conoció como la Guerra de los Seis Días. Sin embargo, fue derrotada rotundamente, e Israel pasó a tomar el control de Gaza, hasta que en 2005, tras la Segunda Intifada, retiró a su ejército y a los 9.000 colonos judíos, dejando el territorio en manos de la Autoridad Nacional Palestina. Pero ya en ese entonces venía ganando cada vez más terreno el movimiento extremista de Hamas.', 'La derrota en la Segunda Intifada (2000-2005), la muerte de Yasser Arafat, la falta de autoridad de Abbas, y la profunda corrupción que había en la Autoridad Palestina -organización nacionalista que a diferencia de Hamas aboga por la existencia de dos estados (Israel y Palestina)- allanaron el camino a Hamas, que en enero de 2006, bajo el liderazgo de Ismail Haniyeh, venció a la Organización para la Liberación Palestina (OLP) en las elecciones parlamentarias.', 'Tras su victoria en las elecciones, el gobernante Al Fataj empezó a ver a Hamas como una amenaza, y las tensiones entre ambos derivaron en un enfrentamiento abierto por el poder en 2007. Al Fataj consiguió sostener el poder en Cisjordania, pero fue expulsado de la Franja de Gaza, que empezó a ser gobernada de facto por Hamas.', 'Ante esa creciente amenaza terrorista, las autoridades israelíes y egipcias comenzaron a aislar a Gaza imponiendo un bloqueo para debilitar a Hamas.', 'Desde su irrupción, los terroristas palestinos lanzaron innumerables ataques con cohetes y misiles sobre territorio israelí, lo que provocó hasta el día de hoy cuatro guerras entre Hamas e Israel (2008, 2012, 2014 y 2021). Gran parte de esos cohetes han sido proporcionados por Irán y por la dictadura siria de Bashar al Assad. Además, excavaron cientos de túneles para infiltrarse en territorio israelí y así llevar a cabo atentados y secuestros de civiles y militares. Todo esto, con un solo fin: destruir Israel y crear un estado islámico independiente.', 'Pese a la existencia de otros grupos extremistas en el enclave palestino, como la Yihad Islámica, siempre que hay un ataque desde Gaza, Israel responsabiliza a Hamas.', 'Cisjordania', 'A unos 40 kilómetros de Gaza, y separado por territorio israelí, se encuentra Cisjordania, una zona de mucha importancia ya que se ubica al lado de Jerusalén, que tanto judíos como árabes reclaman como su capital.', 'Se trata de un territorio mucho más extenso que el de Gaza, con cerca de 5.900 kilómetros cuadrados, y una población de 3.176.549 habitantes.', 'Geográficamente está ubicado en la ribera oeste del río Jordán -de hecho también recibe el nombre de Ribera Occidental-, y al sudeste limita con el Mar Muerto. Además, en el este comparte frontera con Jordania, país que tuvo el control de este territorio palestino tras la guerra de 1948.', 'En la década de 1980 la OLP inició una rebelión en los territorios ocupados, lo que condujo a la Primera Intifada en 1987, cuando comenzó un alzamiento masivo contra la ocupación israelí en la Ribera Occidental y Gaza. Al año siguiente Arafat proclamó la independencia de Palestina; ese mismo año Jordania había renunciado a sus pretensiones soberanas.', 'En 1995 Israel y la OLP firmaron un acuerdo en Washington, por medio del cual se sentaron las bases para la creación de la Autoridad Nacional Palestina, a la que Israel entregó la administración de Gaza y parte del territorio de Cisjordania, excepto Jerusalén Este.', 'Por los Acuerdos de Oslo, los palestinos asumieron un gobierno autónomo en las ciudades palestinas y en unos 450 poblados. La zona se dividió en tres territorios: A, B y C.', 'Los territorios A lo conforman Ramallah, Belén, Jericó, Jenin, Tulkarem, Kalkilya, Nablus y la parte árabe de Hebrón. Bajo dominio civil y militar de la Autoridad Palestina, allí los civiles israelíes no pueden ingresar por orden de su gobierno por temor a que sean asesinados.', 'Los territorios B están administrados civil y policialmente por la Autoridad Palestina, mientras que la seguridad perimetral está a cargo de Israel.', 'Los territorios C, en tanto, están bajo control civil y militar de Israel, y representan el 60% de Cisjordania.']",['Claves para entender el conflicto Israel-Palestina: qué diferencia hay entre Gaza y Cisjordania']
"['Luego de cubrir el conflicto en Medio Oriente entre Israel y el grupo terrorista Hamás, Nelson Castro regresó a la Argentina y se encontró con sus compañeros de trabajo, quienes lo recibieron con una conmovedora ovación. Pocos días después del ataque perpetrado contra los civiles de un kibutz, el experimentado periodista viajó al lugar de los hechos para contar en el aire de TN y El Trece cómo se vive en esa zona de guerra.', 'Este martes por la tarde regresó a la redacción de los canales en los que trabaja y su vuelta fue muy emotiva, dado el recibimiento que tuvo por parte de sus colegas y productores, quienes se pusieron de pie para aplaudirlo y ovacionarlo. Muy conmovido por la bienvenida, Castro se abrazó con Dominique Metzger, quien es su compañera en la conducción de Telenoche (El Trece), y les devolvió el saludo al resto de sus compañeros.', '“Les quiero agradecer este recibimiento en nombre de todo el equipo y les quiero decir lo orgullosos que nos sentimos del apoyo que recibimos”, expresó Nelson. “Para nosotros significó mucho que estuvieran pendientes, nos dio mucha fuerza. Representarlos nos dio un orgullo enorme”, agregó a continuación.', '“Fue una vivencia estimulante, única, movilizadora. Nos hizo sentir imbatibles. Estuvimos al lado del riesgo y, cuando estamos cubriendo las cosas, sepan que los tenemos a todos ustedes presentes. Lo sabemos atentos y contentos de lo que logramos, pero que también se angustian y se preocupan por nosotros, que tienen miedo. Eso nos hace sentir queridos y valorados. Nos da una energía única”, indicó el periodista, quien el año pasado también se hizo cargo de la cobertura de la guerra entre Rusia y Ucrania para ambas señales.  ', 'Un rato después de este especial reencuentro, Castro salió al aire en TN para contar sus sensaciones en la cobertura realizada. “Una guerra es un hecho desgraciado para la humanidad y para un periodista, camarógrafo o productor periodístico es una cima de exigencia, porque es un hecho de la Historia”, dijo en diálogo con Mario Massaccesi.', '“Y, por supuesto, podemos estar ahí movidos por la pasión de la vocación, pero también porque están ustedes acá”, agregó después, muy agradecido con sus compañeros. “¿Qué imagen sigue latiendo dentro suyo de todo lo que vivió en la cobertura?”, le preguntó Massaccesi. “La más fuerte, porque eso no lo habíamos visto ni aún en Ucrania es la de las bolsas con cadáveres”, le contestó Castro, rotundo. “En Israel, vimos en los kibutz los cadáveres que estaban ahí. Es una imagen muy fuerte”, subrayó en ese sentido. Y a continuación evocó otra de las imágenes trágicas que lo conmovieron en plena labor periodística. “Fue la del martes, cuando nos muestran las bolsas de los cadáveres”.', '“Pero la más fuerte de todas las imágenes es la que enfoca Martín Magaldi: cuando se abre la puerta de la cámara frigorífica, aparece una bolsita chiquita, que era de un nene. Martín, que tiene un nene de un año, se pone a llorar”, describió Castro acerca de una secuencia que, aseguró, no podrá olvidar jamás.', '“Eso fue algo que no olvidaré. El dolor humano es algo sobrecogedor. Es curioso, porque escenas como esas yo vi muchas en mi carrera médica y sin embargo, no me deja de conmover. Sobre todo, cuando eso es producto de la crueldad”, cerró Castro.', 'Durante su cobertura en Israel, Castro había recibido una carta en la que el Papa Francisco le prometió que iba a rezar por el equipo periodístico que viajó a la zona de guerra para cumplir con su labor. “Dr. Nelson Castro, querido hermano. Muchas gracias por su correo desde Frankfurt. Rezo por usted y su trabajo. Por favor, no se olvide de hacerlo por mí. Que Jesús lo bendiga y la Virgen Santa lo cuide. Fraternalmente, Francisco”, expresó el Sumo Pontífice.']",['Nelson Castro regresó tras su cobertura del ataque a Israel: “Estuvimos al lado del riesgo”']
