body,title
"['Escribir un silencio, el nuevo libro de la exitosa escritora argentina Claudia Piñeiro, saldrá a la venta en librerías y portales digitales el 1 de noviembre. Pero para los y las fanáticas de la autora de libros como Catedrales, Tuya y Las viudas de los jueves, Infobae Leamos les trae un adelanto exclusivo de este título, que se distingue de todo el resto de su obra.', 'Este es el primer libro de no ficción publicado por Piñeiro, en el que reúne textos personales, familiares, de infancia y de amigos, así como capítulos dedicados a la escritura a la lectura y, además, a los discursos que la autora dio en ferias, festivales, universidades y en el Congreso de la Nación.', 'Editado por Alfaguara, Escribir un silencio invita a lectoras y lectoras a adentrarse en la otra cara de la escritura de Piñeiro, una en la que coexisten su intimidad y su compromiso con la realidad. ', 'En el texto compartido a continuación, Piñeiro explica cómo pasó de ser contadora a una de las escritoras argentinas más leídas. “Todo empezó por temor a que mis palabras hicieran daño”, escribe después de contar su primera experiencia con la terapia, en la que un silencio que parecía no llevar a ningún lado la llevó a la escritura. ', 'Sospecho que lo que escribo nace del silencio. Porque así fue desde mi niñez, del silencio a la escritura. De la re sistencia a hablar, al placer de construir un texto. Ese proceso recién se hizo consciente cuando empecé mi análisis a los 23 años. Harta de verme en estado deplorable sin motivo aparente, una compañera de trabajo me puso en la mano el número de teléfono de la analista de una amiga de una amiga a la que yo no conocía. Y si el refrán popular pregona que los amigos de nuestros amigos son nuestros amigos, por qué, presa de un estado deplorable, no iba a aceptar la propiedad transitiva en el caso de un terapeuta. Por suerte la cosa salió bastante bien, o eso creo.', 'Lo de “sin motivo aparente”, visto con la perspectiva de los años que pasaron, resulta banal y apresurado: motivos sobraban. Pero en aquel entonces, esos muchos motivos estaban mezclados, anudados, entreverados. Algo que me recuerda mucho a la imagen disparadora con la que empiezo a escribir una novela: todo está allí, en ese origen, pero cuesta entenderlo, como una maneja de lana enredada que hay que desanudar para luego ovillar. Claro que los tiempos de escritura de una novela y los del análisis son otros y de distinto precio, así que enfrentada a la situación de tener que decirle a mi analista por qué estaba sentada delante de ella armé un argumento coherente, la supuesta razón que me llevaba a aquella primera consulta: “Vengo porque le tengo miedo a mis palabras”. Un argumento no sólo abstracto sino pretencioso, pero que no dejaba de ser sincero y que, con el tiempo, cobró otros sentidos.', 'Pretencioso o no, ese asunto me estaba trayendo algunos inconvenientes. Funcionaba así: ante cualquier circunstancia yo podía responder con astucia e ironía, asertivamente, pero detrás de lo dicho se percibía cierta agresividad.', 'Luego de una discusión de cualquier tipo, mi propia queja nunca era “por qué no le habré dicho tal o cual cosa”, sino, “por qué no me habré callado a tiempo”. Para mí, la palabra era (es) un arma siempre lista, y si pasaba un límite, que no podía ver hasta después de haber hablado, el otro salía lastimado. Yo también. Así empezó todo: por temor a que mis palabras hicieran daño. Y ese temor no me conducía a otra manera de decir, sino al silencio. Así fue que, coherente con el motivo que me había llevado a terapia, mis primeras sesiones fueron de silencio absoluto. No recuerdo cuánto duró el período de “análisis silencioso”, pero sí que fue largo y penoso. El silencio no siempre es un refugio agradable.', 'Una vez por semana, entraba al consultorio de mi analista y después de decir: “Hola, buenos días”, podía pasarme la sesión entera sin emitir un solo sonido. Tocaba los distintos objetos que ella tenía sobre su escritorio y los examinaba de frente, de costado, arriba, abajo: un sapo verde de madera, una caja con caramelos, un paquete de pañuelos de papel. Al principio me incomodaba por la persona que tenía delante —mi analista—, pensaba que si yo no le hablaba se sentiría mal, me compadecía de esa mujer que había elegido una profesión que la obligaba a estar cincuenta minutos frente a otra mujer callada.', 'Unas semanas después, empecé a incomodarme por mí misma, a hacer cuentas multiplicando las horas que yo pasaba allí por sus honorarios, y el resultado aumentaba mi molestia: era muy caro el valor que pagaba por no decir una palabra. Pero nada podía hacer por el momento más que seguir callada, como si una hermética mordaza de metal sellara mis mandíbulas al estilo Leonardo DiCaprio en El hombre de la máscara de hierro.', 'Con el tiempo, la cosa fue evolucionando. Mis sesiones de silencio seguían imperturbables pero yo ya no sentía pena o incomodidad o molestia ni por mi analista ni por mí, sino todo lo contrario. Habíamos pasado a otra etapa, la del brutal enojo. Lo nuestro era ahora un combate que se sostenía en la espera de la palabra, un duelo donde se medían fuerzas. La compasión y la culpa de las primeras sesiones se habían trasformado en bronca, casi odio. Si mi analista me hubiera obligado a hablar en aquel momento me habría levantado y no habría vuelto nunca más. Mi objetivo no era hablar, todavía, sino resistir en silencio. La frase que venía a mi cabeza era: “Sé que estás esperando que hable, turra, pero mejor que esperes sentada”. Debía haber empezado lo que ellos —los psi— llaman transferencia.', 'Por fin, de aquel silencio salí, aunque no hablando sino escribiendo. Lo que recuerdo de la etapa que siguió fue que un día, harta de permanecer callada, empecé a llevar un texto literario que yo intentaba producir en el tiempo que me dejaba libre un trabajo agotador como economista, de bastante más de ocho horas diarias. Cada sesión compartía con ella un capítulo. Después del “buenos días”, ahora me sentaba y leía. No hablaba, leía. Pedí una licencia en mi trabajo para escribir, y esos textos primitivos se convirtieron en una novela que presenté en el concurso La sonrisa vertical, de Tusquets. Suerte de principiante, mi borrador fue uno de los diez finalistas de ese año, un hecho que reconozco fundacional en el camino que recorrí hasta convertirme en escritora, porque fue la primera vez que un espejo externo me devolvió una imagen que decía que si me esforzaba, si seguía leyendo, si intentaba formarme en literatura, tal vez, algún día sería escritora.', 'Pero más importante aún que esa revelación fue el hecho de que esa novela trazó el camino del silencio a la palabra escrita, escribí para contar una historia. No se trataba de ir a leer un diario íntimo sino ficción, un trabajo de escritura que no intentaba ser catártico sino al que le estaba poniendo todo el esfuerzo posible para que fuera literatura. En aquellas sesiones no leía mi vida, leía la de otra mujer a la que la atravesaba un dolor y un enojo que yo conocía muy bien. Una mujer inventada, una historia inventada, unas circunstancias inventadas, pero un dolor propio, un sentimiento que no me era ajeno. Mientras yo leía, mi analista me miraba imperturbable; o eso supongo, porque yo no la miraba a ella sino a la hoja llena de palabras que tenía frente a mí. Recién después de escribir y leer en sesión aquella primera novela, pude empezar a hablar.', 'El tema del silencio y las palabras me persigue desde entonces. Pero sé que me ha perseguido desde mucho antes, sin que lo tuviera consciente. A lo largo de los años, el silencio se instaló en muchos otros períodos de mi análisis, pero sólo por momentos breves, como un recuerdo de aquel tiempo en el que creía que las palabras pronunciadas sin control podían ser un arma que lastimara. Por fin, pude encontrarles otro destino. La escritura me ayudó a salir del silencio sin correr el riesgo de la palabra pronunciada, de lo dicho sin control. Y, mejor aún, sin asumir los riesgos del silencio. También se paga un precio por el silencio. Lo que no se debe, no se puede o no se quiere decir, se esconde en una zona oscura, indeterminada, donde poco a poco se hace callo. Y el callo crece hasta convertirse en un volcán que un día, irremediablemente, entra en erupción.', 'Escribo para encontrar palabras que cuenten esos silencios, silencios anteriores, los que duelen, los que pueden convertirse en volcán. Escribo las historias que se esconden debajo de él.', '♦ Nació en Burzaco, Argentina, en 1960.', '♦ Es escritora, guionista de televisión, dramaturga y contadora.', '♦ Escribió libros como Tuya, Las viudas de los jueves, Catedrales y El tiempo de las moscas.', '♦ Recibió galardones como el Premio Clarín y el Premio Sor Juana Inés de la Cruz, y fue declarada Ciudadana ilustre de la Ciudad Autónoma de Buenos Aires.']","['Adelanto exclusivo: empezá a leer el nuevo libro de Claudia Piñeiro, “Escribir un silencio” ']"
"['(HealthDay News) - Combatir el cambio climático podría depender de elegir pollo para tu taco o usar leche de soja como crema para el café, sugiere un nuevo estudio. Hacer simples sustituciones en la dieta diaria puede reducir la huella de carbono basada en la alimentación del estadounidense promedio en más del 35%, según un artículo publicado en la revista Nature Food.', '”Lo que estamos observando aquí es un enfoque de pequeños cambios. ¿Qué pasa si alguien cambia solo una cosa en su dieta?”, dijo el investigador principal Diego Rose, director del programa de nutrición en la Escuela de Salud Pública y Medicina Tropical de la Universidad de Tulane en Nueva Orleans.', '”Lo que encontramos fue que si solo haces un cambio, si todos los que estaban comiendo un alimento con una alta huella de carbono en esas categorías hicieran solo un cambio en un día dado, realmente podrías reducir la huella de carbono total”, continuó Rose. ', 'Además, estas sustituciones también tendían a mejorar la calidad de la dieta de una persona, señalaron los investigadores.Una persona podría burlarse de la idea de que su hamburguesa con tocino contribuya a la catástrofe climática global, pero estaría equivocada, dijo Rose.', '”Lo que mucha gente no se da cuenta es que los sistemas alimentarios humanos a nivel mundial representan un tercio de las emisiones de gases de efecto invernadero”, señaló.', 'Para evaluar cómo las pequeñas sustituciones podrían ayudar al clima, el equipo de Rose analizó datos de dieta de más de 7,700 adultos y niños que participaron en una encuesta federal de salud y nutrición. ', 'Los investigadores examinaron cuatro grupos amplios de alimentos: alimentos proteicos, platos mixtos, leche y productos lácteos, y bebidas no alcohólicas, y estimaron el impacto de que una persona sustituyera un alimento de alto impacto en carbono por una alternativa más respetuosa con el medio ambiente.', 'Las sustituciones potenciales variaron desde 79 posibilidades en el grupo de bebidas hasta 180 en el grupo de platos mixtos, que incluía comidas como burritos, pastas, salteados y sándwiches. ', 'Las mayores mejoras provinieron de sustituciones en platos mixtos y alimentos proteicos, encontraron los investigadores.', 'Cambiar la carne de res por pollo o tofu en un plato mixto podría reducir la huella de carbono diaria basada en alimentos de una persona en un 53%, mientras que sustituir un bistec a la parrilla por una pechuga de pollo podría reducir la huella en un 50%, mostraron los resultados del estudio.', '”Si estás pidiendo burritos o tacos, hay tantas otras cosas en ese plato que si cambias la carne molida y en su lugar pones pavo molido o pollo, probablemente no notarás la diferencia, pero definitivamente vas a reducir la huella de carbono de tu dieta”, dijo Rose.Las sustituciones en leche y productos lácteos o bebidas también ayudaron, pero en menor medida, reduciendo la huella de carbono en aproximadamente un 8%.Esas sustituciones también podrían mejorar la dieta general de una persona, añadieron los investigadores.', '”Examinamos el Índice de Alimentación Saludable, que es una medida utilizada para evaluar la calidad nutricional general de una dieta, y encontramos que las dietas mejoraban con estos cambios en cualquier lugar del 4% al 10%”, dijo Rose.', 'Los expertos en nutrición y medio ambiente coincidieron en que alejarse de la carne de res es el cambio dietético que podría producir más beneficios para el planeta.Los animales de pastoreo como el ganado o el cordero, en particular, tienen una gran huella de carbono, dijo Rose.', '”Estos animales son increíbles porque pueden comer pasto y convertirlo en calorías”, dijo. “Pero en el proceso de hacer eso, la fermentación en su estómago produce gases de metano. Lo que significa en términos populares es que el impacto de la carne de res es de 8 a 10 veces el del pollo”.Producir alimento para el ganado también produce muchas emisiones, sobre todo emisiones de óxido nitroso de los fertilizantes, añadió Geoff Horsfield, gerente de asuntos gubernamentales del Grupo de Trabajo Ambiental.Llenar tu plato con frutas y verduras también ayudará tanto a tu salud como al planeta, dijeron los expertos.', '”Creo que empieza con las plantas. Si quieres tener menos impacto ambiental o menos impacto climático con tus alimentos, haz que las plantas sean la estrella de tu plato”, dijo Horsfield, quien no participó en el estudio.”Tofu ha estado alrededor por decenas de miles de años y tiene menos emisiones que los productos animales”, agregó. ', '“Sabemos que cosas como la leche de avena, la leche de almendra y la leche de soja son todas mejores que sus contrapartes lácteas basadas en vacas para el clima”. Emma Laing, portavoz nacional de la Academia de Nutrición y Dietética de EEUU, estuvo de acuerdo.', 'Señaló que la mayoría de los estadounidenses no cumplen con las recomendaciones de las Guías Alimentarias para el consumo de frutas y verduras.', '”Para aquellos que no cumplen con estas recomendaciones, incorporar más prácticas basadas en plantas o enfoques centrados en las plantas en un patrón alimentario variado sería beneficioso”, dijo Liang, directora de dietética en la Universidad de Georgia.', '”Comer una dieta variada no solo apoya la salud sino que también beneficia al medio ambiente”, añadió. ', 'Tener acceso a alimentos seguros, nutritivos y asequibles dentro de nuestro sistema alimentario, al mismo tiempo que se conservan los recursos involucrados en la producción, distribución y consumo de alimentos, son importantes tanto para nuestra salud como para el planeta”.Más informaciónEl Foro Económico Mundial tiene más información sobre alimentos y cambio climático.', 'FUENTES: Diego Rose, PhD, MPH, RD, director del programa de nutrición, Escuela de Salud Pública y Medicina Tropical de la Universidad de Tulane, Nueva Orleans, La.; Geoff Horsfield, BA, MPP, gerente de asuntos gubernamentales, Grupo de Trabajo Ambiental, Washington, D.C.; Emma Liang, PhD, RDN, directora de dietética, Universidad de Georgia, Atenas, Ga.; Nature Food, 26 de octubre de 2023.', 'FUENTES: Diego Rose, PhD, MPH, RD, director del programa de nutrición, Escuela de Salud Pública y Medicina Tropical de la Universidad de Tulane, Nueva Orleans, La.; Geoff Horsfield, BA, MPP, gerente de asuntos gubernamentales, Grupo de Trabajo Ambiental, Washington, D.C.; Emma Liang, PhD, RDN, directora de dietética, Universidad de Georgia, Atenas, Ga.; Nature Food, 26 de octubre de 2023', '*Dennis Thompson HealthDay Reporters © The New York Times 2023']",['Pequeños cambios en la dieta pueden reducir la huella de carbono y beneficiar al planeta ']
"['El ex primer ministro de China, Li Keqiang, murió la madrugada del viernes de un ataque al corazón, un abrupto final a la vida de un líder que había servido junto a Xi Jinping durante una década y estableció un tono más suave, mientras que nunca parecía desafiar directamente las políticas de línea dura de Xi.', 'Li, de 68 años, se encontraba de visita en Shanghái cuando sufrió repentinamente el infarto, según informó la televisión estatal china. “Todos los esfuerzos para resucitarlo fracasaron”, dijo el informe.', 'El Sr. Li fue considerado en su día un posible alto dirigente del gobernante Partido Comunista Chino. Pero al final se vio superado por Xi y se convirtió en primer ministro de China -el jefe del gabinete- en 2013. Durante los 10 años siguientes, dirigió los ministerios del gobierno chino, pero parecía tener menos poder que los primeros ministros anteriores, ya que Xi dominaba la política.', 'Li, doctor en Economía, fue el ejemplo de una generación de líderes chinos con un alto nivel educativo que ascendió rápidamente en las décadas de 1980 y 1990, cuando la generación de Mao Zedong se retiró de la política.', 'Pero él y muchos de sus contemporáneos perdieron gran parte de su influencia en la última década, a medida que el Sr. Xi consolidaba el poder y promovía un círculo interno de leales al Partido Comunista a los que conoce desde hace décadas.', 'Antes de que Xi se convirtiera en el líder máximo, “funcionarios como Li Keqiang lo hicieron muy bien y continuaron la institucionalización del partido”, dijo Victor Shih, especialista en política de facciones chinas de la Universidad de California en San Diego. Pero el Sr. Li y muchos otros profesionales “no tenían tanta práctica en la política despiadada que siempre ha caracterizado a la política de élite”, dijo.', 'Nacido en la provincia de Anhui, en el este de China, Li estudió Derecho y Economía en la Universidad de Pekín, donde se mezcló con estudiantes liberales que más tarde se lanzaron al movimiento prodemocrático de 1989. Pero Li eligió otro camino y ascendió en la Liga Juvenil del Partido Comunista.', 'Más tarde fue líder provincial y se le consideró un posible sucesor de Hu Jintao, el líder chino que también ascendió a través de la Liga Juvenil. Al final, Xi se convirtió en el máximo dirigente en 2012 y Li trabajó a su sombra.', 'Como primer ministro, Li trató de reducir la burocracia gubernamental y la interferencia en la economía privada. Pero Xi dominaba las decisiones importantes.', 'En la última década, Xi había apartado a Li de una amplia gama de asuntos políticos. Xi creó una serie de comisiones del Partido Comunista para elaborar políticas sobre cuestiones como la seguridad nacional, la economía y las finanzas, suplantando gran parte del papel de formulación de políticas que antes desempeñaban los ministerios, que dependían de Li como primer ministro.', 'El Sr. Li “debe haber vivido una vida de frustración e infelicidad durante los últimos 10 años”, dijo Barry Naughton, otro especialista en política china de la Universidad de California en San Diego. “Había sido tan sistemáticamente privado de poder e influencia por Xi Jinping que no creo que su fallecimiento tenga mucho impacto en la situación política de China”.', 'Los internautas chinos expresaron su conmoción por la noticia de la muerte de Li en Weibo, la plataforma china de redes sociales similar a Twitter.', '“Siempre vivirá en nuestro corazón”, escribió un comentarista. “Esto es demasiado impactante”, escribió Hu Xijin, ex redactor jefe de Global Times, un periódico del Partido Comunista. “Profundas condolencias”.', 'Shi Feike, abogado y ex periodista de investigación, dijo que algunas personas, como él, recordarían al Sr. Li por sus inclinaciones liberales y su defensa de las reformas de mercado.', '“Puede que no fuera un político fuerte y contundente, ni un hábil orador público”, escribió Shi en un post en la plataforma de redes sociales WeChat. “Pero en mi impresión, casi todas sus expresiones públicas estaban estrechamente relacionadas con palabras clave como democracia, estado de derecho, economía de mercado y racionalización del gobierno”.', '“¡Que descanse en paz este anciano alineado con la dirección de su tiempo!”, escribió.', 'En China, el fallecimiento de un dirigente se considera un asunto políticamente delicado, que puede desencadenar disturbios, lo que plantea la cuestión de cómo conmemorarán el Sr. Li Xi y el Partido Comunista.', 'En el último año, las autoridades se han apresurado a reprimir los signos de disidencia, especialmente en un momento en que China se enfrenta a retos económicos, una crisis inmobiliaria y un elevado desempleo juvenil. A finales del año pasado, residentes y estudiantes de varias ciudades chinas celebraron protestas contra las restricciones de Covid que supusieron el desafío más audaz al gobierno del partido en décadas y una afrenta inusual al Sr. Xi.', 'Para algunos chinos, la noticia de la muerte del Sr. Li el viernes tuvo ecos de la muerte en 1989 de Hu Yaobang, un ex líder del Partido Comunista relativamente liberal que sucumbió a un ataque al corazón durante una reunión del partido. Su muerte fue recibida con una ola de dolor público que desembocó en las protestas prodemocráticas de Tiananmen.', 'Pero Xi, el líder más poderoso de China en décadas, ha intentado ejercer un férreo control sobre las redes sociales, las universidades y la sociedad en general. El Sr. Li no era visto como la misma figura transformadora que había sido el Sr. Hu en la década de 1980, dijo Joseph Torigian, investigador de la Institución Hoover de la Universidad de Stanford.', 'Sin embargo, añadió Torigian, Xi querrá manejar el duelo con cuidado, incluyendo la necrológica oficial y la valoración del partido sobre el papel de Li.', '“Estoy seguro de que esto dará lugar a preguntas sobre si la muerte de Li Keqiang fue en parte el resultado de que se sintiera frustrado y deprimido por la forma en que fue tratado, o por la forma en que va el país”, dijo Torigian.', '“El país, en general, se encuentra en un estado de malestar, como lo estaba en 1989, y esto es definitivamente inesperado”, dijo. Pero añadió: “Los dirigentes vigilarán muy de cerca si la gente intenta utilizar esto como una oportunidad para crearles problemas.”', '* Este artículo fue publicado originalmente en The New York Times.-']","['China está en shock por la muerte de Li Keqiang, el dirigente que vivió a la sombra de Xi Jinping']"
