body,img,title
"['Van dos días hábiles de noviembre y no todas las fábricas de automóviles actualizaron sus listas de precios al público. Pero las que sí lo hicieron registran valores por sobre la inflación, de entra 10 y 15 por ciento.', 'Las marcas que actualizaron valores de sus automóviles 0km son Chevrolet, Ford, Renault y Toyota, y se espera que pronto lo hagan Peugeot, FIAT, Citroën, Nissan y Volkswagen.', 'Al igual que en agosto pasado, este mes se da la particular situación de estar entrando al último período de 30 días del trimestre en el que tiene vigencia el mismo tope de categorías que determina si los modelos de automóviles pagan la escala 1 o la escala 2 del impuesto interno conocido como impuesto a los autos de lujo, o si quedan exceptuados. Por esa razón, vuelve a producirse el mismo fenómeno que entonces, cuando las marcas llevaron hasta el tope máximo posible a todos sus modelos que estaban debajo de la escala 1, generando una insólita situación en la que el auto más básico de un modelo se publica al mismo precio que el más equipado.', 'En este trimestre, sin embargo, debido a los dos meses con una inflación de dos dígitos que no hubo en junio, julio y agosto, la cantidad de autos que llegaron al tope es mayor y el período de tiempo en que lo hicieron fue menor, ya que en las listas de precios de octubre, ya se podían encontrar varios modelos con el mismo precio.', 'Entre las cuatro marcas que actualizaron sus valores, era en Chevrolet sobre la que mayor expectativa había en el mercado, ya que en el mes de octubre, prácticamente habían replicado los precios de septiembre sin cambiar ningún valor importante, salvo por los dos modelos más accesibles, sobre los que aplicaron un 4,5 por ciento.', 'En noviembre, nuevamente esos dos modelos, el Chevrolet Onix Joy y Joy Plus, volvieron a tener una actualización de precios subiendo un 5% hasta alcanzar el tope del impuesto interno. Así, todas las otras variantes de Onix que viene desde Brasil, tienen el mismo precio que en octubre, en $10.272.900.', 'En el resto del portafolios, en cambio, sí hubo otras actualizaciones de valores. En Cruze se mantuvo el mismo precio del mes pasado en la versión más accesible para quedar dentro del tope impositivo, pero las versiones que ya lo habían superado, fueron actualizadas un 15%. Lo mismo sucedió con el SUV Tracker, aunque en este caso sólo una versión subió ese 15% y fue la de mayor equipamiento, denominada Tracker 1.2T AT Premier, que pasó de $16.965.900 a $19.498.900. Finalmente, en el rubro pick-ups, ni la compacta Montana ni la mediana S10, en todas sus versiones, sufrieron cambios de precio sugerido, manteniéndose en el mismo valor de septiembre y octubre.', 'Ford también hizo ajustes en sus precios. La nueva generación de SUV Territory tuvo un aumento del 9,4% en su versión de acceso, conocida como SEL, pero no modificó el precio de la versión Titanium. También entre los SUV, mientras la nueva versión de Kuga híbrida no tiene precio publicado, la misma diferencia de Territory se aprecia en Bronco, donde aumentó la versión Big Bend un 13%, pero la Wildtrack se mantiene topeada.', 'En el segmento de las camionetas, las tres versiones de Maverick subieron un 11%, mientras que todas las de la pick-up de una tonelada, Ranger, aumentaron un 14%.', 'En Renault, sucede uno de los fenómenos enunciados al comienzo. La lista de precios completa de los modelos más accesibles ha llegado a su tope antes de entrar en la escala 1 del impuesto a los autos de lujo que recién se actualizará el 1 de diciembre. Así, la versión más económica de Sandero subió un 14,8% para llegar al mismo precio que las versiones más equipadas del modelo, de modo tal que la lista de precios de noviembre muestra todos los modelos de Sandero, Stepway, Logan, Captur y Kangoo de pasajeros en el mismo precio de $10.330.000.', 'Koleos no aumentó sus precios de octubre, y en el Kangoo furgón, que no paga impuesto a los autos de lujo por ser utilitario, aumentó toda la gama un 10%. Ese mismo porcentaje aumentaron las pick-up Alaskan, que tampoco pagan el impuesto interno, y todas, salvo la versión Emotion 4x2 que estaba en Precios Justos, la cual tuvo una actualización mayor por tener el precio sin ajuste durante dos meses.', 'Por último, la cuarta marca que publicó sus nuevos precios que rigen desde el 1 de noviembre es Toyota. Su auto más económico, el Etios, aumentó un 12,7%, y ese mismo porcentaje subió el precio de la versión más accesible del Yaris, el XS 1.5, mientras que el resto de la gama de ese modelo quedó igual porque está topeada cerca de 10,5 millones de pesos.', 'Con el Corolla sucedió algo similar. Las versiones más accesibles se mantienen en el precio “topeado”, y las que van del HEV a las GR-S, subieron el mismo 12,7%. Al contrario con Corolla Cross, donde las versiones económicas subieron hasta el tope de la categoría, igualando o acercándose a los precios que ya estaban frenados de las versiones superiores en equipamiento y prestaciones. Las pick-up y el SUV fabricados en Zárate, todas las versiones de Hilux como del SW4, también aumentaron un 12,7 por ciento.']",[],"['Fuerte suba de los 0km: en noviembre, algunos modelos registraron aumentos de precios por sobre la inflación']"
"['Un insólito enfrentamiento entre vecinos ocurrió en las últimas horas en el barrio porteño de Boedo, donde un hombre de 73 años sufrió una brutal golpiza por parte de una vecina que se enfureció cuando este le pidió que levantara la caca de su perro. Por las heridas, el adulto mayor debió recibir ocho puntos en la cabeza.', 'El hecho sucedió el pasado lunes al mediodía y quedó registrado por las cámaras de seguridad ubicadas en la calle Virrey Liniers al 1700, donde se desencadenó el episodio. Todo comenzó cuando la víctima se bajó de su auto recién estacionado y se cruzó con la mascota de una mujer, que se encontraba sin correa y defecando sobre el cordón de la vereda.', 'Su dueña estaba unos metros más adelante, ya que cuando el perro se detuvo a hacer sus necesidades, ella siguió caminando mientras miraba su celular. En consecuencia, el hombre comenzó a gritarle para llamar su atención y solicitarle que limpiara los desechos.', 'De acuerdo a lo que se ve en las imágenes, la chica pareció ignorar los reiterados llamados de atención del señor y continuó su marcha junto a su perro. Sin embargo, el hombre no se dio por vencido y la alcanzó segundos después. Comprometido en mantener la limpieza de la cuadra, la víctima comenzó a caminar detrás de ella pidiéndole nuevamente que corrija su actitud.', 'La insistencia hizo enfurecer a la mujer, quien luego de unos minutos finalmente se dio vuelta y sin mediar palabras se acercó de forma violenta a este. Primero lo golpeó hasta derribarlo, luego tomó un palo que se encontraba dentro de uno de los contenedores de basura ubicado en la vereda. Y fue con este que comenzó a atacarlo brutalmente.', 'En la grabación se ve cómo el hombre intentó escapar de la escena. Sin embargo, tras recibir el primer golpe, no logró recomponerse para huir del lugar. Mientras, la vecina siguió pegándole incesantemente con el objeto, el cual intercalaba con la correa del can para seguir lastimándolo.', 'Los violentos ataques hicieron que el señor cayera al suelo y se lastimara aún más la cabeza, donde recibió la mayoría de los impactos. Ante esta situación, el perro se acercó a él de una forma amistosa, pero que su dueña nunca cesó en su actitud violenta y continuó con la golpiza, de acuerdo a lo que se desprende de las imágenes.', 'Después de más de dos minutos, esta finalmente se retiró junto a su mascota, dejando al hombre malherido en el lugar. A raíz del hecho, se acercó al lugar personal de la Comisaría Vecinal 5B y una ambulancia del SAME, que lo trasladó a un hospital de la zona donde recibió asistencia médica y le curaron las heridas. La profundidad de alguna de ellas motivó que debieran darle ocho puntos en la cabeza, de acuerdo al parte posterior.', 'Su hijo, Sebastián, explicó lo sucedido en diálogo con C5N y señaló que la atacante ya había tenido otros problemas similares por actitudes con su perro.', '“Tuvo un inconveniente previo con los vecinos, no sé si está mal psicológicamente. Por lo que me contó mi papá, él le pidió que levante el excremento del perro. Ella no le dio bola, él le reiteró el pedido y ella le dijo ‘yo no levanto la caca del perro’. Luego pasó lo que se ve en el video”, contó el joven.', 'En este sentido, agregó que su padre además posee una discapacidad: tiene un pie cortado, lo cual lo imposibilita a estabilizarse rápidamente después de la primera caída.', 'Al respecto de cómo se encuentra a poco más de 72 horas del hecho, reveló: “Está muy dolorido. Le hicieron ocho puntos en la cabeza, tienen dolor de clavícula, de costilla, la rodilla inflamada y los brazos golpeados”.', 'A raíz del hecho, la agresora fue detenida y liberada horas más tarde por la justicia porteña, la cual determinó que no puede acercarse a menos de 200 metros del hombre ni contactarse con él. Según el abogado de la mujer, esta padece esquizofrenia. Asimismo, señalaron que no poseía antecedentes penales.']",[],['Una mujer atacó a palazos a un vecino de 73 años porque le pidió que levantara el excremento de su perro']
"['El papa Francisco habló este jueves por teléfono con el presidente de la Autoridad Palestina, Mahmoud Abbas, sobre los últimos acontecimientos en la Franja de Gaza, Cisjordania y Jerusalén, en medio de la guerra entre Israel y Hamas, según informó la agencia palestina de noticias WAFA.', 'Durante la llamada, Abbas destacó su gran aprecio por el papel y los esfuerzos del Sumo Pontífice para alcanzar la paz en Medio Oriente y en el mundo, de acuerdo a lo indicado por ese medio de comunicación.', 'El presidente de la Autoridad Palestina también destacó la necesidad de abrir corredores humanitarios permanentes para llevar materiales médicos y alimentarios y proporcionar agua y electricidad lo más rápido posible.', 'Además, mostró su rechazo al desplazamiento de palestinos de la Franja de Gaza, Cisjordania o Jerusalén y subrayó la necesidad de implementar una solución política basada en la legitimidad internacional para que el pueblo palestino obtenga su libertad, independencia y soberanía.', 'Por su parte, según WAFA, el Papa resaltó la importancia de establecer la paz y detener la guerra en esta región y en el mundo, y la necesidad de proporcionar ayuda humanitaria a todos lo más rápido posible, y expresó su profunda tristeza por las víctimas civiles.', 'Esta conversación entre Francisco y Abbas se dio un día después que el Sumo Pontífice manifestara su temor ante una posible escalada mundial del conflicto en Medio Oriente e insistiera en la “solución sabia” de los dos Estados entre Israel y Palestina.', '“Sería el final de muchas cosas y muchas vidas. Yo pienso que la sabiduría humana detenga estas cosas. Sí, existe la posibilidad, ¿no? A nosotros esta guerra nos toca por lo que Israel, Palestina, Tierra Santa y Jerusalén significan, pero también Ucrania porque está muy cerca”, dijo en una entrevista a la televisión pública italiana RAI emitida en la noche del miércoles.', 'En ese sentido, el pontífice argentino propuso “la solución sabia” de los dos Estados “bien delimitados con Jerusalén con un estatus especial”.', '“Siento que toda guerra es una derrota. No se resuelve nada con la guerra, todo se gana con la paz y el diálogo”, lamentó, para después denunciar que “no se encuentra la capacidad de reflexionar con claridad”, arremetiendo contra la industria de las armas.', 'Francisco recordó el estallido de la guerra en Siria al inicio de su pontificado y dijo que “no es bonito decirlo pero uno lamentablemente se acostumbra y no debemos acostumbrarnos”.', 'También denunció que “lamentablemente el antisemitismo sigue escondido” después del Holocausto y la Segunda Guerra Mundial.', 'El Papa también recordó al “pueblo mártir” de Ucrania y las “persecuciones” que sufrió en tiempos del dictador soviético Stalin: “Ha sido un pueblo que sufre mucho y ahora cualquier cosa les hace revivir eso. Yo les comprendo”.', 'Confesó, además, que entiende al presidente ucraniano, Volodimir Zelensky, en la defensa de la invasión rusa, pero reiteró su llamado por la paz: “Le entiendo pero se necesita la paz, deténganse un poco, alcancen un acuerdo de paz”.', 'El miércoles Francisco animó a rezar por quienes padecen las guerras actuales en el mundo y pidió no olvidar a Ucrania, Palestina o Israel y otras regiones del planeta, después de presidir el rezo del Ángelus.', '“Sigamos rezando por las poblaciones que sufren a causa de las guerras actuales. No olvidemos la martirizada Ucrania, no olvidemos Palestina, no olvidemos Israel, ni tantas otras regiones donde la guerra aún es demasiado fuerte”, dijo desde la ventana del Palacio Apostólico, en este día de Todos los Santos.', 'El pasado domingo, también después del Ángelus, el Papa urgió a declarar un alto el fuego en el conflicto entre Israel y el grupo terrorista Hamas, tras el ataque perpetrado el pasado 7 de octubre por los extremistas palestinos. “¡Cesad el fuego! ¡Cesad el fuego! ¡Cesad el fuego! Paren, hermanos y hermanas. La guerra siempre es una derrota”, repitió.', '(Con información de Europa Press y EFE)']",[],"['El papa Francisco habló con Mahmoud Abbas, presidente de la Autoridad Palestina, en medio de la guerra en Gaza']"
"['En el año 1600, un barco desgastado por las tormentas tocó tierra en Japón. A bordo estaba William Adams, un navegante inglés cuyo destino se cruzó con la hermética sociedad nipona. Gracias a sus habilidades marítimas y pese a las miradas inquisitivas y la desconfianza inicial, el extranjero supo impresionar al poderoso y futuro shōgun, Tokugawa Ieyasu. Bajo el nombre de Miura Anjin, Adams se erigió como un samurái respetado, simbolizando el flujo y reflujo de dos culturas. Su historia fue inspiración para la novela de James Clavell, Shōgun, la cual fue adaptada para la próxima serie épica homónima que llegará a Star+ en febrero de 2024.', 'La producción constará de 10 episodios y se centrará en la lucha del señor Yoshii Toranaga (Hiroyuki Sanada), quien enfrenta una amenaza contra su vida y honor cuando sus adversarios en el Consejo de Regentes conspiran en su contra. ', 'La trama se intensifica con la aparición de un barco europeo misterioso en un pueblo pesquero cercano, embarcación controlada por el marinero John Blackthorne (Cosmo Jarvis), quien posee un conocimiento naval que podría cambiar el equilibrio de poder en la región. Su presencia es considerada una amenaza para los sacerdotes jesuitas y los comerciantes portugueses.', 'Otro personaje clave es Toda Mariko (Anna Sawai), una noble cristiana y la última sobreviviente de una línea deshonrada. Mientras sirve a Toranaga, ella se encontrará en una encrucijada entre su lealtad a su señor, su fe y su incipiente relación con Blackthorne.', 'El elenco también incluye a actores japoneses destacados como Tadanobu Asano, Hiroto Kanai, Takehiro Hira, Moeka Hoshi y Tokuma Nishioka. La adaptación televisiva fue creada por Rachel Kondo y Justin Marks, con Marks desempeñándose como showrunner. Los productores ejecutivos incluyen a Michaela Clavell, Edward L. McDonnell y Michael De Luca.', 'Es importante mencionar que este título no es la primera adaptación del texto de Clavell. En 1980, se produjo una miniserie que contó con la actuación de Richard Chamberlain. Sin embargo, a diferencia de la versión original, que se centró principalmente en la perspectiva de Blackthorne, el nuevo proyecto también incluirá la perspectiva japonesa de la historia a través de los personajes como Toranaga y Mariko.', 'Combinando intriga política, drama y cultura; Shōgun se incluirá en el catálogo de Star+ en febrero de 2024.']",[],['“Shogun”: la épica serie inspirada en el gran líder militar que unificó Japón']
"['Los días previos a la final de la Copa Libertadores entre Boca Juniors y Fluminense se están viviendo con mucha intensidad en las calles de Río de Janeiro, donde miles de simpatizantes del equipo argentino viajaron en las últimas horas y coparon las principales playas de la ciudad costera de Brasil. Luego de ataque organizado de la barra de Flu a los hinchas argentinos que se registró a la tarde en Copacabana, y que terminó con una estampida, gases lacrimógenos y balas de goma, por la noche volvieron los incidentes cuando la policía carioca buscó desalojar la arena y ya se registraba la presencia de nuevos agresores, que llegaron a atacar a los visitantes.', 'Pasadas las 21 horas las imágenes de violencia contra los simpatizantes argentinos volvieron a registrarse con la represión policial que los obligó a desalojar las playas de Copacabana, cuando tras el primer conflicto había llegado la calma y los aficionados de ambas escuadras convivían en paz. Fue ahí que regresaron los conflictos y, tras la explosión de fuegos artificiales, llegó el accionar de las fuerzas de seguridad, que obligó a la gente a retirarse en medio de un nuevo desbande.', 'Pero los incidentes no fueron solo en las playas ya que también circularon imágenes de nuevos ataques pirañas de hinchas de Fluminense contra los de Boca Juniors. En uno de los videos se pudo ver cómo entre varios brasileños le pegaron a un simpatizante argentino.', 'Los testimonios de los incidentes continuaron y también hubo hinchas de Boca Juniors que fueron detenidos por la policía. Se pudo ver a tres de ellos que fueron esposados y subidos a un ómnibus de la fuerza de seguridad. Mientras tanto, uno de los efectivos le apuntó con su arma a otros hinchas argentinos que se ubicaron del lado de la playa. ', 'Más tarde las imágenes del caos mostraron cómo continuó el accionar policial sobre los simpatizantes argentinos, aunque también los efectivos se ocuparon de replegar a los torcedores del Fluminense que se acercaron a la zona donde estuvieron los hinchas de Boca Juniors. ', 'En tanto que la Conmebol efectuó un posteo en sus redes sociales y se expresó sobre los incidentes. “La Conmebol hace un llamado a los hinchas de Boca Juniors y Fluminense a compartir todos juntos los momentos de alegría y celebración que nos dan nuestro fútbol. Los valores del deporte que más nos apasiona deben ser inspiradores de conductas de paz y armonía. Por eso, repudiamos los actos de violencia y racismo que se puedan producir en el marco de esta final”, expresó la entidad sudamericana. ', 'El inicio de las hostilidades', 'En varios de los videos que comenzaron a circular en redes sociales grabados por hinchas que se encontraban pacíficamente disfrutando de la tarde se puede observar a un nutrido grupo de barras del Fluminense marchar por las calles cantando canciones de su equipo y luego yendo a buscar directamente a hinchas de Boca en las playas.', 'No es la primera vez que los torcedores del club brasileño hostigan a los visitantes, ya que días atrás hubo varios simpatizantes de Boca Juniors que terminaron con heridas por el ataque de los violentos, quienes además aprovecharon para robar las pertenencias de los argentinos. En otra imagen se vio a un simpatizante con los colores xeneizes siendo arrestado por la policía aparentemente por haber proferido insultos racistas contra el público brasileño.', 'El periodista de TNT Sports Ignacio Berzuk se encontraba en el lugar de los hechos realizando la cobertura y dio detalles del ataque de los barras de Fluminense a los simpatizantes de Boca, que estaban pacíficamente en la playa. “Fue un momento terrible lo que hemos vivido. La gente estaba tranquila y en paz cuando vinieron cientos de hinchas aparentemente de la torcida del Fluminense a molestar y a agredir, directamente”, comenzó a relatar.', '“Han robado carteras, han agredido a las mujeres, a niños y a los hombres. A todos. La policía brilló por su ausencia, tardaron en llegar siete minutos. No había ningún policía alrededor de la gente de Boca. En el Fan Zone estaban los hinchas del Fluminense al lado de los de Boca”, continuó el cronista desde Río de Janeiro.', 'En otro de los crudos testimonios de los simpatizantes de Boca agredidos por la barra del Fluminense, un fanático que viajó desde México rompió en llanto: “Es hora de parar con esto. Esto no es fútbol. No nos metimos con nadie y vinieron a quitarnos todo. Nos robaron carteras, nos pegaron y nos revolearon sillas y palos, de todo. No viajamos para que nos acribillen a golpes”.', 'Por su parte, el periodista Emiliano Espinoza también presenció la barbarie mientras realizaba su cobertura para el canal La Nación +. “Nos llamó la atención ver a los hinchas del Fluminense caminar en bloque por la avenida. El camarógrafo me dijo: ‘Vamos porque acá algo va a pasar’. Nadie estaba escoltando a estos hinchas, que ingresaron a la playa. La policía militar comenzó con los balazos de goma a los hinchas de Boca y con gases lacrimógenos. A los hinchas le robaron todo”, dijo.']",[],"['Estampida, balas de goma y gases lacrimógenos: las imágenes del ataque de barras de Fluminense a hinchas de Boca en Río de Janeiro']"
"['“En democracia las personas tenemos derechos, no somos meros consumidores ni objetos de tráfico económico”, dijo José Luis Rodríguez Zapatero, en un video de 3 minutos y 33 segundos difundido este jueves 2 de noviembre, en el que manifestó su deseo de que Sergio Massa gane el balotaje frente a Javier Milei y se convierta en el nuevo presidente de Argentina.', 'El ex jefe de Estado español compartió su mensaje a 17 días de la segunda vuelta para definir al próximo gobierno argentino. Con elogios hacia el pasado reciente en el país, llamó a defender la democracia. Para ello, puso como ejemplo hitos como el juicio a las Juntas Militares por parte de tribunales civiles, luego de la última dictadura militar, y la vigencia de las Madres de Plaza de Mayo como ícono de resiliencia y reclamo de justicia.', 'Tras esa introducción, apoyó a Massa. “Un país no es una empresa, es patria y Justicia. Una patria que convoca a vivir un destino común, y de solidaridad”, dijo, y luego afirmó: “Quiero expresar desde mi máximo respeto democrático mi apoyo a Sergio Massa. Por sus convicciones democráticas, porque defiende a la democracia, sabe muy bien que el trabajo fundamental es defender a los más débiles, a los trabajadores, a los pensionistas. como está haciendo en este momento de dificultad”.', 'Luego de enumerar una serie de virtudes que encuentra en el candidato de Unión por la Patria, Rodríguez Zapatero marcó un contraste - sin nombrarlo - con Javier Milei, el líder de La Libertad Avanza y próximo adversario de Massa. “Una sociedad debe mantener sus valores. En democracia las personas tenemos derechos, eso significa que no somos meros consumidores, ni objetos de tráfico económico, ni de ningún otro tráfico”, señaló.', 'Luego, el histórico referente del Partido Socialista Obrero Español (PSOE), continuó enumerando argumentos por los que considera que Massa es el dirigente que debería presidir el país a partir del 10 de diciembre. “Defiende los principios de igualdad entre hombres y mujeres, ese principio que transforma al mundo, esencial del siglo XXI”.', '“Apoyo a Sergio Massa porque cree en la Argentina, en lo argentino, no espera recibir lecciones de ningún otro país”, añadió.', 'Además, se mostró informado respecto de uno de los ejes que el candidato de Unión por la Patria esbozó en medio de su campaña, el llamado a la Unidad Nacional luego de las elecciones. “Ha hecho una convocatoria por la unidad nacional, por los grandes consensos, por superar las divisiones. Porque siempre que lo escucho veo a una persona que tiene a la Argentina en la cabeza y va a hacer un gobierno en favor de la dignidad, los derechos y de las sociedades abiertas”, continuó.', '“Deseo que esta Argentina, a la que admiro, en la que creo, pueda tener un futuro próspero de recuperación económica, de igualdad social, manteniendo sus grandes valores democráticos y ese talento, esa cultura, ese ingenio, que quizás pocos países en el mundo tienen”, concluyó.', 'Rodríguez Zapatero fue presidente de España entre 2004 y 2011. El PSOE, el partido al que pertenece, mantuvo coincidencias históricas con el peronismo en Argentina. Una de las últimas apariciones públicas de Rodríguez Zapatero en Argentina ocurrió en marzo, en el Centro Cultural Kirchner (CCK), junto a la ex presidenta Cristina Kirchner y líderes del progresismo en la región.', 'En contraste, la presidenta de la Comunidad de Madrid, Isabel Díaz Ayuso, referente del Partido Popular (PP), había expresado antes sobre las elecciones en nuestro país que “ahora queda una segunda vuelta y nada desearía más que el cambio político en Argentina”, en una señal de apoyo a Javier Milei.', '“No puede seguir cayendo, cayendo y cayendo mientras cada vez más argentinos vienen a vivir entre nosotros, pidiendo que abramos los ojos, no solo porque España lleva una deriva parecida, sino porque en el momento en el que ya se han traspasado todas las líneas, la alternancia política se va complicando más”, agregó, en oposición, Díaz Ayuso.']",[],['Rodríguez Zapatero expresó su apoyo a Sergio Massa: “Defiende los principios de la democracia”']
