body,img,title
"['Sorpresa en el fútbol argentino: Mauro Boselli anunció su retiro del fútbol. El delantero de 38 años escribió una extensa carta en sus redes sociales para comunicar la decisión, que se hará efectiva a fin de año, luego de sus últimos partidos con Estudiantes. Sus inicios en Boca Juniors estuvieron marcados por su sana competencia con Martín Palermo, pero el atacante logró una de sus mejores versiones con la camiseta del elenco platense.', '“Imposible decir adiós, sin antes decir gracias… Hoy les quiero contar que, cuando termine la temporada, cerraré mi carrera como futbolista profesional”, inició el mensaje escrito en su cuenta personal de Instagram. El punta deja atrás un extenso camino en el Xeneize, Málaga de España, Genoa y Palermo de Italia, Wigan de Inglaterra, León de México, Corinthians de Brasil y Cerro Porteño de Paraguay. Sus estadísticas goleadoras marcan la conquista de 266 tantos en 617 encuentros como jugador profesional.', 'En la misiva, Boselli recorre los distintos pasos de su trayectoria. Su llegada a la Ribera de la mano de Ramón Maddoni es parte de su relato, como así también la Copa Libertadores 2007 ganada con la entidad Azul y Oro y puntualiza en su arribo al Pincha, uno de los dos clubes de los cuales se enamoró en conjunto con el León mexicano: “No sólo por haber alzado una Copa Libertadores con un maestro como Alejandro Sabella, sino porque allí encontré los mismos valores que me enseñaron en mi casa y entendí que ‘acá hay una escuela’ y no es solo una forma de sentir el fútbol, sino de vivir la vida”.', '“Después de dos hermosos años, cumplí el sueño de jugar en Europa y de enfrentar a futbolistas que siempre admiré. Estar en la élite me permitió tener la chance de vestir la camiseta de nuestro país. Otro sueño cumplido”, analizó sobre sus cuatro partidos en la selección argentina. Una victoria por 2-0 ante Ghana en 2009 marcó su debut con Diego Maradona como entrenador y se despidió de la Albiceleste en un empate sin goles ante Brasil disputado en septiembre de 2011. Metió un solo tanto ante Nigeria en la derrota 1-4 disputada en junio de ese año.', 'A continuación, lanzó una crítica personal sobre su paso por el Viejo Continente: “En Europa las cosas no fueron tan buenas como esperaba, pero todo pasa por algo”. Solo marcó 9 festejos en 43 encuentros.', 'Luego de sendos pasos por distintos países de Latinoamérica, contó por qué regresó a la Argentina antes de colgar los botines: “Sentía que el final tenía que ser en un lugar especial, y gracias al Pincha eso fue posible. Regresar con la incertidumbre de volver al fútbol argentino y estar a la altura. Siento que no le fallé. Fue hermoso que mis hijas puedan escuchar y sentir ese “Boseeeelli, Boseeeeeelli…”. “Gracias, Estudiantes. Mi agradecimiento será eterno”, remató el goleador.', 'De cara a su adiós del fútbol, Infobae lo entrevistó en mayo pasado y, en una extensa charla, se refirió a cuando llegue ese día: “Lo vivo como un desafío más. Hoy, gracias a todo lo que me perdí para ser jugador de fútbol, tengo un buen pasar económico y puedo decidir dónde quiero vivir. Ese tiempo que tendré es para usarlo en ver qué viene después, cómo hago para generar, porque se te cortan todos los ingresos una vez que no sos más jugador de fútbol. Con lo que juntaste, mucho o poco, tenés que tratar de no ir todos los días a meter la mano en el bolso. Tenés que generar situaciones e inversiones para seguir viviendo sin meter la mano en el bolsillo. Creo que sigue habiendo desafíos, que no tienen nada que ver con el fútbol, pero también son importantes porque es de lo que vas a vivir el resto de tu vida”.', 'El regreso de Mauro Boselli a Estudiantes no pudo ser mejor a nivel individual. Luego de su arribo a comienzos de 2022, el delantero fue el máximo artillero de la Copa de la Liga en su primer torneo local y, en este año, acumula 13 tantos y 2 asistencias en 39 encuentros. Su aporte será fundamental en la recta final del semestre con los duelos ante Defensa y Justicia, Central Córdoba y Lanús, último partido como local en La Plata, por el certamen doméstico. Además, su equipo deberá afrontar las semifinales de la Copa Argentina ante Boca Juniors, un trofeo clasificatorio a la Copa Libertadores 2024.', 'El mensaje completo de Mauro Boselli', 'Imposible decir adiós, sin antes decir gracias…', 'Hoy les quiero contar que, cuando termine la temporada, cerraré mi carrera como futbolista profesional.', 'Todo empezó cuando mi abuelo me llevó a Barracas Juniors. Allí fueron mis primeros pasos, con Rafa y Conejo como entrenadores.', 'Mi debut en cancha de 11 fue en All Boys, hasta que apareció un tal Ramón Maddoni para llevarme a Boca, donde me formé como jugador y me dio la posibilidad de debutar en primera. Pero, como le pasa a muchos, me fui de joven a Málaga para juntar experiencia. Después de un año, volví a Boca, pude ganar mi primera Libertadores y consolidarme como jugador profesional.', 'Por mediados del 2008 llegue a Estudiantes, uno de los dos clubes de los que me enamoré. No sólo por haber alzado una Copa Libertadores con un maestro como Alejandro Sabella, sino porque allí encontré los mismos valores que me enseñaron en mi casa y entendí que “acá hay una escuela” y no es solo una forma de sentir el fútbol, sino de vivir la vida. Después de 2 hermosos años, cumplí el sueño de jugar en Europa y de enfrentar a futbolistas que siempre admire. Estar en la élite me permitió tener la chance de vestir la camiseta de nuestro país. Otro sueño cumplido.', 'En Europa las cosas no fueron tan buenas como esperaba pero todo pasa por algo.', 'Recibí la llamada de Gustavo Matosas, que hizo que conociera mi otro gran amor: León de México. La historia fue maravillosa: un bicampeonato, ser máximo goleador 3 veces y ser uno de los máximos goleadores de la historia de la institución. Ser Fiera, para mí, sin lugar a dudas fue, es y será un orgullo.', 'Pero tocó hacer las valijas una vez más. Primero Corinthians y luego Cerro Porteño, dos equipos enormes de América, con hinchadas muy pasionales donde en poco tiempo me brindaron todo su cariño y tuve la dicha de ser campeón.', 'Pero sentía que el final tenía que ser en un lugar especial, y gracias al Pincha eso fue posible. Regresar… con la incertidumbre de volver al fútbol argentino y estar a la altura. Siento que no le fallé.', 'Fue hermoso que mis hijas puedan escuchar y sentir ese ‘Boseeeelli, Boseeeeeelli…’', 'Gracias, Estudiantes. Mi agradecimiento será Eterno.']",[],['Mauro Boselli anunció su retiro del fútbol con una emotiva carta']
"['La dieta de volumen es un plan nutricional adoptado principalmente por deportistas y fisicoculturistas que buscan aumentar su masa muscular. ', 'Se caracteriza por el consumo de más calorías de las que se gastan durante el día, según mencionó la docente especialista en nutrición, Nayla Bustamante Morales, para Infobae.', 'La especialista explicó que este régimen también se centra en alimentos ricos en proteínas, que son esenciales para la construcción de tejido muscular, pero también incluye una cantidad significativa de carbohidratos y grasas saludables. “Los carbohidratos proporcionan la energía necesaria para los entrenamientos intensivos, mientras que las grasas saludables son fundamentales para el correcto funcionamiento hormonal”, añadió.', 'Las palabras de la experta son respaldas por un estudio publicado por la revista Journal of Sports Sciences que examina el papel de la proteína en la nutrición deportiva y cómo afecta a los atletas. La conclusión es que la ingesta de proteínas puede optimizar la adaptación física durante los períodos de entrenamiento, mejorar la recuperación, el rendimiento durante y después de la competición.', 'La investigación señaló que se sugiere que la dosis óptima de proteína para maximizar su síntesis en los músculos está en el rango de 20 a 25 gramos. Además, puede actuar como un desencadenante importante para afectar los cambios fenotípicos inducidos por el ejercicio en los atletas. La leucina, en particular, ocupa una posición destacada, esencial para mejorar la recuperación y adaptación mediada por proteínas.', 'De acuerdo con un estudio de Journal of the International Society of Sports Nutrition, se encontró que la ingesta de proteínas de 3,4 g/kg/d, junto con un riguroso programa de entrenamiento de resistencia, promovió mejoras significativas en la composición corporal. Los participantes exhibieron aumentos notables en la masa muscular magra, acompañados de una reducción en la grasa corporal.', 'Bustamante brindó una recomendación para quienes deseen aplicar este tipo de régimen. “Es relevante señalar que, aunque la meta principal de la dieta de volumen es promover la ganancia muscular, esta debe realizarse de una manera controlada y equilibrada para evitar el aumento excesivo de grasa corporal”, declaró.', '“Idealmente, este tipo de dieta debería estar asesorada por un nutricionista o un experto en dietética deportiva para asegurar que se cubren todas las necesidades nutricionales del individuo. Este régimen alimenticio no es para todos, ya que antes el individuo debe someterse a exámenes rigurosos. Es mi opinión”, recalcó la profesora.', 'De acuerdo con la especialista, los alimentos que contienen proteínas son pechuga de pollo sin piel, claras de huevo, pavo, pescado (por ejemplo, el salmón y atún), carne roja, legumbres (como lentejas, garbanzos), lácteos bajos en grasa (yogurt) y frutos secos (almendras, nueces).', 'Asimismo, panes integrales, arroz integral, patatas o papas, avena, quinoa, frutas como las manzanas, plátanos y naranjas, lentejas y otras legumbres, verduras de raíz (zanahorias) son fuentes de carbohidratos.', 'Por su parte, según Bustamante Morales, los alimentos ricos en grasas saludables son aguacate, aceite de oliva, frutos secos (almendras, nueces, pistachos), semillas (como chía, calabaza y lino), pescado graso, como el salmón y la caballa, huevos, aceitunas, mantequilla de almendra o queso.', 'La experta en Nutrición recordó que lo más importante es armar una comida balanceada, debido a sus beneficios para la salud. “Una alimentación equilibrada contribuye a la prevención de diversas enfermedades como la obesidad, el colesterol alto, la diabetes, el cáncer, entre otras”, mencionó.', '“Además, ayuda en la gestión del peso, ya que promueve un equilibrio entre la ingesta calórica y la energía utilizada en el cuerpo. Asimismo, al consumir una variedad de alimentos nutritivos, se promueve un aumento de bienestar y satisfacción, lo que permitirá desarrollar mejor las actividades durante el día”, añadió para Infobae.']",[],['Qué es la dieta de volumen y por qué es la favorita entre los deportistas']
"['Fortalecer y tonificar los glúteos no es algo que sólo deba despertar interés en aquellos que buscan lucir mejor un traje de baño en verano. Es que los músculos que lo conforman se encuentran en el centro del cuerpo, por lo que, participan en la mayoría de los movimientos fundamentales que una persona lleva a cabo a diario.', 'En rigor de verdad, cuando se habla de “glúteo” se hace referencia a un grupo de tres músculos: el glúteo mayor (es el más grande y el que más influye en la estética; es responsable de la extensión y rotación de cadera), el glúteo medio (es esencial para dar estabilidad a la pelvis) y el glúteo menor (está ubicado debajo del glúteo medio y se encarga de dar estabilidad para que los otros tengan fuerza).', 'Juntos, en la zona media del cuerpo, son los responsables de proezas deportivas como correr más rápido y saltar más alto, pero también participan en actividades cotidianas como subir escaleras, levantarse de una silla o subir y bajar de un auto.', 'Para todas estas actividades -y más- es fundamental tener los glúteos fortalecidos, más aún de cara a la edad adulta.', 'Daniel Richter es entrenador personal certificado y explicó que “debido a que los glúteos se encuentran en el centro del cuerpo, participan en la mayoría de los movimientos fundamentales”. Según dijo a Well + Good, “a medida que las personas envejecen, los glúteos son uno de los músculos más importantes para mantener la libertad de movimiento, incluida la capacidad de realizar movimientos cotidianos como simplemente levantarse de una silla”.', 'Con él coincidió su colega Heather Carroll, entrenadora personal certificada, quien refirió que “dado que las personas pasan gran parte de sus días sentadas frente a computadoras o en un automóvil, trabajar los glúteos evita que se alarguen y comiencen a sentirse demasiado tensos”.', 'Además, “los glúteos ayudan a mantener la pelvis alineada con la columna para mantener una postura óptima”, agregó, al tiempo que remató: “Los músculos de los glúteos trabajan directamente con los músculos centrales, manteniendo la pelvis apuntando directamente hacia el suelo en lugar de inclinarse hacia atrás o hacia adelante”.', 'Ya sea en el gimnasio o en casa -con o sin equipamiento- reconocidos entrenadores compartieron cinco ejercicios para trabajar los glúteos de manera efectiva.', '1- Sentadillas', 'Según Richter, “la sentadilla ejercita los glúteos en un amplio rango de movimiento, estirando los músculos bajo carga en la parte inferior de la sentadilla”. “Se ha demostrado que trabajar un músculo en un largo rango de movimiento bajo carga es importante para el crecimiento y la fuerza muscular”, precisó, al tiempo que citó un estudio de 2019 que demostró que realizar sentadillas profundas resultó en el doble de mejoras observadas con medias sentadillas, a pesar de entrenar con cargas más livianas.', 'La entrenadora personal Amy Schemper recomendó a quienes se inicien en la práctica de este ejercicio “comenzar con una sentadilla sentada en una silla (bajando hasta la silla para cada sentadilla sin poner el peso sobre ella), durante tres series de diez repeticiones”. “Esto ayudará a desarrollar la forma mientras se construye fuerza -explicó-. Muchas personas no bajan lo suficiente en las sentadillas, lo que no sólo ejerce una presión adicional sobre las rodillas, sino que hace que la sentadilla sea más dominante en los cuádriceps y menos en los glúteos. Usar una silla o un banco es una excelente manera de aumentar la movilidad y entrenar el cuerpo para agacharse en las sentadillas”.', 'Para los deportistas más avanzados, aconsejó ponerse en cuclillas con mancuernas, pesas rusas o una barra para mejorar la estructura muscular al agregar resistencia adicional. Además, “incorporar una mini banda circular alrededor de los muslos activará los abductores y estimulará los glúteos en el proceso”, destacó.', 'Cómo hacerla', 'Para realizar una correcta sentadilla, los expertos explicaron que hay que pararse erguido con los pies separados a la altura de las caderas, los hombros hacia atrás, el pecho hacia arriba y el core comprometido. Doblar las rodillas y colocar las caderas completamente hacia atrás como si se estirara el trasero hacia atrás para sentarse en una silla mientras mueve los brazos hacia adelante frente a sí mismo para contrarrestar. Cuando los muslos estén paralelos al suelo, presionar con los talones para volver a levantarse. Hacer de 20 a 50 repeticiones.', '2- Empujes de cadera', 'Para Schemper, los empujes de cadera son uno de los mejores ejercicios para activar los glúteos porque aíslan los glúteos mediante la extensión de la cadera y dependen menos de los cuádriceps y los isquiotibiales para ejecutar el levantamiento.', '“Lo que me encanta de los empujes de cadera es que casi cualquiera puede realizarlos -señaló-. Puede comenzarse con empujes de cadera con el peso corporal, como un levantamiento básico de cadera con puente, y luego elevar la parte superior del cuerpo y agregar pesas o una banda circular para quemar más”. En opinión de Richter, “uno de los beneficios es que los empujes de cadera facilitan la activación de los músculos durante todo el ejercicio”.', 'Cómo hacerlo', 'A la hora de explicar el ejercicio, los expertos en fitness sugirieron colocar los omóplatos en un banco con el cuerpo a un lado de modo que las rodillas estén dobladas 90 grados, los pies separados al ancho de los hombros y las caderas levantadas en posición de mesa. Sostener pesas o una barra a lo largo de las caderas. Bajar las caderas hacia el suelo, luego levantarse hasta que los muslos queden paralelos al suelo. Completar diez repeticiones controladas por serie.', '3- Sentadillas divididas búlgaras', 'Debido a que para hacer este ejercicio hay que pararse sobre una pierna cada vez, las sentadillas divididas búlgaras trabajan los estabilizadores de la cadera: el glúteo medio y menor. “Trabajar una pierna a la vez también significa que puede encontrarse e igualar cualquier diferencia de fuerza de un lado a otro, aunque es completamente normal estar un poco más estable en un lado que en el otro”, explicó Richter.', 'Schemper agregó que una postura a la distancia de las caderas es de gran ayuda al ejecutar este ejercicio. “Un gran consejo para la preparación es sentarse en el banco con una pierna doblada y la otra extendida al frente. Manteniendo el pie delantero de la pierna extendida en su lugar, levántese y coloque la pierna doblada en el banco”, destacó.', 'Cómo hacerlas', 'Pararse aproximadamente a un metro delante de un banco o escalón, de espaldas y con la parte superior del pie trasero sobre el banco detrás. Las piernas deben estar separadas a la altura de los hombros y el pie delantero debe estar lo suficientemente adelantado para que cuando se haga una estocada, la rodilla delantera no se extienda más allá de los dedos del pie. Manteniendo los hombros hacia atrás y el core comprometidos, doblar la rodilla delantera para realizar una estocada dividida. Cuando el muslo de la pierna delantera esté paralelo al suelo, presionar con el talón para volver a la posición de pie. Completar de ocho a 10 repeticiones por pierna por serie. Para un desafío adicional, pueden sostenerse mancuernas en cada mano con los brazos hacia los costados.', '4- Peso muerto', 'A Kent Probst, entrenador personal certificado y fundador de Long Healthy Life Blog, le gusta que el peso muerto imita la función de los glúteos en la vida cotidiana, como cuando se levanta algo del suelo. Es debido a su funcionalidad que a menudo se piensa que el peso muerto es el ejercicio de cuerpo completo más eficaz.', '“El peso muerto es un ejercicio potente para desarrollar esos glúteos porque involucra muchos músculos simultáneamente”, dijo, y si bien puede ser bastante difícil de hacer con barra, el movimiento se puede realizar como ejercicio de glúteos en casa con mancuernas. “Esta variación es la mejor opción si alguien está empezando a entrenar -sostuvo-. El peso muerto con barra requiere un nivel significativo de habilidad técnica para ejecutarlo correctamente, y comenzar con variaciones con mancuernas también ayudará a desarrollar fuerza y confianza”.', 'Cómo realizarlo', 'Pararse con los pies separados al ancho de los hombros, los brazos a los lados y una mancuerna delante de cada tobillo. Doblar las rodillas para sentar las caderas hacia atrás lo más posible hasta estar lo suficientemente bajo como para alcanzar y agarrar las pesas mientras se mantiene la espalda recta y el pecho hacia arriba. Involucrar el núcleo para levantar las mancuernas mientras se levanta el cuerpo hasta la posición de pie. La espalda debe permanecer recta y las pesas deben seguir verticalmente a lo largo de las espinillas. Volver a sentar las caderas hacia atrás para bajar lentamente las pesas al suelo. Mantener la barbilla erguida y mirar hacia adelante. Realizar de 10 a 12 repeticiones por serie.', '5- Puentes de glúteos con una sola pierna', 'Los puentes de glúteos con una sola pierna pueden ser un punto de partida fantástico para cualquier entrenamiento centrado en los glúteos, especialmente cuando se trata de desequilibrios, coinciden los especialistas.', 'Además, pueden ser un gran calentamiento antes de las sentadillas. “La clave aquí es moverse deliberadamente, concentrándose en usar los glúteos para impulsar las caderas hacia arriba y controlarlas mientras bajan. Esta práctica ayuda a despertar esos glúteos y potencialmente puede mejorar el rendimiento en sentadillas y el reclutamiento de glúteos durante los ejercicios de la parte inferior del cuerpo”, explicaron', 'Cómo realizarlo', 'Acostarse boca arriba con las rodillas dobladas, un pie apoyado en el suelo y el otro estirado hacia arriba en el aire. Apretar los glúteos para levantar las caderas hasta que el cuerpo forme una línea larga desde las rodillas hasta los hombros. Mantener y apretar para respirar y luego bajar lentamente. Repetir 15 veces, luego cambiar de lado.', 'Según los profesionales, “uno de los errores más comunes que se deben evitar durante los puentes de glúteos con una sola pierna es apresurar el movimiento y no concentrarse en el músculo que se está tratando de entrenar. Se debe asegurar mantener un ritmo deliberado y concentrarse directamente en ejercitar esos glúteos para obtener el máximo beneficio”.', 'Si bien los expertos coincidieron en que “no es necesario hacer todos estos ejercicios cada vez que se entrena, mezclar y combinar tres o cuatro en los entrenamientos habituales proporcionará la variedad que se necesita para desarrollar unos glúteos fuertes”.', 'Pueden hacerse ejercicios de glúteos todos los días sólo si se entrena liviano, aconsejó Richter. “Si se hace un entrenamiento más desafiante, generalmente es una buena idea de una a tres veces por semana, con un punto ideal alrededor de dos veces por semana”.', 'A medida que se avanza, puede aumentarse el volumen de entrenamiento, pero siempre de manera progresiva.']",[],['Cinco ejercicios de glúteos que potencian la zona media y mejoran la postura']
