body,img,title
"['Los meses de octubre y noviembre son el período de mayor exuberancia de color en el Rosedal de Palermo: hay gran cantidad de rosas en flor que van desde el blanco y el amarillo al naranja, el rojo y el rosado, además de las que tienen combinaciones multicromáticas. Unas 18 mil rosas florecen a lo largo de estas semanas en los más de 8.000 rosales.', '“Invitamos a todos nuestros vecinos a disfrutar de este espectáculo natural único y contemplar las diversas variedades de especies que se conservan en el rosedal de Palermo”, señaló Julia Domeniconi, secretaria de Atención Ciudadana y Gestión Comunal de la Ciudad, y agregó: “Expertos en jardinería trabajan todo el año para que este espacio emblemático de Buenos Aires mantenga su riqueza medioambiental y ornamental preservando el diseño paisajístico con el que fue creado un siglo atrás”.', 'El Rosedal abarca una superficie de 3,4 hectáreas dentro del Parque 3 de Febrero. En él relucen 93 especies diferentes de rosas: las más comunes son la rosa Sevillana, la Johan Strauss, la Elina, la Charles Aznavour y la Frederic Mistral. Además, en el espacio se destacan estructuras arquitectónicas como el puente griego, que cruza el lago; un anfiteatro, un patio andaluz y el Jardín de los Poetas donde 26 bustos recuerdan a personajes célebres como Alfonsina Storni, Dante Alighieri, William Shakespeare y Jorge Luis Borges, entre otros.', 'En esta época del año, este parque se llena de flores que brotan sin cesar, llegando a alcanzar unas 18.000. “Desde la Comuna 14 hace ya varios años se viene realizando un trabajo participativo con los vecinos para que participen en los cuidados de las plantas”, destacó Martín Cantera, presidente de la Comuna.', 'Una de ellas es Connie Moreno Quintana, paisajista experta en rosas y colaboradora del espacio, que recuerda que estos son los meses de mayor esplendor para el Rosedal. “Es cuando se produce la primera floración de las rosas, cuando nacen las flores más grandes y se lucen sus colores”, explica la especialista.', '“En el parque hay muchas rosas francesas de Meilland, también hay inglesas de Austin y otras alemanas; hay rosas antiguas y también un sector de estas flores de concurso y una gran colección de las trepadoras, algunas con medalla; otras se ubican en la gran pérgola inaugurada en 1914, año en que el lugar se llenó de rosas antiguas, muy perfumadas y que hoy contiene variedades como la Pierre de Ronsard, una de las más lindas, que no se caracteriza tanto por una gran fragancia pero sí por la belleza única de sus flores colgantes, por el color crema con bordes rosados”, apunta la paisajista.', 'El diseño del Rosedal es de 1914, cuando el gran jardín fue inaugurado bajo la dirección de Benito Carrasco. “Tiene un estilo francés con canteros simétricos y espejados, y una arteria central que se prolonga desde la entrada hasta el Puente griego”, señala Moreno Quintana e invita a contemplar desde lo alto de este puente “la vista maravillosa de nuestro querido rosedal”.', 'También explica que, si bien el período de mayor esplendor de estos jardines se produce en esta época de la primavera, la floración de los rosales abarca unos nueve meses: “El otoño también increíble en su florecimiento”, destaca.', 'Bajo las indicaciones del ingeniero agrónomo Nicolás Corbatta, un equipo compuesto por una docena de jardineros se encarga del cuidado del espacio desde hace más de una década. “Ellos conocen el rosedal y hacen podas magníficas, junto a la labor que desarrolla el equipo gerencial, especialmente a cargo de Martín Cantera y Marcelo Fontela Vidal”, añade Conie.', 'Desde 2015, con la llegada de los meses fríos, los vecinos se pueden llevar un esqueje luego de la poda de los rosales. En ese momento, se los entregan para plantar en los hogares. Así fue como Moreno Quintana conoció el espacio y logró reproducir rosales, llegando incluso a exponer parte de sus ejemplares en una exposición de la Asociación Argentina de Rosicultura.', 'El Rosedal fue declarado Patrimonio de Interés Cultural en el año 2011, y al año siguiente, fue premiado con el Garden Excellence Award, un reconocimiento internacional otorgado por la Federación Mundial de las Sociedades de Rosas (WFRS). Cada año, llega un jurado del premio que evalúa sus condiciones para mantener la calificación, y la Comuna trabaja con la Asociación Argentina de Rosicultura en su cuidado.', 'Junto a los rosales, Buenos Aires dispone de otras numerosas especies vegetales adaptadas a variadas condiciones ambientales. Regidas actualmente por el Plan Maestro de Arbolado Público, las plantaciones que se realizan cada año en la Ciudad se iniciaron originalmente siguiendo los principios del higienismo, una teoría desarrollada en Europa que justificaba la presencia de los vegetales en el entorno urbano por cuestiones ornamentales y de salud.', 'La Ciudad dispone, además, de un Censo del Arbolado Público disponible para consulta en el portal Arbopedia, la ‘wikipedia de los árboles’ de Buenos Aires. El registro se compone de descripciones con la geolocalización de los ejemplares y sus características, información que, junto a las labores de control y mantenimiento de nuestros árboles, permite una adecuada administración y mantenimiento de nuestro bosque urbano.']",[],['Más de 8 mil rosales ya despliegan su colorido en el Rosedal de Palermo: cuándo se puede visitar el parque']
"['Estados Unidos impuso el jueves una nueva ronda de sanciones a 130 empresas y personas de Turquía, China y Emiratos Árabes Unidos que supuestamente ayudan a Rusia en la adquisición de equipos clave para sostener su esfuerzo bélico contra Ucrania, incluidos los componentes de los que Moscú depende para sus sistemas de armas.', 'Las sanciones de la Oficina de Control de Activos Extranjeros del Departamento del Tesoro (OFAC) buscan golpear las capacidades industriales, tecnológicas y financieras de Rusia, así como evitar la evasión de las miles de sanciones económicas que los aliados de Ucrania impusieron a la infraestructura rusa y a sus funcionarios, bancos y oligarcas.', 'Una parte importante de las nuevas sanciones se centra en la interrupción de las cadenas de suministro internacionales de Rusia. Dado que Rusia no puede producir gran parte de la tecnología y equipo que necesita, depende de proveedores de terceros países para adquirir los componentes necesarios. Esto ha llevado a la explotación de relaciones económicas con países como China, Turquía y los Emiratos Árabes Unidos, que se han convertido en centros de exportación y reexportación de tecnología y equipo extranjero a Rusia.', 'En lo que respecta a China, el Tesoro indicó que sancionó a las empresas tecnológicas Jiahehengde y Shangyixianda, responsables de realizar cientos de envíos a Rusia de equipos electroópticos, cámaras, equipos de telecomunicaciones y otros componentes electrónicos, y China Taly Aviation Technologies, que ha enviado componentes de radar a un fabricante ruso de misiles de propiedad estatal para su uso en sistemas avanzados de misiles antiaéreos.', 'La OFAC menciona además varias entidades y empresas en Turquía que han enviado bienes de alta prioridad a Rusia, como circuitos electrónicos integrados, capacitores de tantalio y máquinas para el procesamiento de metales. Se señala que algunas de estas empresas han trabajado con clientes de la industria militar rusa para adquirir tecnología sensible de origen estadounidense.', 'Finalmente, el Tesoro sancionó a una serie de empresas de los Emiratos Árabes Unidos que supuestamente enviaron equipos de aviación, máquinas para la recepción de datos y otros.', 'Entre los sancionados emergen algunas figuras que tuvieron un papel destacado en favorecer la elusión de las sanciones y el suministro de componentes clave a Rusia.', 'El ciudadano turco Berk Turken y sus empresas, supuestamente vinculadas a los servicios de inteligencia rusos, emergió como figura central en las maniobras entre Turquía y Rusia. Según el Departamento del Tesoro, la red de Turken organizó pagos y envíos destinados a eludir las sanciones y transportar mercancías de Turquía a Rusia.', 'Georgios Georgiou, un blanqueador de capitales que según el Tesoro ha utilizado varios sistemas de blanqueo para mover cientos de millones de dólares para oligarcas rusos y ocultar la titularidad real de los fondo.', 'Artur Petrov, un ciudadano ruso que operaba una red de adquisiciones ilícitas en Rusia y en el extranjero para adquirir fraudulentamente grandes cantidades de microelectrónica sujeta a controles de exportación de los EEUU en nombre de una empresa rusa. Petrov utilizó empresas ficticias y otros medios engañosos para ocultar que los componentes electrónicos estaban destinados a Rusia, según el Departamento del Tesoro.', 'El suizo Anton Garevskikh, director general y propietario de Advanced Industrial Technologies, un proveedor de equipos industriales que trabajó con usuarios finales rusos para adquirir equipos de doble uso de proveedores europeos, estadounidenses y asiáticos.', 'La rusa Natalia Solozhentseva, ex vicepresidenta del banco ruso sancionado VTB Bank, que trabajó con la empresa emiratí ARX Financial Engineering, también sancionada, para crear empresas de inversión que gestionan activos rusos.', 'Rusia, en su intento por sostener su maquinaria bélica, ha desviado su base industrial de producir bienes para su población hacia la producción de equipo militar y maquinaria de guerra. Como respuesta a esta situación, la OFAC ha aplicado sanciones a un amplio espectro de empresas rusas involucradas en la fabricación, importación, distribución y reparación de maquinaria industrial, equipos de impresión 3D, suministros de gases industriales y otros materiales y equipos industriales. Entre ellas se encuentra Gazpromneft Catalytic Systems LLC, que según el Departamento del Tesoro fabrica agentes químicos para el refinado avanzado de petróleo en Rusia.', 'Asimismo, se han impuesto sanciones a entidades e individuos con sede en Rusia que están involucrados en la financiación, investigación, desarrollo o importación de tecnología avanzada. Esto incluye a la corporación financiera y tecnológica rusa Sistema, que es una de las mayores empresas de inversión diversificada de Rusia, cotiza en bolsa y está involucrada en los sectores de defensa, finanzas y tecnología. Sistema ha sido sancionada debido a su operación en los sectores de servicios financieros y tecnología de la economía de la Federación de Rusia.', 'El Departamento del Tesoro impuso además sanciones a siete bancos con sede en Rusia.', 'A las sanciones del Tesoro se suman otras del Departamento de Estado contra la producción energética rusa, su sector metalúrgico y minero y los fabricantes de drones.', 'Las últimas medidas contra el sector energético ruso se dirigen a una importante entidad implicada en el desarrollo, la explotación y la propiedad de un proyecto masivo en Siberia, conocido como Arctic-2 LNG, que prevé enviar gas natural licuado a los mercados mundiales. Con las sanciones, que se suman a otras impuestas al proyecto en septiembre, Estados Unidos intenta apuntar a la próxima producción energética de Rusia.', 'Washington también apuntó a los aviones no tripulados suicidas KUB-BLA y Lancet, que utilizan los militares rusos en Ucrania, sancionando a una red a la que acusó de adquirir artículos en apoyo de su producción, así como los fabricantes ZALA Aero y A Level Aerosystems CST. El propietario de las empresas, Aleksandr Zakharov, también fue sancionado, al igual que su esposa, su hija y sus hijos. Según el Departamento de Estado, Zakharov es el creador y diseñador de los drones.', 'Es la primera medida que Washington ha tomado directamente contra el avión no tripulado Lancet, un tubo gris angular con dos juegos de cuatro alas que ha sido una amenaza cada vez mayor en los frentes de Ucrania, según soldados ucranianos.', 'También se impusieron sanciones a empresas de construcción, funcionarios rusos y una empresa metalúrgica y minera que ejecutaba un proyecto para explotar el mayor yacimiento de mineral de titanio del mundo, situado en Rusia.']",[],['Estados Unidos apunta a los proveedores que ayudan a Rusia a seguir su ofensiva contra Ucrania: las figuras clave']
"['Este jueves, el comienzo de Todas las Tardes (El Nueve) se corrió levemente de la rutina tradicional. Antes de pasar a presentar los temas del día, la conductora Karin Cohen le dio pie a Tatiana Schapiro para que cuente lo que le había ocurrido horas antes de salir al aire.', '“Pasaron algunos comentarios antisemitas”, anticipó Schapiro, mientras la producción mostraba en pantalla las imágenes de la puerta de un edificio en Caballito con la estrella de David pintada en aerosol negro. “Esto está pasando en todo el mundo, no solo en Argentina, y ayer lo compartí en mis redes, reflexionando sobre algunos odios que creí que se habían terminado en la historia”, relató para contextualizar el tema. ', 'A continuación, la periodista lamentó que no fuera así y compartió con su equipo y la audiencia las amenazas que había recibido a través de las redes sociales. Primero, mostró la publicación que habría motivado los ataques. Tatiana replicó una publicación que daba cuenta, a través de un collage fotográfico, lo que ocurre actualmente en diferentes partes del mundo y lo que sucedía en 1938, en pleno apogeo del régimen de Hitler. “En Francia marcaron más de 60 casas. 819 actos antisemitas en tres semanas. ¿En serio van a ignorar esta locura?”, escribió ella acompañando las imágenes.', '“A raíz de esta publicación recibí comentarios muy ofensivos, muy despectivos, a los que respondí que nada me afecta porque estoy orgullosa de ser judía. Y eso termina en una amenaza”, relató Schapiro, antes de mostrar como prueba las capturas con la palabra del agresor.', '“Imbécil, todo lo encuadran en antisemita. No tenés vergüenza. Sionista hija de seis millones de putas”, dicen los repudiables mensajes que recibió la periodista, que replicó con palabras similares a las que había expresado al aire. “Estoy súper orgullosa de ser judía. Nada de lo que digas me ofende”. A esto, le sigue otro comentario ofensivo y amenazante. “Cuando nos crucemos en la calle vamos a ver tu orgullo. Sorete”. ', '“Gente así me amenaza a mí y a mis hijos todos los días”, señaló Schapiro, y analizó la situación más allá del mensaje personal: “Cuando hablan de seis millones hablan claramente del holocausto. Nada me asusta de la gente que escriba en las redes, pero sí me asusta que estemos viviendo esto en el mundo. Y me parece que es importante mostrarlo”, aseguró. ', '“Así como una recibe ese mensaje, recibe mil hermosos. Pero esto está pasando y hay que denunciarlo”, prosiguió, y en este sentido destacó el trabajo de la Oficina de Asuntos Comunitarios de la DAIA . “Es muy fácil denunciar: llamás por teléfono, mandás lo que pasó y ellos empiezan a hacer un seguimiento”, relató, e invitó a denunciar también en la fiscalía. “Es grave lo que estamos viviendo. Tener que explicarle a los chicos que no pueden ir con el uniforme al colegio para cuidarlos, es una locura. Es terrible lo que se está viviendo”, cerró. ', 'La semana pasada, un hombre de 34 años fue detenido en el barrio porteño de Villa Urquiza, acusado de publicar amenazas violentas contra la comunidad judía, a través de la red social “4chan”. En sus mensajes, el acusado llamó a matar niños en las escuelas judías y a asesinar integrantes de esa colectividad “al azar”.', 'Un caso similar había ocurrido días antes en San Isidro, cuando un hombre de 50 años fue detenido acusado de publicar amenazas contra la comunidad judía en la red social X, en medio de reivindicaciones a Hamas y Hezbollah. El sospechoso fue capturado por agentes del mismo Departamento de la Policía Federal, mientras circulaba en su camioneta. Dentro del vehículo, según informaron fuentes policiales a Infobae, incautaron varias armas blancas y un rifle de aire comprimido.']",[],"['Tatiana Schapiro recibió amenazas antisemitas: “Nada me asusta, estoy orgullosa de ser judía”']"
"['En su segunda temporada, La edad dorada –el peculiar intento de Julian Fellowes de canalizar los temas de Edith Wharton en clave de Downton Abbey– abandona las elevadas y literarias ambiciones y se conforma con ser el proyecto más culebrón y tonto que siempre fue. Esto la convierte en una enorme mejora con respecto a la confusa y extrañamente anticlimática primera temporada, que estableció varias líneas argumentales prometedoras y luego inexplicablemente no cumplió ninguna de ellas. Ahora La edad dorada se conoce a sí misma: se trata de una serie sobre los nuevos ricos que gastan a manos llenas, para derribar las barreras sociales que la aristocracia estadounidense intentó mantener. Hay una sencillez pasmosa en eso, y en Bertha Russell (Carrie Coon), la verdadera heroína de la serie, cuyo único deseo es lograr una forma sin complicaciones de supremacía social punitiva, y que no adquiere absolutamente ningún rasgo o dimensión adicional en la nueva temporada.', 'Esta vez, Bertha quiere un palco en la Academia de Música (no porque le guste la música, sino porque conseguir uno demostraría que lo ha conseguido). La Sra. Astor (Donna Murphy), su vieja némesis –cuyo personaje no es más que la abreviatura de “dinero viejo”–, afirma que hay lista de espera y que otras familias van por delante de ella. Esto molesta a Bertha. La temporada actual también aborda los romances de mayo a diciembre, el cáncer, la violencia racial en el Sur, las disputas entre magnates por matar a tiros a los trabajadores que protestan por mejores salarios, el regreso de la malvada criada Turner (Kelley Curran), un inventor sin escrúpulos, una sorprendente quiebra, la construcción del puente de Brooklyn e incluso Oscar Wilde. Lo que está en juego en todos estos casos, palidece en comparación con la inversión sin aliento de la serie sobre si Bertha conseguirá su palco.', 'No puedo fingir que encuentro la cuestión tan convincente como la serie, pero impulsa otras subtramas más atractivas (y, como extra, hace posibles algunos trajes muy bonitos). Los fans de la familia Brook-Van Rhijns estarán encantados; todos tienen bastante más que hacer. Ada (Cynthia Nixon) y Oscar (Blake Ritson) destacan especialmente, pero Christine Baranski también hace un trabajo sorprendente como Agnes. Denée Benton consigue por fin profundizar en el dolor de Peggy, y la tensa relación con sus padres adquiere nuevas e interesantes capas, incluso cuando empieza a triunfar como periodista trabajando para T. Thomas Fortune (Sullivan Jones). Audra McDonald hace un trabajo especialmente bueno como Dorothy, la madre de Peggy. El Ward McAllister de Nathan Lane sigue siendo, por desgracia, un poco difícil de aceptar. Pero Marian (Louise Jacobson), la ostensible protagonista de la primera temporada, se beneficia enormemente de una historia reducida pero mucho más convincente, que parece fiel a su temperamento en las formas que su romance en la primera temporada nunca tuvo.', 'En cuanto a los Russell: los niños, un dúo atractivo, sufren las intervenciones cada vez más extrañas de su monomaníaca madre; Larry (Harry Richardson) se dedica seriamente a la arquitectura, mientras que Gladys (Taissa Farmiga, que merece algo más sustancioso) esquiva pretendientes. El marido de Bertha, George (Morgan Spector), lucha contra la sindicalización de sus trabajadores en una idea que amplía el largo historial de la serie de intentar convertir a George en un despiadado capitán de la industria –del tipo que podría llevar a un hombre al suicidio– pero también (¿quizás?) en un buen hombre. Es mejor no pensar demasiado en ello y, de todos modos, la química entre Spector y Coon sigue siendo (a pesar de un par de contratiempos agradablemente resbaladizos) fuera de serie.', 'Estas subtramas más serias a veces parecen menos verdaderas narraciones que un lastre moral. Yuxtapuestas a la frivolidad de la búsqueda de Bertha, pretenden hacer que la alta sociedad parezca un poco tonta, pero el efecto es desigual; a la serie le gustan demasiado los Russell como para socavarlos seriamente. Aunque el mundo parece más grande –y a pesar de un reparto más amplio que incluye a Laura Benanti como una viuda que espera rehacer su casa de Newport, Matilda Lawler de Station Eleven como una de las mayores fans de Marian, Nicole Brydon Bloom como una heredera elegible y (lo más emocionante, para los de cierta generación) Robert Sean Leonard, que interpreta al nuevo pastor de la ciudad– la estirada sociedad en la que Bertha lucha por penetrar parece bastante más pequeña. El mundo de los “viejos ricos”, su antagonista nominal, parece tan débil que a veces parece que la pobre Sra. Astor, una cifra en sí misma, los representa a todos; con la ayuda ocasional de uno o dos amigos estirados.', 'En cuanto al personal del piso de abajo, nada supera las guerras entre mayordomos de la primera temporada, pero hay muchas cosas que gustan en ésta, incluida una encantadora subtrama relacionada con una patente. De hecho, puede que sea en el piso de abajo donde surja cierta complejidad real en torno a la clase; más de una persona al servicio en la segunda temporada resulta tener cierta experiencia en millonarios (y en tener sirvientes). Es una dinámica divertida que permite que la exploración de la movilidad social, que normalmente se limita a Bertha (y su única estrategia, el gasto), adquiera un poco más de textura y amplitud.', 'La primera temporada de La edad dorada a veces daba la sensación de repetir sus premisas de forma tan compulsiva que se olvidaba de desarrollarlas. Lo mejor que puedo decir de esta nueva temporada, además de que es divertida y de que ocurren muchas más cosas, es que no comete el mismo error.', 'Fuente: The Washington Post', '[Fotos: prensa HBO Max]']",[],['“La edad dorada” encuentra su equilibrio en una segunda temporada telenovelesca']
